2018-10-18T16:20:53,"Modern slavery affects 40 million people across the globe, including 10 million children. We must drive this abhorrent scourge off the face of the earth. #AntiSlaveryDaypic.twitter.com/kwr3ACNfbA"
2018-10-18T16:01:49,"Tackling sexual exploitation, sexual abuse and sexual harassment in the aid sector.

Free-to-use photographs from the #Safeguarding2018 summit are available to download here: https://flic.kr/s/aHskKLzfZh pic.twitter.com/6FWxWzK3iz"
2018-10-18T15:09:08,"Help needed please! My publisher has asked for endorsements for my book. If you’d like to provide one, please could you comment below. Thanks x @aaroncumminsNHS @CherylGillan @AlistairBurtUK @JWoodcockMP @theautismplan @brain_in_hand @coleyduggs @AnnaKennedy1 @MediaTutorKatypic.twitter.com/WQv7eWIGCA"
2018-10-18T15:14:15,Thank you. My publisher is looking on here so you can post straight here if that’s ok?
2018-10-18T15:17:39,"As a teacher of young people with autism @Hesnotnaughty provides invaluable insight into the issues they face and how barriers can be overcome. Essential reading for teachers, classmates and all those involved in these young people’s lives."
2018-10-18T16:36:59,"Pleased to see @mahafzaa, Minister for Education for Hashemite Kingdom of Jordan, in London again. @DFID_UK &amp; @educationgovuk officials have also been sharing expertise &amp; learnings to help the Govt of Jordan improve #education &amp; outcomes for Jordanian young people. #GlobalBritainpic.twitter.com/uNUDLmPplh"
2018-10-17T15:34:39,Winter's coming! Risk of patchy ice or hoar frost towards dawn tomorrow over highest roads through the Pennines and Eastern Fells. Gritters will be treating 5 priority routes from 1am. #StaySafe
2018-10-17T21:41:38,"Two thought provoking articles in the UK Press from #WorldFoodDay:

 #FoodPrize18 Laureates @L_Haddad and @davidnabarro argue for the importance of reforming food systems to enhance access to nutritious foodhttps://www.telegraph.co.uk/news/2018/10/16/malnutrition-staggering-global-burden-must-give-new-meaning/?WT.mc_id=tmg_share_tw …"
2018-10-17T21:48:11,Plus UK Development and Africa Minister @hbaldwin highlights DfID success funding nutrition research and announces £5m to roll out vitamin enhanced Sweet Potatohttps://www.telegraph.co.uk/news/2018/10/16/cannot-end-global-hunger-without-investing-solve-problems-tomorrow/ …
2018-10-17T21:11:26,"Hello from Des Moines! We’re live at #FoodPrize18. 

We’re especially delighted to be here as we celebrate two British scientists Drs. @l_haddad and @davidnabarro, selected as the 2018 World Food Prize Laureates for their work in improving maternal and childhood malnutrition.pic.twitter.com/zayI919Rnz"
2018-10-17T21:07:26,Good news for CBC and Beds Borough from the Regional allocation of adult social care winter funding - details on my Facebook post  https://www.facebook.com/174852262702077/posts/949558138564815/ …
2018-10-17T19:33:40,It’s so important to support our young carers. Thank you for your support tonight and throughout the year.https://twitter.com/CarersInBeds/status/1052573207121850369 …
2018-10-17T19:52:45,Couldn’t come from a better friend of the U.K. @eevriviadeshttps://twitter.com/eevriviades/status/1052594141731815424 …
2018-10-15T13:35:00,"Since 2011, #UKaid has supported 34 million people to cope with the effects of climate change and improved access to clean energy for 12 million people 

#GreenGB #climatechange #cleanenergypic.twitter.com/EPL1LJmsLd"
2018-10-16T21:36:02,Excellent result and performance against a tough St Ives side. Our back 4 were outstanding (again). Now the only unbeaten side at our level.  Happy Wader tonight.
2018-10-16T21:49:45,"Uncharacteristically unworthy of you, Jacob.https://twitter.com/Jacob_Rees_Mogg/status/1052273088421875712 …"
2018-10-16T13:50:42,"Saddened to hear of train accident in Bouknadei between Rabat and Kenitra in Morocco. On the UK’s behalf, my condolences and sympathies to all those affected."
2018-10-16T10:48:01,Proud to announce a new £12m GBP education partnership with @UNICEF_Egypt that will help the Egyptian government to turn its education reform vision into a reality.
2018-10-14T12:00:44,"In Cairo supporting Egyptian youth with education &amp; entrepreneurship, by:
Marking 80 years of @BritishCouncil Egypt;
Launching a EGP30m programme for entrepreneurs;
Promoting UK education investment; and
Celebrating UK-funded @StartEgypt’s first birthday.

Stand by for more...pic.twitter.com/wMVtwwPl6H"
2018-10-13T21:24:44,"Great to meet Tunisian Ministers for Education @HatemBenSalem &amp; Industry @slim_feriani. Visits show UK’s close relationship with Tunisia. Education key to development &amp; prosperity, &amp; with Tunisia’s investment potential I’m excited for their youth &amp; our New Economic Partnership.pic.twitter.com/R3LbDNNorv"
2018-10-13T17:37:55,"Honour to practise with Mauritanian women on football pitch. They demonstrated athleticism, leadership and determination. Maybe we can return with @Lionesses?! @soubettepic.twitter.com/ryBpDe5Ig2"
2018-10-13T12:09:00,Very saddened by report of Palestinian mother’s death by stone throwing in the West Bank yesterday. Another family left to grieve in this useless cycle of violence.
2018-10-13T11:03:52,"Great to meet Minister of Petroleum, Energy and Mines again. Exciting potential in Mauritania; British companies ready to make substantial contribution and develop our trade links.pic.twitter.com/0Eq5a5v6ha"
2018-10-13T08:37:36,Very pleased to welcome @ryanhenson87 as Conservative PPC for Bedford and Kempston. Very much look forward to working with you #Conservatives #Bedfordshire
2018-10-13T06:51:04,Grateful for an excellent meeting with President Aziz. Pleased to share our plans to develop UK presence here as we strengthen our relationship.  pic.twitter.com/pVV8VcdRHC
2018-10-12T22:30:05,"The number of children without vaccinations has increased since 2001, new CDC reports findhttps://ti.me/2CFhNZh "
2018-10-12T12:25:58,"Delighted to be back in #Mauritania to mark the May opening of first-ever British Embassy in Mauritania, and see our new Residence. Great opportunity to strengthen our bilateral relationships, especially in trade &amp; business. Look forward to seeing what more can be done together."
2018-10-11T13:09:45,HEART Academies Trust: I have had conversations this week with representatives from the Trust and Local Governing Body of Shortstown Primary School. Please see my website for an update.https://www.alistair-burt.co.uk/news/heart-academies-trust-restructuring-proposals …
2018-10-10T22:18:15,"Great Building and worthy winner 
Foster &amp; Partners' Bloomberg HQ wins RIBA 2018 Stirling Prize https://www.dezeen.com/2018/10/10/foster-partners-2018-stirling-prize-bloomberg-building-architecture/ … via @dezeen"
2018-10-10T10:12:49,"Tunisia is a young democracy and keen to keep its preferential status as a destination for business and tourism - UK tourism numbers are up 340% year on year, says HE Nabil Ben Khedher, Tunisian Ambassador to the UK https://bit.ly/2KQtAIw  #Tunisiapic.twitter.com/yfwNUFC54G"
2018-10-10T11:02:57,"Tunisia offers a multi-lingual, highly educated and skilled labour force and is strategically located, offering access to markets of a couple of billion people, according to HE Dr Slim Feriani, Minister of Industry and SMEs, Energy, Mines and Renewables https://bit.ly/2KQtAIw pic.twitter.com/LNbHrYDVZn"
2018-10-10T13:09:18,"Tunisia has done an excellent job since 2011 - the rate of progress is staggering - and it has become a beacon of hope in the region, says Dr Andrew Murrison MP, Prime Minister’s Envoy to Tunisia https://bit.ly/2KQtAIw  #Tunisiapic.twitter.com/fzBXX6itoP"
2018-10-10T19:10:18,"Wow! What a day! A huge THANK YOU for taking part in #HelloYellow! 

Thousands of schools, orgs and individuals have helped show young people they're not alone with their mental health, and raised vital funds to support our work! 

Together, let's keep making a difference!pic.twitter.com/v0UKxztQuS"
2018-10-10T12:34:17,"Too many children have been traumatised by war. Together we can help more children like Stephanie. 

#UKaid will double all donations made to @WarChildUK's #LearnToLive campaign up to £500,000 through our #AidMatch initiative. #WMHD2018https://twitter.com/WarChildUK/status/1037652805220270082 …"
2018-10-10T17:15:00,"Mental health conditions are on the rise and people in the world’s poorest countries often don’t get the support they need.

#UKaid is providing funding to @WarChildUK and @HI_UK to change this. #WorldMentalHealthDay #AidWorkspic.twitter.com/DKae1ldqJq"
2018-10-10T18:45:00,"On #WorldMentalHealthDay, the UK is proud to be providing psycho-social support to Syrians affected by the conflict within the country and around the region.

UK aid is helping those who have suffered from some of the worst acts of brutality to rebuild their lives.pic.twitter.com/pLTbOeFK1G"
2018-10-10T07:30:09,Don't forget that there is only a week left to show your support for the redevelopment of Biggleswade Station. Please send emails of support to alistair.burt.mp@parliament.uk More information on my website:http://ow.ly/3Phc30m9Xjp 
2018-10-09T11:33:30,"Incredibly moved to see ‘Nazanin’s Story’ last night. Huge credit to the producers, cast &amp; Richard Ratcliffe for bringing to life just how much this extraordinarily brave family have been through. All the more reason to continue the battle to bring Nazanin home. #freenazaninpic.twitter.com/Qdk9Q1jarP"
2018-10-09T14:29:00,"""I think the Sustainable Development Goals are the last best hope for mankind"" 

@stephenfry gives his thoughts on the @UN #GlobalGoals
#UNGA @GlobalGoalsUNpic.twitter.com/5GCLNxdUee"
2018-10-08T15:05:36,"Colonel the Right Honourable Mark Lancaster TD VR MP Minister of State for the Armed Forces addressed the Ship's Company, Embarked Military Forces and the Joint Planning Staffs of @hms_albion in Oman #SaifSareea3 #SS3 @UKinOman @DefenceOps @MarkLancasterMK #mondaymotivation #Navypic.twitter.com/gSl6DbN01r"
2018-10-09T18:41:10,"""Embracing diversity doesn't mean giving up to our identity. On the contrary it means being true to our identity, to our culture"" @FedericaMog at #FBM2018 @Book_Fairpic.twitter.com/kkPCNHmHNP"
2018-10-09T18:28:36,"""We finally embraced our diversity as the true strength of European culture and European identity"" @FedericaMog at #FBM2018 @Book_Fairpic.twitter.com/NcHZJHm6gY"
2018-10-09T17:07:47,"#EUCulturalRelations in the spotlight at the world's largest @Book_Fair, the Frankfurter Buchmesse https://europa.eu/!NQ93WT pic.twitter.com/NqNZWLs19Y"
2018-10-09T18:50:18,.@PennyMordaunt: We’re 200 years adrift on ending extreme poverty. If we want to deliver the Global Goals we have to let others help - including the private sector.
2018-10-09T16:58:14,"@alistairburtuk @hbaldwin, Hi, please could you help us spread the word of how we are working with the @DECappeal to support people of Sulawesi. Please share/retweet quoted tweet.https://twitter.com/IslamicReliefUK/status/1048228636191543297 …"
2018-10-09T18:53:49,"A healthy &amp; educated population is the foundation for growth &amp; development. 
#UKaid funded health research &amp; commitment to #SDG3, as championed at #HSR2018 in Liverpool this week, will help the poorest &amp; most marginalised around the world access essential health servicespic.twitter.com/B61tCdB863"
2018-10-09T14:27:32,"Biggleswade Station - One Step Closer to Redevelopment:
https://tinyurl.com/y9qcru9a pic.twitter.com/9q64xIrXBG"
2018-10-08T20:16:40,A second Brexit poll is a bigger risk than leaving. Superb by @robertshrimsley for the @FT on the madness of a re-run.https://www.ft.com/content/bad4d6e4-cad2-11e8-9fe5-24ad351828ab …
2018-10-07T20:03:16,Her local party will back her - they love her. She’s one of the very best MP’s I look up to and learn from. Her moral courage is second to none.https://twitter.com/sarahwollaston/status/1048871061109047296 …
2018-10-08T08:40:12,"I  am concerned to hear about plans to change the leadership at Shortstown school and others in the HEART Trust. I am making urgent enquiries with the Trust &amp; the Governing body, to see what options there may be to resolve the situation, which has clearly caused serious upset."
2018-10-07T16:07:27,"The stories I have heard today from women leaders in higher education in Oman have been hugely motivating. They are part of a growing and thriving UK alumni, working to prepare young Omanis for the workplace with the assistance of the @BritishCouncilpic.twitter.com/vdstvdhpPN"
2018-10-07T12:53:46,Strongly condemn the murder of two Israelis in the West Bank today. My thoughts and prayers are with the victims’ families
2018-10-07T11:14:37,"Pleasure to see @badralbusaidi from @mofaoman today for the UK-Oman Joint Working Group - an important opportunity to discuss our partnership on issues like trade and education, and wider regional issues such as Yemen, Syria and the GCCpic.twitter.com/y6J1HEjy0O"
2018-10-07T06:15:21,Another child killed by Israeli fire during protests in Gaza. Children should not be targets. Real efforts are needed to break this cycle of violence - Hamas must engage in reconciliation for the sake of the people of Gaza
2018-10-06T19:20:34,In truth Iain most of us could find 2500 words too- and even they would not be enough. And I’m sure those @BuryGSOldBoys could say the same. Thanks.https://twitter.com/IainDale/status/1048619559102664704 …
2018-10-06T17:42:57, REPORT: Read our Match Report from today's 2-2 draw with @mansfieldtownfc  #buryfchttps://www.buryfc.co.uk/news/2018/october/match-report-for-bury-vs-mansfield-town-on-06-oct-18/ …
2018-10-06T14:53:23,Today coaches from @O_BournemouthFC have been training @OmanFA coaches. The skills they are learning will hopefully enable them to discover and create the next generation of @BedsFA players ...pic.twitter.com/Laexy8fPBA
2018-10-05T15:42:59,17.5 tonnes of #UKAid supplied have arrived in Indonesia to support those affected by the devastating #Earthquakehttps://twitter.com/DefenceHQ/status/1048222558070480900 …
2018-10-06T09:44:09,“This is where #UKaid is doing what it does best – saving and changing lives – both in the immediate aftermath of disasters and longer term”  - @PennyMordaunthttps://www.theguardian.com/commentisfree/2018/oct/05/britain-response-indonesia-earthquake-international-aid-tsunami …
2018-10-06T09:41:50,First #UKaid arrives into Palu to help vulnerable Indonesians. We've sent 120 shelter kits to the city which can each provide immediate protection to a family of 5. More #UKaid is on its way.pic.twitter.com/3N4PqfGFUh
2018-10-06T09:44:52,The first #UKaid has reached Palu to provide shelter to those in desperate need - thanks to the @NZAirForce for flying it in on a C130 plane from Balikpapan #IndonesiaEarthquakepic.twitter.com/OOXGWtPxHE
2018-10-06T13:59:46," Before today's game, we will be holding a minute's applause in memory of lifelong Shaker Ian Doody, who sadly passed away as Bury were playing Carlisle United. The thoughts of everyone at the club are with Ian's loved ones. 

#onceashakeralwaysashaker"
2018-10-02T16:10:49,"Desperately sad news. The wonderful Michael Freedland, who was as inspiring a man as he was a writer and broadcaster, died suddenly yesterday. I was thrilled to bring him back into @JewishChron when I became editor. Typically, he filed a piece for next week early and perfectly."
2018-10-06T08:00:27,"Hare coursing can have devastating impacts for farmers. Linked to criminal damage, violence and intimidation, we need to stamp out this crime. You can give information 100% anonymously to our Rural Crime Reporting Line #BeACrimestopper http://www.nfuonline.com/crimestoppers pic.twitter.com/rYPGpUFfue"
2018-10-06T08:16:18,I think you’ll enjoy the start of #FootballFocus today https://twitter.com/BobWilsonBWSC/status/1048485271707242496 …
2018-10-06T07:36:34,"Lovely to be back in Oman - a beautiful country with a crucial role to play in the Gulf. Thousands of UK Military personnel are deployed in Oman for #SaifSareea 3, sharing experience in support of @theresa_may’s 2016 promise that “Gulf security is our security”pic.twitter.com/AXZI7mKpzC"
2018-10-05T12:00:45,Thanks for your tweet. The DEC &amp; its members are independent charities. We rely on the generosity of the British public to help fund emergency relief operations overseas and work with local partners during disasters such as this.
2018-10-04T16:56:37,"Here's @PennyMordaunt, Secretary of State for @DFID_UK announcing that the UK Government will match donations to our Indonesia #Tsunami Appeal up to £2 million! Let's save the survivors. Donate now http://bit.ly/dec-tsunami pic.twitter.com/U6UaEAI12w"
2018-10-05T18:30:16,"When emergency strikes, the safety and wellbeing of children is our first priority.

We're working with local social workers to find unaccompanied and separated children following the devastating earthquake and tsunami in #Indonesia.https://uni.cf/2DZch5d "
2018-10-05T16:39:30,"Congrats to @NadiaMuradBasee on winning the @NobelPrize for peace! 

Nadia told her story to the #UN Security Council in Dec 2015. It was powerful, emotional and diplomats applauded her.

Watch Nadia in #UNSC - https://tinyurl.com/y7qbsncg 

Read about it here: https://tinyurl.com/yb6zbvxe pic.twitter.com/YU6VhcS1u5"
2018-10-05T16:54:30,"President @BarhamSalih receives at his premises in #Baghdad, UN Women Representative in #Iraq @dinazorba where they discussed the participation of women in political and economic leadership in the country.pic.twitter.com/NS0FsjTHJb"
2018-10-05T14:30:29,It was a real pleasure to meet Nobel Peace Prize winner @NadiaMuradBasee at #UNGA last year. She and @DenisMukwege have led groundbreaking work on preventing sexual violence in conflict. This honour is a testament to that. #TimeToActpic.twitter.com/skJOX48G3W
2018-10-04T15:55:09,"From the Lake District to Laugharne, @VisitBritain share the most poetic corners of the country, which inspired the works of our greatest writers: http://ow.ly/hMnI30m6c2H  #NationalPoetryDay #CultureIsGREATpic.twitter.com/d5xzf0pflb"
2018-10-03T16:40:36,"Congratulations to new Iraqi President Saleh &amp; PM-designate Abdul Mahdi, and people of #Kurdistan Region of #Iraq on parliamentary election. Look forward to working with Government of Iraq &amp; Kurdistan Regional Government to deliver stability, security &amp; prosperity for all Iraqis"
2018-10-03T10:39:40,Easily the most talented Tory of recent years. Just a shame that the European issue reached its peak just as Clarke reached his. Another great @steverichards14 lecture.https://twitter.com/steverichards14/status/1047402495134326785 …
2018-10-03T15:01:01,"Over 1,000 schools are feared to have been damaged or destroyed by the deadly earthquake and tsunami that struck #Indonesia.

@unicefindonesia is on the ground, working with the government to support the 1.5m potentially affected people.

Learn more → https://uni.cf/2y1mNUb pic.twitter.com/C7lOTbxoZK"
2018-10-02T17:45:00,DFID in the news - latest update on the UK’s response to the earthquake and tsunami in Indonesia: http://ht.ly/BzOU30m4hQV pic.twitter.com/gVtHCZrn3P
2018-10-03T04:30:04,DFID is the top global donor to the UN Emergency Response Fund – 20% of all contributions in 2017 – and we are proud that they are committing $15 million to the Indonesia earthquake response @UNOCHA @UNCERF
2018-10-02T17:10:00,#UKaid is already supporting the earthquake and tsunami relief efforts in Indonesia through our funding to the International Red Cross movement (@federation): http://ht.ly/BzOU30m4hQV pic.twitter.com/qR1nWLwXzZ
2018-10-03T11:36:34,".@theresa_may: The compassion of our NHS staff, the dedication of our teachers, the bravery of our police, and the matchless courage of our armed forces. Don’t let anyone tell you we don’t have what it takes: we have everything we need to succeed. #CPC18"
2018-10-03T11:36:58,".@theresa_may: And in 2022 we will put the best of British creativity and innovation, culture and heritage on show in a year-long festival of Great Britain and Northern Ireland.  #CPC18"
2018-10-03T11:36:33,"LIVE: #TheresaMay on Brexit negotiations: ""If we hold our nerve, I know we can get a deal that delivers for Britain.""http://bit.ly/2y8JcOz "
2018-10-03T11:34:58,This is a good speech.
2018-10-03T11:31:14,PM says “hundreds of thousands of jobs in just in time supply chains” will be protected by her Brexit proposal
2018-10-03T11:30:42,"PM pleads with her party on Brexit: “Even if we do not all agree on every part of this proposal, we need to come together”"
2018-10-03T10:54:46,The Special Envoy continues his shuttle diplomacy and is heading to Abu Dhabi today. He will meet the leadership of the Southern Transitional Council and Emirati senior officials. They will discuss confidence building measures and resumption of the peace process in #Yemen
2018-10-03T11:06:54,"This is May’s best speech since the steps of Downing Street so far. Couple of reasonable jokes, generous to Mogg and Abbott, praises Labour’s heirs to Attlee and co “but not on the front benches”"
2018-10-03T10:58:37,An unexpectedly funny and then beautiful opening.
2018-10-03T11:00:09,There’s a fiver with your name on it!https://twitter.com/LadPolitics/status/1047440732561268736 …
2018-10-03T10:50:56,What on earth have we been doing hiding away this gifted speaker? This is brilliant. Vote Geoffrey! Next leader has spoken!!https://twitter.com/paulwaugh/status/1047436847314558977 …
2018-09-28T21:09:43,I am proud to be the first woman ever elected in #Eddisbury and to have been returned in 2017 by my electorate with the biggest vote share in the history of the constituency. My constituents know I am prepared to put their interests before my career.  I will not be bulliedhttps://twitter.com/brightsider123/status/1045748825548361729 …
2018-09-29T19:35:11, iFollow: Manager Ryan Lowe reacts to the 2-1 victory against @ColU_Official  #buryfchttps://www.buryfc.co.uk/news/2018/september/ifollow-video-we-looked-good-in-the-attacking-half/ …
2018-09-29T16:33:46,"This week at the UN I met with representatives from every one of the 20 countries &amp; territories I cover in @foreignoffice and @DFID_UK, plus UN special envoys and UN humanitarian leads. #UNGA remains a vital forum for discussing global issues that require a global solution.https://twitter.com/UN/status/1045675609597399041 …"
2018-09-29T14:06:45,Deeply concerned by developments that have led to the withdrawal of US diplomats from their Consulate in Basra. UK stands with US against any threat to the safety of their staff. UK condemns all violence or threats against diplomatic missions in Iraq.
2018-09-29T10:34:21,".@PennyMordaunt: My thoughts are with those affected by yesterday's devastating earthquake and tsunami in Indonesia which has left hundreds dead and many more without power and shelter. We are closely monitoring the situation, and the UK stands ready to assist."
2018-09-28T21:01:19,"“Conservative Party needs to rally round Theresa May to strengthen UK’s negotiating position with EU” Agree 58%, Disagree 17%, DK 25%"
2018-09-29T10:39:30,"A little word of warning to the assorted low lifes trying to target @NickyMorgan01 @Sandbach @sarahwollaston and others: you obviously don't have much experience of dealing with strong Tory women. Like the Lady, they are not for turning.https://twitter.com/andywigmore/status/1045616421567451136 …"
2018-09-29T10:56:58,Pathetic. Stay out of our party Mr Wigmore. Nicky Morgan’s worth a dozen of you.https://twitter.com/andywigmore/status/1045616421567451136 …
2018-09-28T11:05:30,Adverts threatening the position of MPs elected and re-elected are anti-democratic and desperate - as @BrandonLewis &amp; @Conservatives have made clear there is no place for you in our Party
2018-09-28T03:33:53,"A great handle - one for all fans of #nonleaguefootball.

Do you follow @AlistairBurtUK?https://twitter.com/NonLgeProgs/status/1045393727492116483 …"
2018-09-28T17:41:47,I welcome today’s adoption of UK-drafted resolution at Human Rights Council @UN_HRC condemning appalling human rights situation in Syria. Reflects broad international agreement that the Asad regime’s crimes cannot be ignored or forgotten.
2018-09-28T16:34:53,Discussing challenges to press freedom and the safety of journalists. #FreeThePress #UNGAhttps://twitter.com/UKUN_NewYork/status/1045711724777738240 …
2018-09-28T15:46:23,Pleased to attend the @GPtoEndViolence board meeting today to discuss tackling violence in schools around the world to ensure all children can be educated in a safe environment. @DFID_UK is working with @UNICEF and others to tackle this important issue. #UNGA #ENDviolencepic.twitter.com/hhjBTzT8jQ
2018-09-27T22:00:06,"The UK remains unequivocally committed to @UNRWA, for whom we have consistently been a top five donor. In 2018, we increased our planned support by 60% to continue meeting immediate needs. It is vital others follow our lead #UNGA"
2018-09-27T17:22:24,"Pleased to discuss Iraq at #UNGA today. Looking forward to continuing our work towards a strong stabilisation partnership between the Iraqi Government and the international community. The Iraqi people deserve a bright, prosperous future.pic.twitter.com/G306QsaLe8"
2018-09-26T23:49:31,"4 in 5 refugee crises last over 10 years. This has a devastating impact on children’s education. 

That’s why Global Compact commitments on quality education are so critical. The UK is committed to improving learning outcomes for the most marginalised.

#RefugeeEducation #UNGApic.twitter.com/tDAKlCXzSW"
