2018-09-07T15:06:39,"""I would like to wish Jewish people across the United Kingdom and around the world a happy, peaceful and prosperous #RoshHashanah. As the Jewish New Year begins, I want to renew my unwavering vow to stand by our Jewish community now and for the years to come."" – PM @theresa_maypic.twitter.com/OuGFRu78bl"
2018-09-07T17:33:05,"A full-scale military offensive in Idlib will not only kill many more civilians, medical and humanitarian workers, it will overwhelm the capacity of the city to cope &amp; create a humanitarian emergency not yet seen in this terrible terrible conflict.

~@AmbassadorAllen #EyesOnIdlibpic.twitter.com/lA10k4V6KW"
2018-09-07T16:01:02,"""There are more babies in Idlib than there are terrorists - that should give those engaging in military action pause for thought.""

~@KarenPierceUN speaking at #UNSC on #Syria
#EyesOnIdlibpic.twitter.com/ckY5upDB1Y"
2018-09-07T07:15:05,"Busy constituency day today, starting with a regular MP's meeting at Central Bedfordshire Council to catch up on a range of issues affecting the constituency. @letstalkcentral"
2018-09-06T18:46:29,"Delighted that my first act today was to meet and present a copy of my Credentials (as called in diplomacy) to HE the Lebanese Foreign Minister. 

Now to work. There is a lot for UK and #Lebanon to do together and build onpic.twitter.com/7GyBevjF1U"
2018-09-06T20:48:57,"""I find it unconscionable that after all these years, in the 100th anniversary year of the end of the First World War, that any government can even think of using chemical weapons against its own people.""

Ambassador @KarenPierceUN at #UNSC briefing on #Syria #ChemicalWeaponspic.twitter.com/hyiDqXJcc5"
2018-09-06T18:35:11,"Following the recent car break-ins in the Kings Reach area of Biggleswade, I have received a useful update from our local police:http://ow.ly/NFVQ30lHYYs "
2018-09-06T17:28:06,"Today I met His Highness @ABZayed and Her Excellency Reem al Hashimy. We discussed the excellent UK-UAE relationship and important global issues, including Yemen, Libya and Pakistan. The breadth of His Highness’s visit this week demonstrates the strength of the UK-UAE partnershippic.twitter.com/piuX2ZMglI"
2018-09-05T23:21:39,"We will, but first we will all say ‘thank you John’ for a magnificent job in Cairo, where your affection for Egypt &amp; the Egyptian people has enhanced the U.K./Egypt relationship immensely. @foreignoffice indebted.https://twitter.com/JohnCassonUK/status/1037383898165063680 …"
2018-09-05T22:49:22,"“To restore stability to #Libya, there is an urgent need to establish strong and unified civilian and military institutions, which work for the benefit of all citizens”https://twitter.com/UNSMILibya/status/1037459683248951296 …"
2018-09-05T18:01:03,Very pleased to see great collaboration between world-leading experts on #ageing research during UK-Israel conferences in London this week. Congratulations to all involved #BIRAX @ukinisrael @ilBritish @BritishCouncil @KingsCollegeLon @DavidQuarreypic.twitter.com/e0h6QQlEmv
2018-09-05T10:53:46,Alarming reports of Russia airstrikes  in NW Syria with numerous media outlets stating civilian casualties. The protection of civilians is paramount. A humanitarian catastrophe in Idlib must be avoided - the lives of 3 million people are at stake
2018-09-04T22:12:19,"Welcome the efforts of the UN Support Mission and Special Representative Salame to bring an end to the violence in Tripoli. UK, Italy, France and US have issued a statement calling on all parties to end the fighting and support the political process.https://bit.ly/2wK5Iwt "
2018-09-04T19:13:29,Today I announced an additional £7 million of #UKaid for @UNRWA. This helps ensure Palestinians can continue to access vital healthcare and education. The international community must follow our lead and step up support to ensure vital services aren’t interrupted.
2018-09-04T15:17:18,"Last week’s visits ended with a day in Paris: a chance to speak with Minister of State @JBLemoyne about Middle East issues, interesting conversation with @UNESCO on their work &amp; quick catch up with new Centre de Crise Director, Eric Chevallier. Back in UK now for la rentréepic.twitter.com/zc66GRcUUF"
2018-09-03T17:38:15,Weekend in Tehran - I had useful conversations with Deputy Foreign Minister Araghchi on the nuclear deal &amp; wider regional issues. I also continued to press the case strongly on our dual national consular cases
2018-08-31T18:35:57,"Whilst in Dhaka this week I visited a @DFID_UK @WSUPUK 
partnership which has improved health and well-being for low-income residents through improved #water and #sanitationhttps://twitter.com/UKinBangladesh/status/1035056120467836928 …"
2018-08-30T09:54:04,We're honoured to welcome @AlistairBurtUK &amp; @AlisonBlakeFCO at @icddr_b today and share our work on maternal &amp; #childhealth and humanitarian response to the Forcibly Displaced Myanmar Nationals (FDMNs) in the #Rohingya camps. http://flic.kr/s/aHskH6B8FW  #healthpic.twitter.com/8uGC0bV49R
2018-08-30T18:06:25,"On this International Day of the Disappeared I want to commend the work of  @TheICMP @KatBomberger &amp; their dedicated team. Without them there would be less closure, less hope and a hush from the otherwise voiceless. Read their stories.https://twitter.com/TheICMP/status/1035105417402179584 …"
2018-08-30T17:47:00,"Going to university is almost unimaginable for refugees.

Only 1% enroll in tertiary education compared to 37% of youth globally. #TurnTheTide http://www.unhcr.org/turnthetide/ pic.twitter.com/os5eSNgKMt"
2018-08-30T12:01:48,As this protracted crisis moves into another year the UK will continue working with the government of Bangladesh and our partners to deliver life-saving solutions for the #Rohingya people.https://twitter.com/DFID_UK/status/1035105000022859776 …
2018-08-29T16:30:16,Thank you @AlistairBurtUK for visiting one of Save the Children's child friendly spaces in Cox's Bazar. We're enormously proud to be working alongside @DFID_UK to deliver life-saving #UKAid to #Rohingya children and their families.pic.twitter.com/6hfIpNZgNR
2018-08-29T17:53:46,"Today, at Kutapalong refugee camp in Cox's Bazar, I saw first hand how the UK and it's partners are responding to the humanitarian crisis. #UKaid is helping to meet the urgent needs of Rohingya including food, shelter, clean water, health and sanitation.pic.twitter.com/yk3ni87Qsl"
2018-08-29T17:03:38,"Lack of soap &amp; water for handwashing puts the health of all people – especially young children – at risk for diseases, such as diarrhoea

#WWWeek pic.twitter.com/cw1WM5CKf5"
2018-08-29T16:00:51,"6 in 10 people worldwide, or 4.5 billion, lack safely managed #sanitation 
#WWWeek pic.twitter.com/2irX7pBrwk"
2018-08-29T15:24:36,"It`s World Water Week 

DYK: 2.1 billion people lack safe drinking water at home , more than twice as many lack safe sanitation 
#WWWeekpic.twitter.com/ZzPwl5jVhx"
2018-08-28T16:26:31,"""To echo the words of the US and France, the UK also will respond appropriately if the Asad regime repeats its illegal use of chemical weapons that has already had such devastating humanitarian consequences for the Syrian population.""

Ambassador @KarenPierceUN | #UNSC #Syriapic.twitter.com/SfFHqJHR8P"
2018-08-28T18:15:00,"Theresa May: ""I want to be clear: foreign aid works""
#UKAfrica #UKaid #AidWorkspic.twitter.com/d1GHrEXaCC"
2018-08-29T10:44:26,All our thoughts and prayers with Nazanin and her family today. Unbearable suffering to be apart from daughter with her hopes raised then dashed. We must redouble efforts to find a way to get her home #FreeNazanin
2018-08-28T14:45:18,I am delighted to see that @GNRailUK are going to extend the compensation scheme to non-season ticket holders. A small victory to long suffering rail users. More details are available on my website:http://ow.ly/A1u730lAskM 
2018-08-28T12:10:51,On my return to the UK I will be speaking to the @CommonsIDC &amp; will give an account of how #UKAid is providing the Rohingya people with some form of future. We are taking a leading role in driving the agenda forward &amp; prioritising long-term support. #AidWorks
2018-08-28T12:02:19,I have arrived in Bangladesh just days after the first anniversary of this man made crisis. Whilst here I will see how life-saving #UKAid is making a difference to the persecuted Rohingya people who have been driven from their homes.
2018-08-26T11:06:00,"The camps in Cox’s Bazar in Bangladesh are experiencing the heaviest monsoon rains in years. More than 200,000 people are at risk. 

This is how #UKaid is helping to relocate Rohingya refugees to safer areas through our partner @Refugeespic.twitter.com/zMZEXEuQkJ"
2018-08-26T00:32:02,"Deeply saddened by passing of John McCain, warrior, statesman, senator, husband, father, friend and moral tribune. A great man has been taken from us just when we most need his courage, valor, and integrity. May the memory of who he was and what he stood for be preserved forever."
2018-08-25T16:42:11,This show articulates how I feel about my mum better than I ever could. The team behind it have earned every word of praise. This is the icing on the cake.https://twitter.com/MusicalTheatreR/status/1033383197323735040 …
2018-08-24T21:27:35,"To protect #Rohingya children, adolescents and adults, WHO and partners organized vaccination campaigns to prevent:
cholera
polio
measles
rubella
diphtheria
tetanus
#VaccinesWorkpic.twitter.com/DoK6ktjQlq"
2018-08-24T20:10:07,"In the last year in Cox`s Bazar #Bangladesh, WHO &amp; partners established:
 
155 health posts
60 #PrimaryHealthCare facilities
11 secondary care facilities.
 
All these efforts to protect the health of thousands of #Rohingya people http://bit.ly/2o5gVDU pic.twitter.com/kb24UxoBfk"
2018-08-24T10:31:17,"It`s been a year since the beginning of the #Rohingya crisis. Major outbreaks were averted, thousands of lives saved, but nearly one million Rohingyas in Bangladesh continue to be vulnerable.
http://bit.ly/2P3k7eC pic.twitter.com/LKYxvbOhT6"
2018-08-24T12:12:36,"One of the greatest privileges of my job is meeting the UK’s humanitarian heroes. People from every part of the country, who save lives around the world, and build their own knowledge and capabilities to protect our British citizens back home. https://twitter.com/DFID_UK/status/1032928960756232194 …"
2018-08-24T07:18:07,Proud moment. I asked @asda to use the packaging on their own brand menstrual products to deliver health messages to women. They agreed and have now hit the shelves! Politicians and business working together @asdadewsbury @asdatickledpink @APPG_WHpic.twitter.com/XRKfuU4wlJ
2018-08-24T21:18:56,"We must have a good, sensible, practical outcome in March 19 for people like @grahamsphillips - just getting on with a vital job for the public, no political side, just seeing &amp; saying pharmacy as it is for those they serve.https://twitter.com/grahamsphillips/status/1032907234232205312 …"
2018-08-24T20:26:31,"More than 720,000 stateless Rohingya refugees, fleeing violence in Myanmar’s Rakhine State, have found safety in Bangladesh. UNHCR urges renewed international engagement and supporthttps://trib.al/Y33FIeT "
2018-08-24T09:14:33,"Today marks the 1st anniversary of Kofi Annan’s Commission recommendations for #Rakhine. 

The UK remains determined to see it implemented in full, and for safety, dignity, and justice for the #Rohingya and all communities in #Rakhine.https://www.gov.uk/government/news/minister-field-statement-on-the-anniversary-of-the-rohingya-crisis …"
2018-08-24T16:19:51,One of the great politicians of our time nears the endhttps://twitter.com/cindymccain/status/1033007621156962304 …
2018-08-24T10:17:12,"1 year

The largest refugee camp in the world.

WFP is grateful to @dfat, @CanadaDev, @eu_echo, @francediplo, @MofaJapan_EN, @MofaKuwait_en, @MFA_Lu, @NorwayMFA, @mfa_russia, @SwissHumAidUnit, @KSAmofaEN, @USAID, @DFID_UK for their life-saving support to #Rohingya families.pic.twitter.com/vXi0NH6FAP"
2018-08-24T17:55:17,Such sad news about a deeply honourable man.https://twitter.com/MeghanMcCain/status/1033006388732022785 …
2018-08-24T16:12:24,Deeply concerned about emerging media reports that a number of civilians were killed yesterday in Al-Duraihmi in Yemen. I urge all parties to do everything possible to protect civilians and respect international humanitarian law.
2018-08-23T19:20:35,"""Let us continue to work together to develop and nurture in future generations a culture of human rights, to promote freedom, security and peace in all nations""Kofi Annan

#UNSC members observe a minute of silence in honour of the passing of Former Secretary-General Kofi Annan.pic.twitter.com/hXD29lQn2r"
2018-08-24T07:44:34,"Chaired @UN Security Council in New York discussing the progress made in countering Islamic extremism &amp; Daesh. Military victory in sight, but much much more to do if we are to win the peacepic.twitter.com/5DUDRMNCRe"
2018-08-24T07:45:00,"The camps in Cox’s Bazar in Bangladesh are experiencing the heaviest monsoon rains in years. More than 200,000 people are at risk. 

This is how #UKaid is helping to relocate Rohingya refugees to safer areas through our partner @Refugees
#aidworkspic.twitter.com/ErkPo8Bk2M"
2018-08-24T07:47:24,"Where immunisation levels are low, it is far more likely that an outbreak will spread, with serious consequences for those who cannot be vaccinated and who are at far higher risk. #CommunityImmunity helps protect the most vulnerable"
2018-08-24T07:38:19,"Important thread from @louiseckenny Measles is not a harmless childhood illness. MMR uptake in #Totnes remains lowest in Devon, &amp; has been historically low, leaving community especially at risk.https://twitter.com/louiseckenny/status/1032011734998024192 …"
2018-08-24T07:49:01,"If you are the only adult living in your property, we will reduce your Council Tax by 25%. Apply for your discount today http://bit.ly/single-persons-discount …pic.twitter.com/KXW5hTaY96"
2018-08-23T21:11:27,"We must press on with military operations against Daesh. 

British forces continue to play their part as members of the global coalition and UK leads in a vital area of strategic communications against Daesh.

 @Jeremy_Hunt | #UNSC #Terrorismpic.twitter.com/GvWSKpGo3O"
2018-08-23T09:44:39,"It’s also worth observing that if any Conservative  “Remainer” MP had written to all Assoc chairs in the way @Jacob_Rees_Mogg has, we would be reprimanded by the party &amp; criticised for gross disloyalty to @theresa_may with all the attendant abuse &amp; threats of deselectionhttps://twitter.com/Anna_Soubry/status/1032563172455137280 …"
2018-08-22T23:51:06,UK is third largest donor to the United Nations and we support @antonioguterres in reforming and modernising the @UN. Vital if it is to be an even stronger force for good in the world.pic.twitter.com/CPaFTU8qTP
2018-08-23T11:09:04,"Dismayed by plans to construct over 2,100 settlement units in the West Bank, illegal under international law. Israel must halt such counterproductive actions, and all parties must deescalate current tensions and urgently commit to renewed efforts for peacehttps://tinyurl.com/y9xvmrlt "
2018-08-22T20:16:41,What an honour to meet Dr Henry Kissinger just now. The world’s most experienced diplomat tutoring the world’s newest.pic.twitter.com/tVzqMWIcTo
2018-08-22T17:32:38,"Thank you #BeautifulLebanon for the thrill of discovering your hope &amp; complexity; for the honour of meeting your energetic &amp; passionate people; &amp; for the pride to lead a @ukinlebanon team reflecting all the ideals of public service. #ShoulderToShoulder
#Goodbyepic.twitter.com/2l9m7hoXLO"
2018-08-21T11:49:18,Never have I so wished to simultaneously hug my mum AND the two female actors onstage in @sparks_play  Outstanding. Beautiful. Heartbreaking. Hopeful. Joyous. Real. Go and see it  @ThePleasance @edfringepic.twitter.com/XngHhuXcdb
2018-08-22T11:19:54,Received my Tommy through the post this morning to support the There But Not There Nation wise Installation to the Fallen@Remembered2018 Please support this cause and see the web site for more informationhttps://www.therebutnotthere.org.uk/ 
2018-08-22T11:09:18,"In 2016, 90,000 people died from measles – mostly children under 5. It is a tragedy that this can happen from a preventable disease. I am proud that #UKaid is working to save the lives of the world’s poorest children through effective measles vaccination programmes"
2018-08-21T18:08:23,"Important speech from Foreign Secretary @Jeremy_Hunt today in DC. Called on allies around the world to work together to uphold the rules based system that has led to unparalleled peace &amp; prosperity, while further improving it so that more people enjoy the benefits.pic.twitter.com/2c5HRDTKZg"
2018-08-21T16:45:31,Thoughtful first Washington speech by new FS. International norms protect us all- we are forgetting lessons of the past.https://twitter.com/foreignoffice/status/1031931168877424640 …
2018-08-21T14:51:12,NEWS: Foreign Secretary @Jeremy_Hunt has delivered a speech at the @USIP calling on like-minded countries to defend the international rules-based systempic.twitter.com/55iUlDGDgT
2018-08-21T12:41:40,#EidMubarak. My message to all those celebrating:pic.twitter.com/Z2FWZkGlWh
2018-08-20T19:08:13,"To all who celebrate the #EidAlAdha2018 and to your families, I would like to wish a festive holiday. May God flood your lifes with happiness and joy and guide our work together to bring the gift of peace and dignity to all in need. #EidMubarak! #UN"
2018-08-20T13:50:45,"#Measles is one of the most contagious diseases ever known.
 
When people do not get 2 doses of the vaccine against measles, the disease spreads quickly.
 
When enough people get immunized, everyone in the community is protected.
 
Yes, #VaccinesWork!pic.twitter.com/JLPUpd3lvX"
2018-08-20T15:43:28,"#Measles is one of the leading causes of death among young children globally even though a safe and cost-effective vaccine is available. 

#VaccinesWork, we can stop measles!
http://bit.ly/2wAxFpo pic.twitter.com/Y2VqmKrEBw"
2018-08-20T10:04:50,"It's been just over a year since @DrTedros took office as WHO Director-General. Here’s his first annual letter outlining the achievements made towards WHO’s mission “to promote health, keep the world safe, and serve the vulnerable” http://bit.ly/2MEsaAQ pic.twitter.com/CRIiyy9H0u"
2018-08-20T08:22:28,"“Combating organised crime and improving security is good for developing nations and directly contributes towards the security and safety of the UK"" - @PennyMordaunt
https://www.theguardian.com/world/2018/aug/19/uk-aid-minister-hails-double-win-of-heroin-crackdown-in-tanzania … #UKaid #aidworks"
2018-08-20T08:57:19,".@PennyMordaunt heard how a #UKaid-funded anti-smuggling scheme in Tanzania has stopped heroin worth millions of pounds reaching Europe

https://www.thesun.co.uk/news/7052929/britain-drug-squad-east-africa/ … #aidworks"
2018-08-19T13:55:56,"Well said @GeorgeFreemanMP ‘We should resist the siren voice of Farage and assemble a ‘Big Tent’ Brexit coalition in the best traditions of One Nation Conservatism, as Disraeli, Churchill and Thatcher did. We will pay a high price for delivering a UKIP-style hard Brexit.’https://twitter.com/ConHome/status/1031133854873137152 …"
2018-08-19T12:07:38,"We are living in frightening times where the extreme Left and Right seem to be trying to hijack mainstream political parties. The majority of British people are not extremists. We are a decent, law-abiding, respectful nation with moderate views. We are under attack!https://twitter.com/Anna_Soubry/status/1031092849046114304 …"
2018-08-19T11:06:33,It’s time to choose between a Conservative Brexit or a UKIP Brexit.  My piece on @ConHome now live....https://twitter.com/ConHome/status/1031133854873137152 …
2018-08-19T11:18:37,Spot on.  My piece in @ConHome today reiterates: we need to frame an inspiring OneNation @toryreformgroup @Conservatives Brexit and not be lured by a UKIP Hard Brexit #NoDeal #CrashOut  https://www.conservativehome.com/platform/2018/08/george-freeman-its-time-to-choose-between-a-conservative-brexit-or-a-ukip-one.html …https://twitter.com/NickyMorgan01/status/1030123011557519360 …
2018-08-19T07:56:12,There are no such things as Remain constituencies or Leave constituencies.                                 There are just United Kingdon constituencies.                                   We need to end the Brexit Civil War.   Extract from my piece on @ConHome coming later this ampic.twitter.com/ibjUKePWuK
2018-08-19T03:11:03,"On 19 August 2003, 22 UN staff lost their lives including @UN Envoy Sérgio Vieira de Mello in the Canal Hotel bombing in #Baghdad #Iraq

Today and always, we remember our fallen colleagues.

#NotATargetpic.twitter.com/nv0FohlgV7"
2018-08-19T08:21:00,"In the past 2 years alone, there have been over 1,200 attacks on hospitals, ambulances and medical personnel – in just 16 countries.

That’s an average of 50 attacks every month.

That’s more than 11 attacks every week.

That’s more 1 attack every day.

Enough.

#NotATargetpic.twitter.com/ObvcIwpgkl"
2018-08-19T08:00:00,"UK aid is a world leader in responding to humanitarian disasters, improving resilience to future crises and tackling climate change.

#WorldHumanitarianDay #WHD2018 #aidworkspic.twitter.com/ZBlhgUwAI8"
2018-08-19T11:00:27,"Aid workers are saving lives in north west Syria where 2.9m Syrians are at risk from deadly airstrikes. 

Last year #UKaid gave 1.3m vaccinations to under 5s, clean drinking water to 653,000 people and an education for 321,000 children there.

#WorldHumanitarianDay #NotATargetpic.twitter.com/zIABt30c8Q"
2018-08-19T11:00:47,A nice example of the breadth of interest and the commitment of our Ambassadors and High Commissioners abroad. Thanks @TSAReillyhttps://twitter.com/foreignoffice/status/1030405300225040385 …
2018-08-19T09:46:29,"Tragically 99 aid workers have already been injured, abducted or killed this year in the line of duty. That includes 12 killed and 28 injured in Syria, where Asad and Russia routinely target hospitals and aid workers. They are not a target. #WorldHumanitarianDay #NotATarget"
2018-08-18T19:00:54,Kofi’s passing is a moment to remember an era of civility and opportunity in international affairs. He allowed us to think we could change the world. And with his gentle words and steely determination he would settle for nothing less.https://www.crisisgroup.org/who-we-are/crisis-group-updates/memoriam-kofi-annan-1938-2018 …
2018-08-18T20:42:19,"Dear @bernardjenkin 1. We, not they, opened the whole issue of obstructing UK EU trade through your beloved #Brexit .
2. Despite your fantasies, elected national governments, not “EU bureaucrats”, determine the EU negotiating position.https://twitter.com/bernardjenkin/status/1030718446873583616 …"
2018-08-18T20:38:07," iFollow: Will Aimson on today's draw with @FGRFC_Official and his first goal for the Shakers  #buryfc
https://www.buryfc.co.uk/news/2018/august/ifollow-video-we-know-we-can-be-better---aimson/ …pic.twitter.com/iLwLU2iYEw"
2018-08-18T17:05:10,"“More than ever before in human history, we share a common destiny. We can master it only if we face it together. And that, my friends, is why we have the United Nations.”
— @KofiAnnan, Dec 1999

The UN mourns the loss of our former Secretary-General, who passed on Saturday.pic.twitter.com/zbADwG1TMU"
2018-08-18T17:53:48,"As we say farewell to #KofiAnnan its worth reading his #NobelPeacePrize speech. “Today’s real borders are not between nations, but between powerful and powerless, free and fettered, privileged and humiliated” #UNhttps://www.nobelprize.org/prizes/peace/2001/annan/lecture/ …"
2018-08-18T15:17:56,"I’m saddened to hear of the passing of one of the world’s greatest humanitarians, Kofi Annan on the eve of World Humanitarian Day. His commitment to humanity will continue to inspire us @UNOCHA to keep delivering assistance to all people in need.pic.twitter.com/tEITpQPLKG"
2018-08-18T12:38:29,"RIP Kofi Annan, statesman and champion of peace. At times when the value of multilateral organisations are under the microscope he showed that moral leadership can make a big difference"
2018-08-18T12:52:27,The @ToryReformGroup and our Patron @NickyMorgan01 are quoted in today’s article on @HuffPost - calling on moderates to make sure we keep the party a broad church and ensure we are registered Conservative membershttps://m.huffingtonpost.co.uk/entry/liberal-tories-urge-moderates-to-join-conservatives-in-battle-for-partys-soul_uk_5b76bde6e4b05906b412d18c …
2018-08-18T10:34:26,"Kofi Anan was the ultimate gentleman diplomat, a champion of struggling people everywhere, a relentless pursuer of peace and a true partner of the United States in noble causes. He was a friend in need to so many, including me. May he Rest In Peace.https://twitter.com/nytimes/status/1030761743700684800 …"
2018-08-18T09:01:46,Paid my respects at the memorial in honour of the British nationals who lost their lives in the Bali terrorist attacks in 2002pic.twitter.com/9VnVcZs1rn
2018-08-18T10:42:45,"Kofi Annan was a guiding force for good. I join the world in mourning his loss. In these turbulent and trying times, his legacy as a global champion for peace will remain a true inspiration for us all. https://bit.ly/2L8R86Y pic.twitter.com/SKfBk5zaY2"
