2018-03-14T17:35:22,"50,000 more children will receive school meals by 2022 under Universal Credit than would have done under the previous benefits system:https://www.channel4.com/news/factcheck/factcheck-labour-arent-telling-the-full-story-about-free-school-meals …"
2018-03-14T11:20:16,"I'm delighted that today in Parliament we will be launching the APPG on Endometriosis alongside @WomenWithEndo. My colleagues and I will be discussing how we can raise awareness of the condition, which affects 1 in 10 women, particularly amongst young girls in education.pic.twitter.com/jCx9UNvfhR"
2018-03-09T14:16:12,If you have innovative ideas which could make global change and are aged 18-35 apply now to the British Council's #FutureLeadersConnect programme http://bit.ly/18FLC pic.twitter.com/J0LCrJCRtj
2018-03-08T11:04:07,I welcome the news that secondary ticketing agencies have been banned from using “misleading” price strategies by @ASA_UK and join with @FanFairAlliance in opposing industrial-scale online ticket touting that is exploiting consumers.
2018-03-07T13:28:44,Pothole repairs already underway in Southend after bad weather. Find out more: https://www.davidamess.co.uk/news/pothole-repairs-underway-after-bad-weather …pic.twitter.com/xTSnFP3mc7
2018-03-07T11:38:07,Great to visit @SouthEssexColl to celebrate #NationalApprenticeshipWeek alongside my colleague @JamesDuddridge on Monday. Apprenticeships are key to creating a stronger and fairer economy where people of all ages and backgrounds can fulfil their potential.pic.twitter.com/SCxhnqx0lX
2018-03-01T13:57:01,Delighted to support #WorldBookDay in Parliament. Spending just 10 minutes a day reading with a child can make a crucial difference to their future and turn them into readers for life. #ShareAStorypic.twitter.com/rIVI5D2gMf
2018-02-27T10:18:21,"See my contribution to yesterday's Westminster Hall debate on Live Farm Animal Exports #BanLiveExports
http://parliamentlive.tv/Event/Index/b22ff481-91ef-4c91-affc-008cf49aa434?in=17:07:58 …pic.twitter.com/ob3hazjMZC"
2018-02-22T16:58:26,Great to see our Patron @amessd_southend talk on Michael Gove’s work to advance animal welfare on today’s @daily_politics show. Thank you also to Sir David for the kind words about our Conservative Animal Welfare Foundation Co-Founder in the interview!pic.twitter.com/XgemqO0DbW
2018-02-14T13:18:14,Many thanks to @HenryBootConstr for giving me a tour of the @SouthendAirport Business Park last Friday. This development will create employment and benefit the local economy enormously.
2018-02-12T12:37:40,"Great to meet with @stae_elephants recently and to hear of their inspiring work to save the Asian elephant. Last week, I highlighted the appalling abuse that these amazing animals suffer with @andrealeadsom during Business Questions in the @HouseofCommons.https://twitter.com/ConservativeAWF/status/962090781535342593 …"
2018-02-06T17:30:37,Longstanding animal welfare supporter @amessd_southend at yesterday's @appgES event with unwanted ivory surrendered by IFAW supporters over past six months #StopTheIvoryTradepic.twitter.com/3Uhy5hlZM8
2018-02-07T10:17:50,"Over 8 million tonnes of plastic enters our oceans every year, so on Monday I pledged to #PassOnPlastic with @SkyOceanRescuepic.twitter.com/mYABTrKThv"
2018-02-06T10:07:16,"Did you know that UK sport is already being impacted by climate change? The things we love might be changing, but together we can help protect them. Please join me and @TheCCoalition to #ShowTheLove for iconic British sports this February http://tiny.cc/thegamechanger "
2018-02-02T16:41:01,".@amessd_southend is right to be a proud supporter of the excellent @MusicManProject, based in his constituency. A wonderful music education service specifically for children and adults with learning difficulties.https://twitter.com/amessd_southend/status/955427546644041728 …"
2018-02-02T10:32:57,"Great to meet students from @ChaseHighSch who visited Parliament to take part in the voting workshop yesterday. I was delighted to hear their questions about current affairs, local issues and the role of an MP.pic.twitter.com/nzN2VqtYYj"
2018-02-01T17:01:15,"See my question to the Secretary of State for Wales regarding cross-border economic opportunities. The reduction of toll charges will benefit tourists, businesses and commuters - providing a £100 million boost to the Welsh economy.

http://parliamentlive.tv/event/index/28c51cde-1c05-4397-bced-f0e06b95974d?in=11:36:02 …pic.twitter.com/2q3vUNjCdP"
2018-01-31T13:13:45,Delighted to join my colleagues and @ConservativeAWF on Monday to call for the end of live animal exports for slaughter. We have a fantastic opportunity to ban this practice now that we are leaving the European Union. I therefore urge everyone to get behind our calls.pic.twitter.com/tcL8Tco3sA
2018-01-29T19:09:15,Thank you to @cmackinlay for hosting fantastic parliamentary event today  to end live exports for slaughter today. Thanks also to  MPs #TheresaVilliers MP #AnneMain &amp; @amessd_southend  &amp; all MPs  &amp; celebrities for their kind supportpic.twitter.com/5VkRu6jzIl
2018-01-27T15:35:17,"Campaigning to bring our organisation into the U.K and worldwide with Sir David Amess in Parliament 

Our APPG is taking place March 14th 2018 

Thank you to everyone for the incredible support you have shown so far #womenwithendometriosisorganisation @amessd_southendpic.twitter.com/ild8jFwVqq"
2018-01-26T16:58:00,I recently met @kidneycareuk to hear about the Government consultation on Organ Donation. I encourage as many people as possible to participate so all opinions on this matter can be heard.https://www.davidamess.co.uk/news/government-consultation-organ-donation-sir-david-amess-mp …
2018-01-24T16:56:19,With our objective to bring Endometriosis into education we are thrilled to have Sir David on board leading us and our campaign through Parliament pic.twitter.com/bllfSDFErG
2018-01-24T15:55:48,Great to meet the Youth Mayor and Member of Youth Parliament for Southend yesterday at the 'State of Child Health - One Year On' event in Parliament. Delighted to here about the hard work of @SoSYouthCouncil and their recent activities.pic.twitter.com/zmwTh1lmNm
2018-01-22T13:10:52,Proud to have witnessed the award-winning @MusicManProject World Record triumph at the London Palladium in October. Having put on such a spectacular show I am thrilled that they will now be performing at the Royal Albert Hall in April 2019.https://www.davidamess.co.uk/news/music-man-project-musicians-break-world-record-attempt …
2018-01-19T15:03:36,Delighted to welcome my colleague the Secretary of State for Health @Jeremy_Hunt to Southend Hospital this morning. Great to hear about his passion and plans for our Health Service and to speak with clinical &amp; support staff. @SouthendNHSpic.twitter.com/HUBLgNolS9
2018-01-17T18:11:00,Great to welcome my fellow #Southend MP Sir David Amess to the twitterverse @amessd_southendpic.twitter.com/2EwvuRdd09
2018-01-17T12:44:46,We have a environmental and economic duty to protect our bees. Read my article on Conservative Home to find out why:https://www.conservativehome.com/platform/2018/01/david-amess-how-we-can-protect-bees-and-increase-food-at-the-same-time.html …
2018-01-16T15:13:17,The civilisation of any country can be judged by how they treat their animals. I am delighted therefore that the Conservatives are determined to champion greater animal welfare standards in the UK.https://twitter.com/Conservatives/status/953272270306381826 …
2018-01-16T13:17:26,"Yesterday I signed the Holocaust Education Trust’s Book of Commitment. My message was that none of us should ever forget the terrible atrocities that took place and that this year’s theme, ‘The Power of Words’, should be passed on to future generations.pic.twitter.com/u0UzY05Wzd"
2018-01-14T16:20:28,"Working with Sir David Amess &amp; @JamesDuddridge we have secured increased funding for schools in @SouthendBC from the @educationgovuk. This means:

1. A 2.4% increase in overall budget (+£2.85m)
2. More cash per pupil
3. Implementation of the min per pupil funding a year early"
2018-01-16T10:56:42,"See my question to the Defence Secretary yesterday about support for local charities that help veterans tackle isolation and loneliness.

http://parliamentlive.tv/event/index/6683de80-17b0-44e6-b2b0-dfca5695f9bd?in=14:35:28 …pic.twitter.com/IhkuZ51Siy"
