2018-11-27T13:15:17,"Yesterday I asked the Defence Secretary @DefenceHQ reaffirm the importance of the Commonwealth to UK national security. Commonwealth soldiers made an extraordinary contribution in both world wars, and it is vital that we remember them and continue to support their legacypic.twitter.com/kH3vitlwXT"
2018-11-26T14:38:25,Fantastic debate at @durhamunion on Friday evening. Lots of lively discussion on unity in the United Kingdom.  It was also a great pleasure to address the @DUConservatives Association.pic.twitter.com/07cJBhuYK1
2018-11-23T09:36:17,Thank you @amessd_southend for your support at the #Scrap6Months event in @UKParliament last week!https://www.davidamess.co.uk/news/sir-david-calls-terminal-illness-welfare-access-review …
2018-11-22T14:02:03,Thank you very much for your support for #FurFreeBritain and our action outside Defra today @amessd_southend #24hoursinacagepic.twitter.com/ygpcbp59cw
2018-11-22T10:34:49,"After hearing from @LJWGHepCandSM on their pharmacies testing project at our meeting last month, our co-chair @amessd_southend has written to Public Health Minister @BrineMinister asking what can be done to minimise barriers to distributing hepatitis C treatment in pharmacies.pic.twitter.com/OhwypUw0SA"
2018-11-21T17:58:29,"Pleased to welcome Southend Councillor Meg Davidson to @UKParliament to celebrate 100 years since women were first allowed to stand for Parliament. Lots of work to be done to encourage more women to get involved in politics, if you know someone who'd be great at it #AskHerToStandpic.twitter.com/UpLnqUoKm8"
2018-11-21T14:11:41,Thank you @amessd_southend  for supporting the Campaign to Ban Trophy Hunting &amp; our call for an end to U.K. trophy imports. It’s time to stop this cruel industry once &amp; for all. @CBTH #bantrophyhunting #bantrophyimports http://www.bantrophyhunting.com pic.twitter.com/brONgYJzDy
2018-11-20T18:51:32,"Proud today to unveil a plaque to honour @NSPCC founder, Reverend Benjamin Waugh. Buried in Sutton Road Cemetery, Southend. On #WorldChildrensDay we remember his legacy and dedication to helping protect children across the UKpic.twitter.com/YAIjGORAMi"
2018-11-20T16:49:09,"Big thank you to ⁦@amessd_southend⁩ for attending our parliamentary reception today! Thank you for supporting hot, healthy and nutritious school meals #NSMW18 @NSMWpic.twitter.com/CcwJ3S5361"
2018-11-19T16:42:26,"I cannot support any deal that fails to honour our manifesto commitments, and deliver the Brexit 17.4 million people voted for. My statement on the Draft Withdrawal Agreement:https://www.davidamess.co.uk/news/sir-david-amess-mps-statement-draft-withdrawal-agreement …"
2018-11-16T10:58:51,"If you live near Southend-on-Sea, come along and meet some of the Save The Asian Elephants volunteers and win a prize on our tombola at @Official_LTC Christmas Fayre, @parkinn hotel, Southend-on-Sea this Sunday 11am - 3pm, entry is FREE. #STAE #FridayFeeling #ChristmasIsComingpic.twitter.com/QTrKYqUmXc"
2018-11-14T21:25:42,"This week I’ll be attending the charity black tie ball held in the House of Commons in aid of the Women With Endometriosis charity 

Thank you Sir David Amess for organising an incredible event and for your continuous support  @amessd_southend pic.twitter.com/yk73LgdXRY"
2018-11-14T18:48:55,Great to meet the new @EssexPoliceUK Chief Constable @BJH251 with my fellow Essex MP's. Looking forward to working together on improving policing in Southend and getting more police officers on our streetspic.twitter.com/HcwNKP8Cdi
2018-11-14T11:54:01,"Today, we’re meeting with MPs @amessd_southend, @patel4witham, @JamesCleverly, @JamesDuddridge, @vickyford, @GilesWatling, @JWhittingdale &amp; Mark Francois at Westminster to ask them to support an ambitious #EnvironmentAct for a #WilderEssex. You can help – http://www.essexwt.org.uk/wilder-future pic.twitter.com/IPbunaiKur"
2018-11-09T17:52:15,"Poignantly beautiful scenes at Tower Hill in the lead up to Armistice Day. 10,000 candles lit to mark the cetenary of the end of the First World War. An incredibly moving tribute to all those who have given so much for this country  #TowerRememberspic.twitter.com/7vnRurPgsY"
2018-11-08T17:15:42,Great to hear that @family_action children centres in Southend have now received recognition by @UNICEF @babyfriendly for their excellent support to new parents and work to ensure all babies in Southend get the best possible start in life. https://www.southend.gov.uk/news/article/1526/southend_s_children_s_centres_recognised_by_unicef_for_their_support_to_new_parents …
2018-11-07T19:35:39,"This year, Southend-on-Sea is hosting an extra special programme of activities to commemorate Remembrance Day: More here:
http://www.southend.gov.uk/southendremembers … #southendremembers #Remembrance2018pic.twitter.com/ELA09ZqznV"
2018-11-07T17:21:19,"This Friday my guest on ""LIFE WITH PATTI BOULAYE"" will be Sir David Amess @amessd_southend at 1.00pm &amp; 8.00pm GMT https://www.disruptive.live/series/life/  watch it anywhere in the world along with past guest interviews @disruptivelive @comparethecloud #lifewithpattiboulaye #life #thefaithofachildpic.twitter.com/UhAwbSbhuj"
2018-11-06T17:59:01,Today I asked @PhilipHammondUK to join me in celebrating the success of @BESTGrowthHub in Southend. So far they've helped over 3000 businesses and start-ups get advice and funding. The support available has really helped boost local growth in Southend. http://www.bestgrowthhub.org.uk/ pic.twitter.com/JmvVJS4k5g
2018-11-06T14:21:17,We thank you @amessd_southend for your support to #BanDogMeat in the UK!  We look forward to working with you and discussing the next steps to get this banned!  #IAMNOTFOOD @DavidRutley @michaelgove @DefraGovUKpic.twitter.com/9J3oOSXOJD
2018-11-06T13:34:15,I'm pledging my support to help stop #puppysmuggling. @DogsTrust recent report has shown the horrific conditions and treatment animals illegally imported into the UK suffer. It's time to take action and end this awful practice for goodpic.twitter.com/t47iYil0Rj
2018-11-05T18:17:50,Come along to the Southend Jobs Fair on Wednesday 28th November at the Park Inn. A great chance to chat with local employers and learn about exciting job opportunities available. Find out more information at https://www.facebook.com/events/1800991443540457 …pic.twitter.com/q9XjXFqwNv
2018-11-04T14:09:06,"Patron @amessd_southend  says:’I am appalled to see the hunting of deer with hounds still taking place across the British countryside.The pursuit of deer to exhaustion, ending with a bullet to the head and being carved up for trophies, is truly shocking..
https://www.league.org.uk/news/new-footage-reveals-the-cruel-world-of-stag-hunt#utm_source=engaging%252525252520networks&amp;utm_medium=email …pic.twitter.com/Ytr72jREoP"
2018-11-02T15:51:34,"Sir David Amess MP calls for hunting ban to be strengthened ""I'm appalled to see hunting of deer with hounds still taking place [...] the public expect such cruel &amp; macabre bloodsports to be consigned to the history books"" @amessd_southend http://bit.ly/2QkkcMc  @ConservativeAWF"
2018-11-02T14:01:45,"Thank you to all MPs supporting our call to end the cruel cages used on game birds. 

Please ask your MP to join the campaign. https://e-activist.com/page/21258/action/1?ea.tracking.id=web …pic.twitter.com/NfMixLWcDC"
2018-11-02T14:11:48,"Lots of commemorative events across Southend to mark 100 years since the end of the First World War. Particularly moved by the new commemorative benches in Gunner's Park, a tribute to all those who sacrificed so much for our country. Find out more at http://www.southend.gov.uk/SouthendRemembers …pic.twitter.com/n1KogxiZ5Y"
2018-10-31T16:37:39,Great to hear @SouthendBC and @EssexPoliceUK launching their #MakeaChange campaign to help people get off the street for good. A welcome initiative alongside @mhclg Rough Sleeping strategy which will see £1 million invested in Southend by 2020 to tackle homelessness in our town
2018-10-31T16:17:55,". @amessd_southend supports an end to Game Bird Cage Cruelty. Being confined in@cages means that the birds suffer from stress, and are therefore fitted with various unpleasant devices such as masks and clips https://www.animalaid.org.uk/ban-the-cage/  #EndTheCageAge #AnimalWelfare #Compassionpic.twitter.com/r64Y1p7tDt"
2018-10-31T12:47:42,The MP for Southend West @amessd_southend is the latest #IPTPoppyRide participant with a distance of 2.52kmpic.twitter.com/qbAW03xDUX
2018-10-30T19:01:46,"We’re really happy to announce that Sir David Amess, MP for #SouthendWest has pledged to #StandUp4Brexit 

Thanks so much for your support David!

We now have 51 MPs supporting our campaign. If your MP hasn’t pledged yet please email them: https://www.parliament.uk/mps-lords-and-offices/mps/ …pic.twitter.com/XP71TnQUCo"
2018-10-30T10:15:16,"Great to hear @SouthendBC pressing ahead with much needed road resurfacing programme in the next few weeks. Even better news alongside @hmtreasury £420 million boost to tackle potholes, and road repairs across the country."
2018-10-29T17:41:43,Cutting income tax for 32 million. Abolishing stamp-duty for all first-timer buyers. Investing an additional £1.7 billion in Universal Credit. @Conservatives are backing working families and making the economy work for everyone. #Budget2018
2018-10-27T20:23:31,"Me, @ConorMcGinn @MikeKaneMP @amessd_southend have written to the Pope.  We want him to end Catholic social teaching which tells young people that being LGBT is a disappointment or misfortune.https://twitter.com/EqualFuture2018/status/1055587539137060866 …"
2018-10-26T14:55:27,"Delighted to hear that visitor numbers to Southend reached a record high in 2017. With 7.5 million trips being undertaken, an increase of 500k from 2016, it is clear that Southend's tourism industry is booming. Yet another reason why Southend should be made a city!"
2018-10-26T10:15:45,Very happy to announce that @amessd_southend becomes the latest signatory of our #CommonwealthPledge and commits to promoting closer ties with the Commonwealth this Parliament!pic.twitter.com/jEth3ezF3G
2018-10-26T12:00:58,The Hive Enterprise Centre is 100% behind #Southend being reclassified as a city! Southend IS a City! @amessd_southend @JamesDuddridge @SouthendBC @thejazzcentreuk You have our support! @Essex_Echo @investessexhttps://www.echo-news.co.uk/news/17009963.jazz-centre-leads-to-city-bid-for-southend/ …
2018-10-25T16:27:00,Today I raised the important topic of childhood cancers with @CommonsLeader. More needs to be done to raise awareness of the symptoms and prevent the tragedy of childhood cancer happening in more families #ChildhoodCancerpic.twitter.com/yfJqHoNC1m
2018-10-25T14:32:53,Voting in the @AvivaUK Community Fund is now open. Visit http://www.avivacommunityfund.co.uk  to find out about all the fantastic local projects you can support in Southend  #AvivaCommunityFundUK
2018-10-25T12:59:31,"Leaving the Common Fisheries Policy is a great opportunity for our coastal communities, particularly the fishermen and cocklers of Leigh-on-Sea. Today I asked @DExEUgov to ensure that any extension to the transition period will not harm our fishing industry.pic.twitter.com/DE1bcdQCLt"
2018-10-25T10:25:37,"Following Monday's meeting with fellow Essex MPs and the Policing Minister, I have co-signed a letter to the Chancellor calling for the additional funding granted by the previous Police Funding Settlement to become a permanent fixture of future budgets."
2018-10-24T15:58:59,"Today I asked the Prime Minister to join me in celebrating the re-opening of the @thejazzcentreuk in Southend. A fantastic venue, that will draw jazz devotees from far and wide. Yet another reason to support our wonderful town becoming a city.pic.twitter.com/b8CiyICneX"
2018-10-24T15:00:14,"The Heritage Lottery Fund has recently granted @TrustLinksLtd £10,000 for their project 'Bird and Bat Life at Growing Together Westcliff'. I'm delighted to learn that this funding will enhance the project through a series of workshops and habitat improvement.pic.twitter.com/2rE7SkXTru"
2018-10-24T12:38:14,Yesterday the Maldives APPG welcomed Deputy Ambassador Aishath Azeema to our AGM. As Chair of the APPG I would like to congratulate the new President on his election. We look forward to working closely with the new President and his administration in the future.pic.twitter.com/4pGsQajZeg
2018-10-24T11:13:17,On #WorldPolioDay I will be wearing my purple crocus pin in order to highlight the End Polio Now campaign. I urge all constituents to visit https://www.rotarygbi.org/projects/purple4polio/ice-cream/ … to purchase #Purple4Polio ice cream and provide children with life-saving protection against polio.pic.twitter.com/au4yGaX2Zy
2018-10-23T14:24:37,Great to meet with @nickhurd and fellow Essex MPs to discuss policing in our area. Raised concerns on behalf of many constituents regarding police numbers in Southend. Looking forward to working with @ukhomeoffice on this in the future.pic.twitter.com/feKAx5CdZj
2018-10-22T16:29:41,Great to speak today at @Policy_Connect 'Building a Safer Future' Event . Current fire safety regulations not fit for purpose and urgent action required. Crucial that the Government now implements all Hackitt Review recommendations  #100Hackittpic.twitter.com/rjx3D74dEz
2018-10-22T16:04:45,"Delighted to welcome the Taiwanese Ambassador to Southend on Friday. The purpose of the visit was not only to show the Ambassador all that Southend has to offer, but to secure future investment for our town.pic.twitter.com/CADpYJfaen"
2018-10-19T16:31:10,Today is @breastcancernow #wearitpink day! I enjoyed meeting them back in September to hear about their vital research – you can donate here https://bit.ly/2Cs9Khe pic.twitter.com/MXEiwUW3c8
2018-10-18T12:46:26,Congratulations to the newly elected Youth Mayor and Deputy Youth Mayor of Southend. At a time in which more young people than ever are getting involved in politics I have no doubt that these two individuals will do a tremendous job in office. @SouthendYMayor @SoSYouthCouncil
2018-10-18T09:44:24,"Keeping your home, family and personal belongings safe this autumn is paramount. Visit the Essex Police website for their top safety tips to prevent some of the crimes most common at this time of year: http://www.essex.police.uk/letstalk  #LetsTalkAboutCrime"
2018-10-18T08:25:21,Event organisers are being given the opportunity to bid for funding to set up events and activities in the borough. You can bid using the following link http://www.southend.gov.uk/smallgrants  . The first round is open now and bids can be made until 5pm Tuesday 6 November.https://twitter.com/SouthendBC/status/1052587730826346496 …
2018-10-17T14:05:48,Great to attend the official opening ceremony of Vimpex Ltd as Chair of the APPG on Fire Safety &amp; Rescue earlier this month. I was delighted to congratulate the local company on its new venture and I look forward to visiting again in the near future.https://www.youtube.com/watch?v=cvNUPhUU9s8&amp;feature=youtu.be …
2018-10-17T13:52:04,Great to see new Community Safety Officers starting their work in Southend this week. These officers will support the Police and other agencies to provide reassurance and visibility within the town centre area.pic.twitter.com/eBzVqFLfzo
2018-10-17T11:23:40,"The Prime Minister is right, unemployment is at the lowest rate since 1975 and wages are rising at their fastest pace in nearly 10 years. This is welcomed news that reflects the @Conservatives balanced approach to making sure the economy works for everyone."
2018-10-17T11:13:01,"30 million dogs are killed each year for their meat. In the UK it is still legal to eat #DogMeat, but I am determined to change that. This is why I am in favour of closing the legal loophole in order to ban the consumption of #DogMeat in the UK. @worlddogalliancpic.twitter.com/cCjSDbv3ax"
2018-10-16T13:35:45,Pleased to announce that @Dr_PhilippaW has joined the APPG team as Vice-Chair following our AGM this morning. Our long-standing officers @amessd_southend @VirendraSharma @jennyranderson and Baroness Masham were also re-elected.pic.twitter.com/lgGTGMuT2Q
2018-10-16T14:15:48,Last week we presented @WHSG1920 with a cheque for £3000 as part of Erin Stoner's #JPSpeakOut Grand Final Champion winnings! Thanks to @amessd_southend who was there to congratulate Erin and share his experience of public speaking https://bit.ly/2PCXxKv  @JPFoundation @stammerpic.twitter.com/JnIOHNIBGN
2018-10-16T15:15:16,Thrilled to have @amessd_southend attend our campaign launch to ban the consumption of #DogMeat in the UK - thank you!  #IAmNotFood pic.twitter.com/CQifu7SDhV
2018-10-14T08:23:46,Thank you to Sir David Amess MP for supporting our campaign to end race horse deaths.pic.twitter.com/VgF5Ldf1HN
2018-10-12T16:24:33,"Yesterday I raised the issue of mis-sold life insurance policies with @CommonsLeader. Too often constituents find they have been paying more into schemes than they will actually receive on their death, and by cancelling their policy they risk losing everything.pic.twitter.com/WdYTcvGRiz"
2018-10-12T15:16:17,Delighted to have @andrealeadsom as guest speaker at the Southend West Conservative Association Annual Dinner yesterday evening. Great to also be joined by the Mayor of Southend and many local supporters.pic.twitter.com/wdMW803ApG
2018-10-12T09:36:40,Great to join @crisis_uk on #WorldHomelessDay and pledge to #EndHomelessness. Join the Everybody In campaign at https://bit.ly/2pNhdjG pic.twitter.com/WZfS8vFVWT
2018-10-12T08:24:51,"In the year that we are about to mark the centenary of the end of the First World War, it was a pleasure to once again have so many centenarians attend our annual tea party to share with those present what they have done throughout their lives.pic.twitter.com/UExlXoEciK"
2018-10-11T16:06:44,Great to welcome 120 soldiers from @BritishArmy to Parliament yesterday. Our Armed Forces do so much for us therefore I want to thank all of those who protect our nation.pic.twitter.com/yJ08nlR1In
2018-10-11T10:40:50,"Delighted to support the wonderful charity @CirdanTrust. 33,000 young people across the UK have already experienced the challenge and adventure of life at sea aboard one of their sailing voyages. Find out more about the fantastic work they do at https://cirdantrust.org/ ."
2018-10-04T11:07:00,I'm supporting #WorldAnimalDay to raise the status of animals in order to improve welfare standards around the globe. It is my hope that this event will continue to grow until it links animal welfare advocates all across the world. @worldanimalday
2018-10-03T20:26:47,Blue Fox Patron Sir David Amess MP @amessd_southend message to end the #badgercull at party conference #CPC2018 #WorldAnimalDaypic.twitter.com/43bMTcbuRt
2018-10-02T11:19:53,I'm joining over 500 MPs to plant trees with @WoodlandTrust as part of the #QueensCommonwealthCanopy! Find out more about the @QueensCanopy at https://protect-eu.mimecast.com/s/-XgpC81Q5CzOnlpCnYh8d?domain=woodlandtru.st …
2018-10-01T14:52:50,A true advocate for animals in Parliament for over 30 years - @amessd_southend and his Southend team at #CPC18 #EndWildlifeCrimepic.twitter.com/jjXaDIKlkH
2018-10-01T15:55:03,"Sir David Amess, MP for Southend West, showing his support for raising the society lottery limits! #Cpc18pic.twitter.com/dTLTW1pDUt"
2018-10-01T16:01:54,Duncan with @amessd_southend MP who recently spoke up strongly for #STAE in Parliament.#SaveTheAsianElephants #Birmingham #cpc18 @ConservativeAWF @Conservativespic.twitter.com/N7exIL8qfx
2018-09-28T13:00:46,"Delighted to visit Southend Army Reserve Centre earlier this week to meet local troop members. Great to see some of the work they do and how being a reservist integrates into their work-life balance. As Churchill said, 'A reservist is twice the citizen'.pic.twitter.com/kKfCALyPYU"
2018-09-26T12:42:33,"Delighted to support #WorldSchoolMilkDay &amp; @SchoolMilkAll to ensure that children across the UK receive healthy, nutritious milk daily in learning environments.pic.twitter.com/DqnGtMyqJu"
2018-09-25T17:38:28,"The British people have been betrayed today by a vote at the Labour Party Conference which in essence means despite the result of the 2016 referendum, with the majority of people voting to leave the European Union, Labour want to reverse that decision. So much for democracy."
2018-09-25T15:24:04,It is vital that communities benefit as our economy transitions to one with increasingly more decentralised and clean energy. The Local Electricity Bill will enable local energy generation to benefit local communities. I will do all I can to ensure it becomes law.
2018-09-24T15:22:22,The wonderful @MusicManProject will be performing their most spectacular concert yet when they take to the stage at the Royal Albert Hall on Monday 15th April 2019. Tickets are available now from the Royal Albert Hall Box Office #MusicIsMagicpic.twitter.com/yq4hdkV3KN
2018-09-20T09:06:18,"Please note, I will not be holding an advice surgery tomorrow - Friday 21st September. The next surgery has been rescheduled for Monday 24th September at Iveagh Hall, Leigh-on-Sea from 9:00 to 12:00."
2018-09-12T16:18:02,Very positive meeting yesterday. Thank you Sir David Amess @amessd_southend for taking the time to meet and chat about #PetTheftReform @SAMPAuk_pic.twitter.com/0mT7yk7lqR
2018-09-12T09:27:29,Yesterday I set out some of @QSA's recommendations on how to tackle funeral poverty. See my full speech during the Westminster Hall debate at https://parliamentlive.tv/Event/Index/0b841c45-6ddd-498a-9a94-d0ee84993170?in=14:45:17 …pic.twitter.com/XWlJ0WdXa6
2018-09-11T14:58:37,The issue of illegal encampments is one that I stand shoulder to shoulder with my colleagues on. Yesterday I spoke in the House of Commons about how this matter needs urgent attention so that it is no longer overlooked.pic.twitter.com/m42f2AUqVh
2018-09-07T12:25:24,"Great to hear that projects in Southend West have received a total of £130,624 in funding from the @BigLotteryFund over the last three months #NationalLottery"
2018-09-07T09:28:18,During Business Questions yesterday morning I raised the topic of funding for lower league football. Glad to hear that money is being allocated to further develop grassroots sport.pic.twitter.com/hhRzeVhLfZ
2018-09-06T14:31:33,Fantastic to see the @LessSurvivable cancer community and parliamentarians fight together to see survival rates for the less survivable cancers double from 14% to 28% by 2029. Thank you for your political support @amessd_southend and @FitzMP #28by29https://twitter.com/LessSurvivable/status/1037708078765023233 …
2018-09-06T08:45:18,Yesterday it was announced that Southend Borough Council have secured further funding from the Government to tackle rough sleeping. This extra cash will build on the improvements already being made to services between 2019 and 2020.
2018-09-04T15:00:08,"Great to support @bloodwise_uk today here in Parliament. With 240,000 people living with blood cancer in the UK it is important that their unique needs are fully understood by the Government, Parliament, the NHS and the medical community.https://twitter.com/bloodwise_uk/status/1036957678025822208 …"
2018-09-03T13:09:30,Delighted to announce that this year's Centenarians' Tea Party will be taking place on Sunday 7th October at Iveagh Hall in Leigh-on-Sea. If you know anyone aged 100 or over that may wish to attend please get in touch.pic.twitter.com/IOwuWg8K7C
2018-08-29T10:40:19,Proms in Priory Park takes place this coming Saturday at 6pm in the Gardens of Prittlewell Priory. Book tickets via the Mayor's Charity Events Team at events@southendmayorscharity.net or telephone 07538 306226.pic.twitter.com/GZvEoRQwuG
2018-08-23T08:17:16,Well done to all students in #Southend picking up their GCSE results today. No doubt your hard work and commitment has paid off! #gcseresultsday2018
2018-08-21T10:10:46,Calling all small shops in Southend West – what makes your shop stand out? Nominate yourself for the Best Small Shops Competition in Parliament at https://www.indieretail.uk/best-small-shops/ … #indieretail
2018-08-17T13:45:43,"Honoured to visit the Southend and District Reform synagogue today to see Della Carr present a cheque for £3,100 to Fair Havens @HavensHospicespic.twitter.com/rJPUXG9M5N"
2018-08-17T08:24:25,Congratulations to all the students in Southend who have worked so hard to obtain their excellent exam results this week. Time to relax and celebrate!pic.twitter.com/1HKnAmUszh
2018-08-16T14:47:28,"I introduced the Specialist Printing and Materials (Offences) Act in March 2015 and I have just been informed by the Project Genesius team at the Metropolitan Police that the first prosecution is about to take place, keeping people safe from identity theft by criminals.pic.twitter.com/tKeeEAAgfj"
2018-08-14T15:40:22,"Attending the Carnival Dog Show in Priory Park is always a treat. However, getting everyone to 'sit and stay' is a challenge! Well done to Eddie and all his volunteers for another successful Show.pic.twitter.com/ciRhm2iMym"
2018-08-14T15:32:37,A wonderful afternoon at the Southend Blind Welfare Garden Fete on Saturday. Glorious weather and the chance to join the Old Chimers for a spot of bell-ringing - more difficult than it looks!pic.twitter.com/RlIwfjX7qH
2018-08-10T17:21:35,Thoroughly enjoyed the Summer Youth Project’s performance of Little Shop of Horrors at the Palace Theatre yesterday evening. The scheme’s students worked incredibly hard and put on a tremendous show!pic.twitter.com/rl2zOu17tS
