2018-08-10T08:53:06,Delighted to join Southend and District Reform Synagogue last Saturday for a special Shabbat service honouring Della Carr for her 40 years of volunteering at Reform Synagogues across the UK.pic.twitter.com/ZfroIyc5PO
2018-08-07T15:47:01,Are you a local charity or community group looking for funding? Apply before 15/08 for a grant of between £500-£20k http://www.postcodetrust.org.uk 
2018-08-07T09:39:31,"Yesterday, Op Southend was introduced. This operation will bring police resources from across the county to the district to help tackle violent crime. I was delighted to visit Southend Police Station prior to the launch on Friday."
2018-08-06T16:35:50,"It's great to have a new Parliamentary supporter, Sir David Amess MP, after meeting with his office recently. He joins our campaigns to help ensure all children enjoy the benefits of school and nursery milk. @amessd_southendpic.twitter.com/OXLQp6l9fA"
2018-08-02T08:56:48,"I was delighted to join actress @RealRula on 'Life with Patti Boulaye' last week. It was a pleasure to meet Rula, a real star, who has appeared in so many wonderful programmes and shows, playing some iconic roles in the process.pic.twitter.com/oHihVuARIZ"
2018-07-27T08:57:57,Great to join my good friend @PattiBoulaye on her new TV show 'Life with Patti Boulaye' yesterday afternoon. Be sure to tune in when it airs soon! #lifewithpattiboulayepic.twitter.com/F93Sibrdwj
2018-07-25T09:35:11,Great to speak in the summer adjournment debate yesterday afternoon in order to raise topics concerning Southend West and various other matters. See my full speech here: https://parliamentlive.tv/event/index/83036152-7f77-4d63-98a6-1d82b563b395?in=16:16:41 …pic.twitter.com/7zHY1Htygs
2018-07-24T09:04:11,Great to visit @TrustLinksLtd Growing Together Westcliff on Friday. From looking around the site's gardens + meeting members &amp; volunteers it really is no surprise the project is a frequent winner in the 'Southend in Bloom' and 'Anglia in Bloom' competitions.pic.twitter.com/RsZINvT8If
2018-07-20T23:00:33,"""We Brits want the Iranian people to enjoy the same freedoms that we do.""  @amessd_southend #FreeIranhttp://ow.ly/CUIa30l20ys "
2018-07-20T18:24:00,"Thank you @amessd_southend for signing our petition to stop the killing of animals by hunts in the UK! Read more here: https://www.davidamess.co.uk/news/sir-david-joins-calls-hunting-act-be-strengthened-stop-wildlife-being-killed …

You can sign our #HuntingKills petition here: http://www.league.org.uk/huntingkills pic.twitter.com/hot6pAJfsy"
2018-07-20T16:02:40,"Thank you @amessd_southend for signing our petition to stop the killing of animals by hunts in the UK! Read more here: https://www.davidamess.co.uk/news/sir-david-joins-calls-hunting-act-be-strengthened-stop-wildlife-being-killed …

You can sign our petition here:http://www.league.org.uk/huntingkills "
2018-07-19T17:45:04,Delighted to have @amessd_southend and @LukePollard pledging to #HonourHer. Thank you for supporting our campaign to end #VAWG here in the UK and around the worldpic.twitter.com/pW5Zw1AQWQ
2018-07-18T19:27:42,"Thanks to Sir David Amess for your comments on our show: ""An absolutely brilliant play which was so relevant. Youngsters aren’t going to listen to teachers and politicians but they may listen to organisations such as yourselves."" #letshopeso #Antigangcrimepic.twitter.com/EYDLD6O3ub"
2018-07-17T12:25:46,Delighted to take part in @PostcodeLottery free funding workshop for local charities and not-for-profit organisations on Friday at Iveagh Hall.pic.twitter.com/u2gwEBZRFu
2018-07-13T10:10:56,"Yesterday I called for a debate on 'Do Not Resuscitate' protocols in hospitals. This is a profound and dark subject, but it is certainly one that Parliament should consider.pic.twitter.com/68GAO75hWj"
2018-07-13T06:21:46,Looking forward to @PostcodeLottery charity funding workshop in Southend-on-Sea today with local MP @amessd_southend
2018-07-12T14:35:49,"Thank you @England for making us roar again! Football does matter and they exceeded our wildest expectations. Yes, football is coming home!pic.twitter.com/yWuvF9lvOL"
2018-07-12T08:55:45,Delighted to attend the launch of the @U3A_UK impact report in Parliament earlier this week. Here is a message from myself and U3A Chairman Pam Jones. #LearningNotLonelypic.twitter.com/7tnvfXDYld
2018-07-11T16:23:08,I wish the England football team good fortune in their match against Croatia. Our whole nation is urging them to win. My dream is that we bring the World Cup back home. Football’s Coming home! #ENGCROpic.twitter.com/0zgHlLE7dC
2018-07-06T09:16:49,"During BQs yesterday morning, I asked @CommonsLeader for a debate on the inequalities of the provision of PIP for blind people. Concerns have been raised about the disparity in the age at which payments can be made therefore I am glad this issue has now been clarified.pic.twitter.com/xLRh8JHmQQ"
2018-07-05T15:44:49,Yesterday I reaffirmed my support for the Ivory Bill during its Third Reading. I am delighted action is being taken to eradicate the ivory trade and I welcome the Government's ambitious new plans to tackle illegal wildlife trade across the world.pic.twitter.com/ZfS49LSSIp
2018-07-05T12:08:43,"On the NHS' 70th Birthday I would like to thank and pay tribute to all the men and women who work/have worked in the service for their dedication to public health. Long may the NHS, which is the envy of the world, continue to be a free service! #NHS70"
2018-07-03T13:18:13,Delighted to meet with @feedthehungryuk to discuss their wonderful work to deliver food and supplies to those who need it most. Feed the Hungry UK's Hand to Hand events bring together communities to help some of the poorest children across the globe.https://www.youtube.com/watch?v=00-3LEeVanA …
2018-06-30T15:54:52,".@amessd_southend : We stand united with every &amp; each one of you in your battle and I’m sure that our message of a free &amp; democratic #Iran will echo all the way to #Tehran, to cities &amp; towns across Iran, shaking theocracy to its core
#IStandWithMaryamRajavipic.twitter.com/udntwmt5kA"
2018-06-30T16:34:09,The  delegation take the stage with @amessd_southend @Offord4Hendon @RogerGodsiff #TheresaVilliers #freeiran #Freeiran2018 @Maryam_Rajavi @Baroness_Vermapic.twitter.com/3HJw7dXxP4
2018-06-28T10:39:54,During BQs today I asked @CommonsLeader for a debate on noise pollution. It is clear that more can be done to tackle noise pollution in all its forms therefore I am delighted to hear that @DefraGovUK will be looking into how we can effectively manage noise in the coming months.pic.twitter.com/5yESeh1Gal
2018-06-26T16:00:16,The results of the Parliamentary Photographic Competition 2018 will be announced at an Opening Ceremony in the Upper Waiting Hall on Monday 2nd July at 3.30pm. Following this a reception will be taking place in Dining Room B between 4pm and 6pm.
2018-06-23T13:29:43,"A busy day for our @ECFRS @EssexFireCar #RoadSafety team . Our @essex_audi S3 is Currently at #LeighOnSea for their open day, time for a quick pic with @amessd_southend . This evening our team will be engaging with #modifiedcarclubs at an event in #Southend. @SaferEssexRoadspic.twitter.com/Y2K0pRIk20"
2018-06-22T15:54:12,Patron @amessd_southend says: “It’s totally unacceptable that in 2018 we are still exporting live animals. If there’s one big benefit of leaving the European Union -it’s that we will be able to ban the live exports of animals” in Parliament Square 14 June #StopLiveTransportpic.twitter.com/U869kkXmf5
2018-06-20T16:43:42,"In the year of the NHS' 70th Anniversary I am delighted that this Conservative Government is increasing funding for one of our proudest institutions. We have pledged:  
- An extra £20.5bn in funding 
- A 3.4% increase in funding per year 
- An extra £4.1bn just next year "
2018-06-15T11:26:10,"During Business Questions yesterday morning I asked @CommonsLeader for a debate on illegal encampments. As the consultation is about to finish, I very much hope the Government will take the advice of my colleague Mark Francois MP and adopt the Irish option.pic.twitter.com/AihWPD7h0j"
2018-06-14T15:24:56,Please see the following notice on my website regarding the European Union (Withdrawal) Bill.https://www.davidamess.co.uk/news/notice-regarding-european-union-withdrawal-bill …
2018-06-14T12:09:59,Sir David Amess MP explains why everyone should care about banning live exports! @amessd_southend @ConservativeAWF #StopLiveTransportpic.twitter.com/925tD3VfBE
2018-06-13T11:05:58,"Yesterday I led a Westminster Hall debate on eliminating hepatitis C. Following the launch of the @APPGLiverHealth report, I urged the Minister to listen to our recommendations in order to achieve the eradication of hepatitis C in the foreseeable future.pic.twitter.com/yMjM0gcYO7"
2018-06-11T18:34:18,The 10 last survivors of the 101 new Conservative Members of the 1983 intake to the House of Commons #tempusfugitpic.twitter.com/86FadG7tp8
2018-06-05T19:54:58,"In @UKParliament 4 June, the Second Reading took place of the Ivory Bill to bring the #UKIvoryBan into law.  Sir David Amess @amessd_southend mentions STAE &amp; also STAE board member Lorraine Platt @ConservativeAWF gets a much-deserved mention. https://bit.ly/2LnLXQR  #elephants"
2018-06-05T14:05:34,"Join @PeterEgan6, @emmamilnethevet, @HenrySmithUK, @amessd_southend, @ConservativeAWF and @BroomDonald in supporting a UK import ban on cruel foie gras!

#FoieGrasFreeGB
http://animalequality.org.uk/foie-gras/ pic.twitter.com/RfNbhGI5np"
2018-06-05T12:48:22,A big thank you to fantastic Blue Fox Patron @amessd_southend for his very kind words in his speech at the second reading of the #IvoryBill in Parliament on 4 Junepic.twitter.com/ta1223QxLF
2018-05-24T12:12:20,Very pleased that yet again @amessd_southend MP took time out of his busy schedule to support our campaign to protect wildlife and stop #wildlifecybercrimepic.twitter.com/RzwsCsj4IC
2018-05-22T16:19:29,"Great to meet with Emma Cox, CEO of @EndometriosisUK during this afternoon's APPG on Endometriosis meeting. Interesting to discuss how Endo UK, @WomenWithEndo and the APPG can work together to make a real change for those who suffer from the condition."
2018-05-21T10:05:30,"A wonderful thread by a wonderful charity. This week I'll be wearing my butterfly badge for #ChildrensHospiceWeek, will you? #LifesShorthttps://twitter.com/Tog4ShortLives/status/995983783550705664 …"
2018-05-21T09:44:41,"Proud to support the WE100 campaign to celebrate the beauty of ageing. Read more about it in my interview with The House, Parliament's magazine. Let's make it to 100! http://library.myebook.com/thehouse/the-house-magazine-issue-1615-14-may-2018/1201/#page/28 …"
2018-05-18T15:05:27,Delighted to reaffirm my support for animal welfare in the UK and internationally by calling for a ban on all imports of fur to the UK. Calling for a #FurFreeBritain! @HSIUKorgpic.twitter.com/JnSz0cyXtH
2018-05-18T11:52:31,Yesterday I asked @CommonsLeader for a debate on the availability of private rental properties for disabled people. Glad to hear the Government is taking this matter very seriously.pic.twitter.com/ypg65aKXSk
2018-05-17T14:30:00,The All-Party Parliamentary Fire Safety &amp; Rescue Group is determined to continue it's fight for a ban on combustible cladding. See my question to the Secretary of State following his statement below.pic.twitter.com/vZQaa6YZHG
2018-05-17T12:43:33,I welcome the wide-ranging reforms proposed in Dame Judith Hackitt's report today. Glad also to hear from @JBrokenshire that the Government will start a consultation on banning combustible materials on high rise tower blocks.
2018-05-17T09:06:35,Yesterday's debate on the Grenfell Tower disaster presented an opportunity for the APPFSRG to present it's recommendations to @JBrokenshire &amp; @DominicRaab. Action must be taken to prevent tragedies like this from ever happening again.pic.twitter.com/Tr34a6KM2f
2018-05-15T08:35:52,Calling all independent &amp; student filmmakers - fancy having your film judged by a national panel of industry experts? Get your short film entry to #filmthehouseUK in by 30 September http://www.filmthehouse.co.uk pic.twitter.com/WZhrfzEU7j
2018-05-11T16:22:55,"Thank you to our Patron @amessd_southend for speaking on his support for the ban on fox hunting  &amp; for his speech to end live animal exports, pig farrowing crates &amp; more in his talk on animal welfare at @ElmbridgeCons @cwowomen lunch event  todaypic.twitter.com/5es1hixpP7"
2018-05-11T15:41:09,Thank you to @amessd_southend &amp;  @DUNWEBER the Chairwoman of @ElmbridgeCons Conservative Women’s Organisation for kind support to end live animal exports at local @cwowomen event todaypic.twitter.com/ch4hn0EhFm
2018-05-11T15:51:49,". @amessd_southend delivers a  fantastic talk on animal welfare- to end live exports, pig farrowing crates &amp; to introduce method of production labelling &amp; more at @ElmbridgeCons @cwowomen lunch event today in Surreypic.twitter.com/9NuSc39Cdd"
2018-05-11T10:09:18,Absolutely right for @amessd_southend to raise removal of the portrait of @theresa_may from @UniofOxford’s Geography dept; a pathetic attempt to denigrate our second female PM. Protecting free speech and expression means defending achievements of our country's best and brightest.pic.twitter.com/7t0Mucb3yM
2018-05-10T12:11:13,The UK is a world-leader when it comes to the music industry and Southend certainly has a wealth of musical talent. During @DCMS questions this morning I asked @MattHancock what further assistance the Government is giving to aspiring performers.pic.twitter.com/O2CeSCZAdL
2018-05-10T08:57:29,Thanks to @amessd_southend for highlighting to @DCMS Ministers the need to support aspiring performers across the music industry #DCMSPQS
2018-05-09T14:15:39,"Approximately half of people with cancer exhibit psychological complications. In order to help patients manage fear, anxiety and depression specialised skills are required. This Pacific Medical Training article outlines how sufferers can be helped: https://pacificmedicalacls.com/first-aid-for-people-with-cancer.html …"
2018-05-09T12:50:09,Thanks to @amessd_southend for attending the launch of our report on mental health and #rarediseasepic.twitter.com/2oa9BnJWCA
2018-05-09T08:36:24,In order to put an end to this cruel practice we must prevent our own holiday firms and tour companies from advertising encounters with these animals. A shocking and unfortunately very real report:https://www.thesun.co.uk/news/6180080/we-expose-india-tourism-brutal-treatment-elephants/ …
2018-05-08T16:00:29,Today I met with survivors and relatives of those who lost their lives in the Grenfell Tower Fire. It was heartbreaking to hear about their experiences and I hope our work with @GrenfellUnited will prevent tragedies like this from ever happening again.
2018-05-08T09:56:58,If you have any suggestions on how to develop physical activity in primary schools you can put forward your views to @_ukactive who are collecting evidence for their latest Generation Inactive report. The consultation is open until Friday 1 June at 5pm.https://ukactivekids.com/#ukactive-kids-physical-activity-sector-physically-active-have-your-say …
2018-05-04T16:27:05,"Great to hear also that Basildon Council is now back under the control of the Conservatives. Every Conservative candidate in Basildon, Thurrock, Rayleigh and Rochford should all be extremely proud of their hard work."
2018-05-04T15:39:31,Delighted that local residents have endorsed the work thus far of the @Conservatives group on Southend Council and indeed strengthened their position. I now look forward to working closely with the Conservative controlled council to regenerate Southend.pic.twitter.com/Dofr3FJYkC
2018-05-02T20:46:16,Sir David Amess MP @amessd_southend supports a ban on the import of Foie Gras at tonight’s  @AnimalEquality parliamentary reception to end the cruel practice hosted by @HenrySmithUKpic.twitter.com/EqcuNnO8Ss
2018-05-02T16:23:49,"Real pleasure to meet @SNewtonUK, Minister for Disabled people. Thank you for your time and encouragement. Thanks to patron @amessd_southend for arranging.pic.twitter.com/XOnQ19d687"
2018-05-02T16:38:22,"Since the Conservative Party took control of Southend’s local authorities in 2016 we have invested in new homes, better public services and improved infrastructure. If you care about these issues make sure you vote for your local @Conservative candidate in #LocalElections2018pic.twitter.com/QRw9fWj8Gi"
2018-05-02T15:05:31,"Best of luck to everyone standing in #SouthendWest - make sure you vote for @amessd_southend's #Conservative Team tomorrow to give you a strong and fair voice that listens to, and cares for, the local community.pic.twitter.com/YCc72pn0zk"
2018-05-01T13:30:32,Proud to support @WildlifeTrusts and their Nature Recovery Network. This initiative seeks to connect urban and rural green spaces and protected areas throughout the UK #naturenetworkpic.twitter.com/iYnNItyeJ6
2018-05-01T09:04:45,"Our @Conservatives Government is determined to ensure that the UK remains a global leader in animal welfare standards. Here's what we have done so far: 

- CCTV in slaughterhouses 
- Ban on ivory sales 
- Ban on microbeads 
- Increased animal cruelty sentences pic.twitter.com/GFTg3ZrOD5"
2018-04-28T12:44:20,Proud to have the support of both Southend MPs @JamesDuddridge and @amessd_southend for my Thorpe Ward campaign. #torycanvasspic.twitter.com/P6fqZXtzDp
2018-04-27T15:10:55,"A HUGE THANK YOU to everyone who joined @SBCCExec @JamesDuddridge @amessd_southend @markkass @enterprise4good &amp; @thehivesouthend Members, Supporters, Sponsors &amp; cake-loving networkers at today's  #VoteSouthendDL100 #techcityonsea @DigiLeaders photocall ! Most Appreciated!pic.twitter.com/hTH6XFZ2Kh"
2018-04-27T10:25:16,"Yesterday at @CommonsLeader Qs I asked @andrealeadsom for a debate on the future of the National Fund, a charity whose purpose is to pay off the final amount of the UK's national debt. Set up in 1927 by an anonymous donor, it is now worth almost £500m.pic.twitter.com/xYbLYGcsM0"
2018-04-27T09:55:55,Make sure you vote for Southend Tech City-On-Sea in the Digi Leaders 100 awards! Follow the link to vote now! https://www.digileaders100.com/categories/  #VoteSouthendDL100 #DL100pic.twitter.com/GctZGWBLYc
2018-04-25T12:34:07,"Thank you to @amessd_southend for attending our MP drop-in and taking a #StandAgainstSuicide.

More info  http://thecalmzone.net pic.twitter.com/E73qpd1wY7"
2018-04-26T09:32:26,Important discussion on the upcoming Offensive Weapons Bill with Home Office Minister Victoria Atkins MP yesterday morning. Following my call for a review into the recent escalation in knife crimes I am delighted that work is being done to address the situation.pic.twitter.com/ir6Cggm7pv
2018-04-25T13:24:20,"At Southend Hospital we have over 1,200 nurses who work tirelessly 24/7 to provide excellent care for our local population. Because of their inspirational work I am supporting Nurses' Day to say thank you. @theRCNpic.twitter.com/KSYN0FKXos"
2018-04-25T09:56:56,Great to have @theresecoffey in Southend to join the local election campaign alongside our @Conservatives candidates on Saturday. #LocalElections2018pic.twitter.com/3pd86GYFlX
2018-04-25T09:18:35,"Thanks to @amessD_southend, @AndrewRosindell, the in house guides and other MPs supporting us, our clients, their constituents and taxpayers in seeking a review of the decision to ditch quality #parliamenttours. Please RT to get more colleagues on board before today’s meeting!"
2018-04-24T14:46:35,I was delighted to join Rabbi Warren Elf and the congregation of Southend and District Reform Synagogue on Saturday to celebrate the 70th anniversary of the independence of the State of Israel.pic.twitter.com/YRy2mFPgfz
2018-04-19T09:07:00,Recently I have been working with @DiabetesUK to bring about change in the way consumers shop for food products. Tackling unclear food labelling is an essential measure needed to improve not only people's health but also their knowledge of the origins of their food. @ciwfpic.twitter.com/u8RPO68awt
2018-04-18T09:50:52,"Today's job figures show wages are ahead of prices, meaning more money for hardworking families. I'm proud that we delivering a strong economy to ensure Britain is fit for the future!pic.twitter.com/Aom4QU4qHb"
2018-04-17T15:23:04,"Delighted to discuss numerous local issues with @SBCCExec such as access issues for emergency vehicles, pot holes in the borough and city status today in Westminster.pic.twitter.com/DGVGXIbSxO"
2018-04-11T16:25:50,"The situation in Syria needs to be addressed cautiously. What we have seen is a devastating humanitarian issue and those responsible must be held to account. The solution is to develop a strategy, with the approval of Parliament, that takes into account all factors.pic.twitter.com/OdCr4dpBFK"
2018-04-11T13:56:44,"In January I asked the Minister for Security to commit to ensuring members of the public and organisations such as charities receive better protection from cyber crime, therefore this announcement is welcomed.https://twitter.com/Conservatives/status/983968685051273216 …"
2018-04-11T11:09:33,"This World Parkinson's Day, I'm proud to join the global community to unite and show what Parkinson's truly is. #UniteForParkinsonspic.twitter.com/9DnPCCUOLc"
2018-04-11T08:56:36,Delighted to join my fellow Essex MPs to support the Love Essex NHS campaign. There is no system quite like our National Health Service anywhere in the world and we are particularly blessed with a fine hospital in Southend. @LoveSouthendNHSpic.twitter.com/vpKnLFAZUR
2018-04-10T14:52:29,Yesterday I spoke to @DaveMonkShow on @BBCEssex  about free school meals. You can listen to my interview from 1hr 42mins:https://www.bbc.co.uk/programmes/p061tkp5 …
2018-04-07T10:06:34,Great #ToryCanvass team out this morning supporting my fantastic neighbour @amessd_southend in #Southend with @aliciakearnspic.twitter.com/MBGx64LZzw
2018-04-05T14:17:29,"Out speaking to residents with Floyd, Helen and @JamesCourtenay in Blenheim Park ward.pic.twitter.com/KkH1Wtzmin"
2018-04-03T15:23:25,A momentous and comprehensive announcement by @michaelgove which aims to end elephant poaching once and for all. The UK is leading the world on the subject of animal welfare yet again.https://twitter.com/Conservatives/status/981098706987610112 …
2018-03-28T15:26:03,"I welcome the news that 150 new police officers will be recruited to keep local communities in Essex safe. With this increase, a wide range of policing capabilities will be improved including cyber crime prevention, community policing and operational support. @EssexPoliceUKpic.twitter.com/iV3uEZqBeY"
2018-03-28T10:20:27,Great to hear that we are taking a step forward and will be introducing a #DepositReturnScheme in England for single use drinks containers. This will increase recycling rates  and slash the amount of waste polluting our land and seas. @SkyOceanRescuehttps://www.google.co.uk/amp/s/news.sky.com/story/amp/govt-to-launch-deposit-return-scheme-for-single-use-bottles-in-england-11306448 …
2018-03-27T10:57:40,Twenty countries have expelled over one hundred Russian diplomats in the wake of the Salisbury nerve agent attack. This is an overwhelming response from our friends and allies to such a blatant violation of international law here in the UK.
2018-03-22T17:11:23,"Following recent adverse weather conditions, 280 potholes were repaired within the first week thanks to an extra £100,000 of funding from Southend Borough Council.pic.twitter.com/3UNeofSzpz"
2018-03-21T16:25:52,"With the exceptional context of a deadly virus now being fully curable with easily deliverable, highly cost-effective medicines, finding those still undiagnosed and living with hepatitis C should be a national ambition. @HepatitisCTrust https://www.huffingtonpost.co.uk/entry/we-must-not-waste-a-once-in-a-generation-opportunity_uk_5ab11cb8e4b0675a615b9d4b …pic.twitter.com/0Mj2OmyQ4R"
2018-03-20T12:56:15,"Delighted to take part in this @ClearlyWorld video for an important cause. 2.5 billion people suffer from poor vision without access to treatment. Most only need a pair of glasses. At @Commonwealth18, #OurCommonwealth leaders must address this. Let's get #GlassesOn at #CHOGM2018.pic.twitter.com/Y4ebixl83G"
2018-03-20T11:03:22,Thank you to @amessd_southend for coming to our event and showing support for @hanseizuremum as she meets MPs before delivering the petition with Alfie to the @ukhomeoffice at @10DowningStreet this afternoon #alfieshope #endourpainpic.twitter.com/G2orsoS1X9
2018-03-16T15:27:02,"It’s shocking that so many new mothers aren’t getting the help they need, therefore I'm supporting NCT's excellent #HiddenHalf campaign to improve services in Southend and across the UK.pic.twitter.com/cl5bNLrtSL"
2018-03-16T12:57:28,"During Business Questions yesterday, I asked the Leader of the House for a debate on food labelling. It must be easy for consumers to understand the effects the food they buy has on their health and the animals involved therefore clearer labelling is needed.pic.twitter.com/dc2NdYw1J1"
2018-03-15T14:09:24,Yesterday we launched the APPG on Endometriosis in Parliament. It was great to discuss with colleagues and @WomenWithEndo how we can help increase awareness and improve the lives of those who suffer from the condition.pic.twitter.com/JiQLdLrTYT
2018-03-15T12:19:17,"Following @MusicManProject World Record achievement, yesterday I asked the Prime Minister if she agrees that this is yet another reason why Southend should be made a city. #TinklingTrianglespic.twitter.com/55jNYWUa2L"
