2018-04-11T09:00:07,"My staff and I are working to be better equipped to improve the lives of everyone affected by Parkinson's in Southport, and better understand the issues faced by those who come to my advice surgery.

Please show your support for @ParkinsonsUK #uniteforparkinsonspic.twitter.com/iYWZcafkTp"
2018-04-10T16:00:21,"Transport is an important part of my plan for Southport. Our town thrives on the commuters who travel out and the tourists who come in. That's why I'm so disappointed by @northernassist's plans. 

Read more here: https://buff.ly/2qjC92g pic.twitter.com/yw9YdusV7P"
2018-04-10T14:00:25,One of my favourite memories from the 2015 General Election. When the wonderful Matthew Parris came up to Southport and charmed the whole room #Tbtpic.twitter.com/m95qx3ES7A
2018-04-10T13:00:36,My family is one of thousands that've had to deal with the pain of a diagnosis. I hope that @theresa_may's important initiative will eventually prevent others from experiencing it: https://buff.ly/2qkwjO9 pic.twitter.com/JLZgS9MItE
2018-04-10T11:00:06,"Our government has given Sefton Council nearly £500,000 in funding for potholes, but I don't feel we're seeing this money on our streets. If you see any potholes on Southport's roads, please report them to the council. Find out how by click this link: https://buff.ly/2qafa9J pic.twitter.com/kr8N4PzRKl"
2018-04-10T09:00:02,"Twenty years later, the #GoodFridayAgreement is still the best way to bring together people in Northern Ireland and negotiate a better future for everyone."
2018-04-09T15:00:28,"The RAF's continued success is a testament to its strength, ability, and courage. 

I was grateful for the chance to speak about these values while commemorating the service's centenary yesterday.pic.twitter.com/JrvS7X41OP"
2018-04-09T13:00:42,"I recently asked Merseyside Police to introduce 'knife wands' in Southport, with funding provided by the Home Office. The trend in knife crime worries me, and we need to be vigilant.pic.twitter.com/EBSjWrqsPS"
2018-03-30T22:42:15,What a great day and night at Fylde Fish Bar for Good Friday 2018! Thank you to all those that visited us tonight and for all your patience waiting to get our award winning fish and chips! #GoodFriday2018 #visitsouthport #teamworl #northwest https://www.facebook.com/293175650693/videos/10160345395060694/ …
2018-03-21T18:04:57,Thank you @damienmooremp for taking time to chat to us about the importance of diagnosing brain tumours early. We look forward to working with you on @HeadSmartUK #BTAM18pic.twitter.com/bW4r4TlDDN
2018-03-21T15:10:34,Pleasure to introduce @damienmooremp to our member @Jewish_Care today in Parliament. Thank you for taking the time to meet with us.pic.twitter.com/HYSWBJcxr4
2018-03-21T15:30:28,"English MPs proudly showing support for #EnglishTourismWeek at a meeting with Tourism Minister @Michael_Ellis1 where they also learned more about @VisitBritainBiz 's new campaign, I Travel For. #ETW18 @HuddlestonNigel @damienmooremp @Patrick4Dales @KeithSimpsonMPpic.twitter.com/MeCoZJkafd"
2018-03-16T16:00:06,"If you have an issue or concern you would like to raise with me, please get in touch.pic.twitter.com/Y7ZEQqJE5E"
2018-03-16T10:00:08,"Small Business Saturday UK returns on 1st December 2018. Are you a local business?  Register for a chance to be featured in ""Small BIZ 100"" campaign. Let's support our local businesses, not just on 1st December, but throughout the year! #shoplocal https://buff.ly/2IlyNTM pic.twitter.com/dgk6o3pexQ"
2018-03-15T16:00:07,Delighted to meet with Cheif Superintendent Matt Boyle and Inspector Graham Fisher last weekend to discuss Operation Castle.pic.twitter.com/kpe7N5Ay3m
2018-03-15T14:00:59,"Last week I asked a question to the Parliamentary Under-Secretary of State at the Department of Environment, Food, and Rural Affairs about plastic debris on beaches in Southport. You can watch my question here.pic.twitter.com/hv1skn2qxY"
2018-03-15T10:00:00,"I strongly support my party's initiative to see more women represented across our Party.  If you're a woman who wants to stand and make a difference for your community, express your interest by following the attached link. #askhertostand https://buff.ly/2IpNm94 "
2018-03-14T14:00:46,How dare Vince Cable come to my constituency to insult older voters | BrexitCentralhttps://buff.ly/2tGqw9U 
2018-03-14T10:00:05,"Yesterday I voted in favour of new eligibility criteria for free school meals which will mean 50,000 more children will benefit from a free school meal by 2020 when compared to the previous benefits system under Labour.pic.twitter.com/8Rw0pyyQP3"
2018-03-13T16:01:03,How dare Vince Cable come to my constituency to insult older voters | BrexitCentralhttps://buff.ly/2tGqw9U 
2018-03-13T14:00:05,"Today, the Chancellor unveiled his Spring Statement, showing that our economy continues to grow and is almost 17% bigger than it was in 2010. Meanwhile, Labour's new borrowing plans would cost £106 billion - amounting to an extra £3,907 more debt for every household in Britain.pic.twitter.com/5JLzvOkYv8"
2018-03-06T14:00:29,Fully support the @Conservatives #RespectPledge ahead of this year’s local elections.pic.twitter.com/fxQc83N03p
2018-03-05T16:00:04,"Glad to see Schools and colleges in England will receive £600 for every additional pupil who takes an advanced maths qualification, which will help young people get the skills they need for the future so they can go as far as their talents will take them.pic.twitter.com/xZKPM6PqQe"
2018-03-03T23:12:16,"Today I launched the @Conservatives #RespectPledge ahead of this year’s local elections.

Democracy has always been robust and oppositional but a line is crossed when this becomes abuse and intimidation.pic.twitter.com/bWcrDEfWkB"
2018-02-27T10:00:20,We are increasing Armed Forces mental health funding to £220 million over the next decade and have launched a 24/7 Military Mental Health Helpline so that all our courageous troops and their families know there is somewhere to turn in times of trouble.pic.twitter.com/IdNZJFyhfP
2018-02-25T15:05:55,Agree. Surely we can disagree on Twitter without threatening to kill each other?https://twitter.com/debhazeldine/status/967751900664881153 …
2018-02-23T11:02:47,Morning meeting at Crossens Nursey School. Now onto my second constituency meeting.pic.twitter.com/KTQIG6U1LS
2018-02-22T09:55:37,Great to receive the support of @damienmooremp. Backing our lifesaving campaign for a defibrillator in every single school across the UK. #SaveLives http://www.theoliverkingfoundation.co.uk pic.twitter.com/cAxDaQ7Na8
2018-02-20T18:18:25,.@damienmooremp says his 10-min rule bill escalates some of the Eric Pickles recommendations on postal voting in his role as anticorruption champion
2018-02-20T18:17:02,"Ten Minute Rule Motion: Postal voting, moved by @damienmooremp, is starting now http://parliamentlive.tv/event/index/94cdc6e8-d337-41d8-a354-63d1ae4c8b58?in=18:16:11 …"
2018-02-20T12:34:50,"From 2:30pm: prayers, FCO Qs, one UQ, three ministerial statements, then @damienmooremp 10 min rule bill on postal voting. After that, #SAMLBill second reading. Then petitions and finally, the adjournment debate."
2018-02-19T17:00:42,"MUST WATCH: Conservative MP for Southport, @damienmooremp speaks about his visit to Israel with @CFoI last week, encourages fellow MPs to visit Israel: ""If you want to understand this place better, you've got to visit it""pic.twitter.com/I5mIR5bLvR"
2018-02-08T16:10:16,READ: Conservative parliamentarians attend CFI briefing with Israeli Minister of Science and Technology @OfirAkunis https://cfoi.co.uk/conservative-parliamentarians-attend-cfi-briefing-with-israeli-minister-of-science-and-technology/ …pic.twitter.com/ZbJ7thA1l5
2018-02-12T22:14:33,PHOTO: Conservative parliamentarians on @CFoI delegation meet @innoafrica's @DovLipman for a lively dinner discussion about Israeli politics &amp; Israel's humanitarian effortspic.twitter.com/SWB040bFh0
2018-02-13T19:46:42,"Thanks to British Ambassador @DavidQuarrey for hosting @CFoI delegation of MPs &amp; Lords this evening, with informative dinner discussion on UK-Israel ties &amp; briefing from @UKIsraelHubpic.twitter.com/cSQtS6I8TQ"
2018-02-14T13:16:21,"PHOTOS: Leading Palestinian pollster @KShikaki briefed Conservative MPs &amp; Lords today in Ramallah about the latest trends in Palestinian &amp; Israeli public opinion polls, based on his recent research: http://www.pcpsr.org pic.twitter.com/epc1lnjC45"
2018-02-10T15:43:02,At #CW18 with @DavidRutley @damienmooremp @CGreenUK Fantastic discussion on campaigning to win!pic.twitter.com/hpAgDxr5Yc
2018-02-10T14:00:45,Time to hear from @DavidRutley @damienmooremp &amp; Chris Green MP at #CW18pic.twitter.com/qTmXVuJFSb
2018-02-10T12:45:21,Great to see @damienmooremp supporting the @CandWTories #CW18 conference in #Chester this afternoon!pic.twitter.com/S1ctoRJBoZ
2018-02-08T13:52:58,"Following Tuesday's #Vote100 celebrations, @damienmooremp called for a debate on encouraging more women to stand for public office in business Qs earlier.
http://parliamentlive.tv/event/index/a02b1462-fb97-4aae-a8cd-f67e9fd1226c?in=11:41:09&amp;out=11:42:10 …pic.twitter.com/QQuxWwa1zf"
2018-02-08T10:20:00,Our #apprenticeship lead Vicky Kearney joined @AnneMilton Minister of State for Apprenticeships &amp; Skills &amp; Southport's @damienmooremp on a visit to @southportcoll with Trust students past and presentpic.twitter.com/Q1kiwb48a4
2018-02-08T10:00:24,I was delighted to visit the Tate &amp; Lyle Sugar Refinery in the Docklands area of East London. The company has had a factory on the same site for over a century and is an example of a British business that has a global outlook; importing sugar cane from all over the world.pic.twitter.com/8ITn35GKmD
2018-02-07T18:06:20,Israel's Minister for Science and Technology @OfirAkunis meets Conservative parliamentarians at @CFoI briefing in Parliamentpic.twitter.com/RXco9qh5LW
2018-02-07T16:01:28,Thank you @KatiePrice for coming to @HoCpetitions yesterday to give evidence on online abuse. The comments your son Harvey has received are truly shocking and I admire the dedication and courage you have shown to tackle the problem.
2018-02-07T14:01:22,We all have a role to play in protecting our oceans – that’s why I have signed my pledge to #PassOnPlastic and encourage others to do the samepic.twitter.com/6xHge26xOV
2018-01-26T15:14:22,We were pleased to welcome @damienmooremp to our Wastewater Treatment Works in Southport today. It was great to give a tour of the site and talk about our priority services scheme in the area.pic.twitter.com/Y4SSiSc0j8
2018-01-20T17:19:09,"A wet day out today with @damienmooremp and special guest @CGreenUK! Thanks to all who lent a hand, and to local residents for taking the time to chat.pic.twitter.com/coVfa864GJ"
2018-01-12T10:00:01,Good luck to @FyldeFishBar who are in the running to be the UK's best fish and chip shop. I ate there the other week and they're worthy contenders!
2018-01-11T16:00:03,"Today the Prime Minister is launching the 25 Year Environment plan, highlighting our steps for a cleaner, greener Britain that will leave our environment in a better state than we found it for the next generation.pic.twitter.com/8l1QeMOPDC"
2018-01-11T14:01:15,"This morning, I met with Age UK to discuss the Governments plans to launch a social care Green Paper on behalf of residents living in Southport. https://buff.ly/2DnlLmV "
2018-01-10T16:01:12,My comments in the local Southport Visiter regarding our hospital this winter:https://buff.ly/2D11fuu 
2018-01-09T12:00:15,"Today, our ban on microbeads comes into force, helping to protect our oceans and sea life as we lead the way on tackling the problem of plastic waste.pic.twitter.com/1PY1HjOCa2"
2018-01-09T10:00:25,My response to another attempt by Southport Labour to undermine our local hospital: https://buff.ly/2D65UJd 
2018-01-08T16:00:40,Congratulations @BrandowLewis &amp; @JamesCleverly. You're welcome to make Southport your first stop on the 2018 campaign trail!
2018-01-08T14:00:27,"We're supporting the creation of a new Northern Forest - spanning more than 120 miles between the cities of Bradford, Leeds, Manchester and Liverpool - providing a rich habitat for wildlife to thrive, and a natural environment for millions of people to enjoy.pic.twitter.com/yrmig9KqyO"
2017-12-20T12:56:15,@prestonlabour @SouthRibbleLab @SRConservatives Touched to get lovely postal messages of support for my health from @SeemaKennedy and @damienmooremp Not joining Tories though!
2017-12-09T21:08:01,Did you catch the Thorntons Christmas advert? A 2% donation will be made to SSAFA when you purchase a box of chocolates from the continental range. Buy here: https://buff.ly/2AkZKa1 pic.twitter.com/LJ6QuOw7Qc
2017-12-07T19:26:41, Some serious sour grapes from the SNP here. They really can’t stand the fact that 13 @ScotTories MPs have shown them up by #DeliveringForScotland in the budget. The only thing 56 SNP MPs achieved in 2 years was no Sunday trading in England http://www.heraldscotland.com/politics/15708358.SNP_disputes_claim_Scottish_Tories_influenced_budget/ …
2017-12-07T15:31:56,Joining @Alison1mackITV for tonight’s @Granada_Debate @damienmooremp ; @Debbie_abrahams and @Rachaelorrsome @oxfamgb - 10:45pm @ITVpic.twitter.com/5mRmoD4JB3
2017-12-07T15:30:22,Joining @Alison1mackITV for tonight’s @Granada_Debate @damienmooremp ; @Debbie_abrahams and @Rachaelorrsome @oxfamgb - 10:45pm @ITVpic.twitter.com/ELqLajc400
2017-12-06T18:00:50,"Great to see you support #SmallBizSatUK! Will you sign up to our Thunderclap for #SmallBizWonders and boost smaller businesses across the country?
https://www.thunderclap.it/projects/65594-small-business-wonders …"
2017-12-02T17:04:56,More pictures from my Lord Street tour for #SmallBusinessSaturday #SmallBizSatUKpic.twitter.com/B5BtmEXsLZ
2017-12-02T17:03:14,"This afternoon I’ve been out talking to businesses on Lord Street and surrounding areas about Small Business Saturday UK. A big thank you to Connard Jewellers, Lillibet’s, Mind Games, Southport Market, Retro Culture, Dad’s Guitars, and Wayfarers Arcade.
#SmallBusinessSaturdaypic.twitter.com/xXYF0aEYS0"
2017-12-02T12:50:08,Supporting Small Businesses in Birkdale on #SmallBizSatUK #SmallBusinessSaturdaypic.twitter.com/VWGxiuzgGd
2017-12-02T12:47:21,"This morning I’ve been speaking with entrepreneurs in Birkdale Village about the local economy and how I can help champion their business.

Thanks to Stanley’s Fruit Stores, Croziers, The Cheese Centre, The Tea Rooms, Brough Butchers, and June the Florist.
 #SmallBusinessSaturdaypic.twitter.com/BYQMBpBFFM"
2017-12-02T11:00:27,"Onto Bates Farms and Dairy in Birkdale, a local family-run business which has been operating in Southport for 78 years. Great to see their business doing well and continuing to distribute across the north-west. Thanks to Chris and the team. #SmallBizSatUK (2)pic.twitter.com/opNttEulL9"
2017-12-02T10:59:35,"First stop, Langdons for one of the best breakfasts in Southport. #SmallBizSatUKpic.twitter.com/mYh9RMf8OX"
2017-12-02T09:50:54,"Today is Small Business Saturday UK.

I’ll be out across Southport meeting with business owners to discuss what more we can do to support our town’s economy and to encourage residents to buy local.pic.twitter.com/RanK1e2Z6k"
2017-12-01T16:00:31,"This afternoon I hosted a drop in session at Asda. Speaking to residents and shoppers about local and national issues. Also great to speak with Will, the store manager (pictured below).pic.twitter.com/qpdepAi7Jx"
2017-12-01T14:55:56,Speaking at The Older Persons Forum in Southport this morning. Happy to support their campaign for a Minister for Older People.pic.twitter.com/dyaAOiYao2
2017-11-29T12:50:51,"The Transport Secretary, Chris Grayling has today announced a bold Rail Strategy that will expand the rail network- making life better for commuters, unlocking potential for housing developments and boosting jobs.pic.twitter.com/sJ9dBMJ5ZH"
2017-11-24T12:23:31,My response to Southport Labours ridiculous misconception and fake news on animal welfare... https://goo.gl/1xnixf .
