2018-05-01T15:47:59,Attended APPG on Freedom of Religion or Belief today to meet Elder Christofferson from Church of LDS &amp; Dr Daniel Mark. @stephenkerrMP @JimShannonMPpic.twitter.com/ndzo8T8LWX
2018-05-01T10:04:18,Spoke in Chamber last night about Energy Price Cap. #CapTheGap @JohnPenroseNews https://goo.gl/ceXYbx 
2018-04-30T15:00:02,Starting now: our session on planning guidance on #fracking. Watch live here: https://parliamentlive.tv/Event/Index/d1ca0d59-f5aa-4eda-9ccb-216370e0ac03 …
2018-04-30T08:48:18,#BestofBritishhttps://twitter.com/FXMC1957/status/990852017689190402 …
2018-04-29T11:17:05,"“Our position on that is that we don’t believe that staying in the Customs Union is something that delivers on the verdict of the British people, it means that we are rule takers from Brussels,” says @duponline's @NigelDoddsDUPpic.twitter.com/810b1Pgdrw"
2018-04-28T19:14:14,Out in Amber Valley campaigning today for Team Blue with @nigelmills &amp; @cllrbarrylewispic.twitter.com/GVTP7Xmj4Q
2018-04-28T12:57:39,Lovely to welcome you to our offices on Friday @ALewerMBEhttps://twitter.com/alewermbe/status/989862284678848512 …
2018-04-28T11:20:21,"Avoid the A45 from Northampton to Wellingborough this morning
https://www.northamptonchron.co.uk/news/traffic-news-major-road-closure-causes-traffic-backlog-from-wellingborough-to-northampton-1-8479460/amp#click=https://t.co/TaMnczmfvn …"
2018-04-27T20:57:28,What is this insanity?! A #Conservative Council building Council homes?! Great work by @NorthamptonBC &amp; @NPH_news pic.twitter.com/XHdBT7XpGH
2018-04-27T16:16:54,A development of 14 new homes in Spring Boroughs was officially opened by Andrew Lewer MP today. The Borough Council and Northampton Partnership Homes have worked closely with the local community to address the need for family housing in the area.pic.twitter.com/nThqMV3KZ2
2018-04-27T19:46:20,Our Politics and a Pint evening with @ALewerMBE MP &amp; @RMatthewsMEP  is underway pic.twitter.com/5891yii1ah
2018-04-27T19:50:08,#Daventry calling! Out and about with the #ToryCanvass contingentpic.twitter.com/Ur9mYzjj73
2018-04-27T10:00:10,"The Duke and Duchess of Cambridge are delighted to announce that they have named their son Louis Arthur Charles.
 
The baby will be known as His Royal Highness Prince Louis of Cambridge.pic.twitter.com/4DUwsLv5JQ"
2018-04-27T13:42:14,Great meeting with Sarah at @AdviceNorthants today. Very impressed with the help and professionalism that they provide for those in need of help. #TopOrganisation #NorthamptonSouthpic.twitter.com/G1rPXYR1N0
2018-04-26T15:26:13,"@halfon4harlowMP's thoughts on extending degree apprenticeships, reforming the levy to help disadvantaged young people  and for funding FE, were a breath of fresh air - incisively developed too by @ALewerMBE with brilliant European illustrations and examples from Derby Universityhttps://twitter.com/halfon4harlowMP/status/988746306754633728 …"
2018-04-24T11:00:48,"This picture of #BigBen is a familiar sight at the moment, but in 1858 the Houses of Parliament as we recognize them were still new; #OTD the biggest bell in the world was ready, at a 2nd attempt, to be hung in the clock tower. Read more about Big Ben: http://ow.ly/843V30jpuzj pic.twitter.com/ZHpHwu7hM3"
2018-04-24T12:08:34,"@ALewerMBE Andrew Lewer is speaking at launch of Politeia’s pamphlet on #VocationalEducation. He hopes publication marks future direction of policy on vocational training and apprenticeships - a greater focus on getting young people into high skilled, rewarding employment.pic.twitter.com/JecV6AprsN"
2018-04-24T11:47:44,Pleased to be speaking alongside @ALewerMBE at @PoliteiaUK's report launch this morning on technical education and #Apprenticeships.pic.twitter.com/2cjY6DUw73
2018-04-24T11:24:13,The unveiling of the #MillicentFawcett statue in Parliament Squarepic.twitter.com/anxftcuEPL
2018-04-24T10:50:17,"We delighted that our local MP for Northampton South @ALewerMBE &amp; MEP @RMatthewsMEP will be at White Lodge, Billing Road the Friday Evening for ""Politics and a Pint"". The event is free and is a great opportunity to discuss all things EU &amp; Westminster! 7pm - 9pmpic.twitter.com/AtdVLEG9SO"
2018-04-24T08:27:09,"I would not be here today as PM, no female MPs would have taken their seats in Parliament, none of us would have the rights and protections we now enjoy, were it not for Millicent Fawcett. It is an honour to be unveiling her statue in Parliament Square later today.pic.twitter.com/BvmfhvaElS"
2018-04-24T09:48:14,Speaking at @PoliteiaUK event launching this report today with @halfon4harlowMP
2018-04-23T10:14:14,"At 2.30pm tomorrow, we'll be hearing from @CMAgovUK @CareEngland @CareQualityComm @actuarynews @LGAcomms @NHSEngland &amp; ADASS about the long-term funding of #adultsocialcare. Find out more here: https://www.parliament.uk/business/committees/committees-a-z/commons-select/housing-communities-and-local-government-committee/news/adult-social-care-evidence-17-191/ …pic.twitter.com/RM5ZZRVdhl"
2018-04-23T12:03:20,"Her Royal Highness The Duchess of Cambridge was safely delivered of a son at 1101hrs.

The baby weighs 8lbs 7oz.

The Duke of Cambridge was present for the birth.

Her Royal Highness and her child are both doing well."
2018-04-23T05:54:19,A happy #StGeorgesDay to you all. pic.twitter.com/1FGDxO14YA
2018-04-22T09:23:11," ""MPs consult 'citizens' assembly' for first time to give public role in solving social care funding crisis"" - @Telegraph (£)

We're excited to be working with @CommonsHealth &amp; @CommonsCLG to make this happen. #socialcare #demoparthttps://www.telegraph.co.uk/politics/2018/04/21/mps-consult-citizens-assembly-first-time-give-public-role-solving/ …"
2018-04-23T09:12:17,Well done Chris!https://twitter.com/CGreenUK/status/988074805961338880 …
2018-04-21T14:09:33,Wishing Her Majesty a very happy 92nd Birthday  #QueensBirthdaypic.twitter.com/EnoLPTnjPr
2018-04-19T08:03:28,My latest Brexit Briefing analyses the Irish border issue’s key role in the negotiations in the coming weeks:https://www.danieldaltonmep.co.uk/news/brexit-briefing-no34-border-showdown …
2018-04-18T16:06:39,"We're glad to see our #HealthyHousebuilding briefing note in the hands of @ALewerMBE MP!
Read the note here: http://www.ukgbc.org/Healthy-Housebuilding …pic.twitter.com/7WvqLrWSl2"
2018-04-18T11:10:05,Interesting meeting with International Consortium of British Pensioners. Curious inconsistencies described to me.pic.twitter.com/cv6anZmv36
2018-04-18T01:20:30,"We mourn the passing of Barbara Bush, who believed that the world would be a better place if more people could read, write and comprehend. That’s why she started the Foundation and her legacy will continue to impact lives for generations to come. Visit: http://www.BarbaraBushLegacy.org pic.twitter.com/A2dlNCiKgj"
2018-04-16T15:14:14,"We have some brilliant news to reveal! Last financial year, we awarded an amazing £1.3 Million to 503 charities, projects and individuals across #Northamptonshire! We'd like to thank all of our generous donors who've contributed to this record-breaking achievement! #GiveNorthantspic.twitter.com/o3Y5BfeEfe"
2018-04-17T11:00:15,"Thrilled to announce that new national league tables show we have soared 178 places in just three years, to become the leading provider of Further Education in the region. Congrats to all students and staff who have worked so hard to make this happen. http://ow.ly/Dqez30jwShA pic.twitter.com/nzArWKSqEy"
2018-04-17T09:19:12,"I understand why @EmmanuelMacron is seeking to regain the initiative on #EUreform. The EU has drifted for too long. However, voters do not want us to return to the 1950s agenda of political integration but a reformed EU to face the challenges of the 2050s. #FutureOfEurope"
2018-04-16T15:11:32,Watch live: PM @Theresa_May gives a statement on Syria to MPs at the @HouseofCommonshttps://www.pscp.tv/w/baS0pDIyOTU1OTR8MU1ZeE5wakVuUUxHd98WI40ebp-wdIFkxrXqd3K6xJm0fjRGMH4KWLCTHqpb …
2018-04-14T10:02:06,Outside space @CynthiaSHospice @NHFTNHS #makingadifferencepic.twitter.com/A0nMF8nZV3
2018-04-14T19:08:42,"I have had a lovely evening with the Friends of St James Library, this evening. The community spirit that exists within this community is really wonderful. #stjames #northamptonshire #northampton #communitypic.twitter.com/qQ1e6ufJBm"
2018-04-14T11:16:57,"Do not forget the Midlands!! @Joannechocolat
@valmcdermid
Northern Fiction Alliance says publishing industry should move north -http://www.bbc.co.uk/news/uk-england-43752992 …"
2018-04-14T08:51:10,Wishing my Northampton Sikh residents a very happy Vaisakhipic.twitter.com/HiBv0zBHuO
2018-04-14T07:35:24,Mayorhold carpark is closed tomorrowhttps://twitter.com/NorthamptonBC/status/984818556092239874 …
2018-04-13T13:30:01,"Vehicle sector has Brexit challenges, no point denying it, but solutions as well as problems here from @ddalton40https://twitter.com/ddalton40/status/984456574218526721 …"
2018-04-12T06:35:34,County’s chief constable to retire...https://twitter.com/northantspolice/status/984318237545508864 …
2018-04-12T05:57:24,The countdown begins to 2018's Northampton County Beer Festival #beerfestival #Northamptonshire #CAMRA #Northamptonpic.twitter.com/BZ7gLneKpr
2018-04-11T18:15:17,Excellent analysis of EU debates from @johnredwoodhttps://www.telegraph.co.uk/politics/2018/04/11/time-world-class-universities-asked-tough-questions-eu/?WT.mc_id=tmgliveapp_androidshare_AqfJLqxDQlqT …
2018-04-10T13:20:11,The country has become a proxy battlefield for Russia and the Westhttps://capx.co/svDGL 
2018-04-10T15:26:21,"""Let’s celebrate this anniversary, remember the victims, give thanks for lives saved, and start talking calmly and sensibly about such border solutions,"" writes @DCBMEP as the Good Friday Agreement turns 20 #GFA20. Read here https://www.telegraph.co.uk/politics/2018/04/10/good-friday-agreement-has-nothing-fear-brexit/ …"
2018-04-07T09:24:00,"I had a wide-ranging &amp; very productive discussion with Chief Exec @soniaswartCEO at @NGHnhstrust yesterday on hospitals, health &amp; social care.pic.twitter.com/wVdzGYIFMr"
2018-04-06T07:16:47,"Yesterday I met with the Chief of @nhftnhs to discuss mental health provision and improving health outcomes. Really impressed with my tour of Berrywood Hospital, rated as Outstanding by Care Quality Commission (Thank you Andreas)pic.twitter.com/biqdq1DLM3"
2018-04-05T16:11:16,A special thank you to all the staff of @EdwardGreen1890 for their fascinating tour of how to make the best shoes in the world. The quality and dedication of the staff was outstanding. True craftsmen and womenpic.twitter.com/ZHAMjGiybM
2018-04-04T14:35:06,Thanks to @spectator for running. @SpecCoffeeHouse. #Antisemitism never acceptable.https://twitter.com/SpecCoffeeHouse/status/981475065731706880 …
2018-04-01T08:44:38,Happy Easter from everyone at Northampton Conservatives
2018-04-01T07:30:34,Happy Easter everyonehttps://twitter.com/MethodistGB/status/980324014114725889 …
2018-03-29T12:20:00,"Venezuela's prisons are notoriously overcrowded and in poor condition. Now, at least 68 people are dead after a fire broke out during a riot in the jail area of a Valencia police station.https://www.npr.org/sections/thetwo-way/2018/03/29/597853855/fire-breaks-out-during-riot-at-venezuelan-jail-leaving-68-dead?utm_source=twitter.com&amp;utm_medium=social&amp;utm_campaign=npr&amp;utm_term=nprnews&amp;utm_content=20180329 …"
2018-03-28T08:17:17,This is great news for the NHS and the General Hospitalhttps://www.thesun.co.uk/news/5916591/pm-pledges-billions-for-the-nhs/amp/#click=https://t.co/SCL9KlgKhw …
2018-03-27T07:32:40,100 years ago today @SaintsRugby’s Harry Spanton died in these bleak fields near Bouzincourt. He was a machine-gunner with the 5th Northamptonshire Regiment. His body was never found.pic.twitter.com/iQGgh3rmcO
2018-03-27T20:22:36,Congratulations to Northampton curry champions @IndianSaffron for Highly Commended in this year's Parliamentary Tiffin Curry awardspic.twitter.com/w4F3RRuHWM
2018-03-27T15:32:09,Honour to have 103bn @Official_REME from #Northampton barracks come visit us at @UKParliament and take a tour. Thank you @LeoDochertyUK &amp; @AndrewBowieMP for meeting up with them and discussing military &amp; defence matters.pic.twitter.com/RcB3pOy9wc
2018-03-26T12:00:00,"At 4.30pm, we'll be joined by @CommonsHealth to hear about adult social care from @age_uk @alzheimerssoc @LeonardCheshire @scope @TheKingsFund @instituteforgov @LSEnews &amp; @NuffieldCollege. Watch later here: https://parliamentlive.tv/Event/Index/f2d1557d-b21b-47d0-b243-333522b9ea85 … #socialcare #adultsocialcare"
2018-03-25T09:00:43,"Today, 100 yrs after the mud &amp; slaughter, our thoughts of Walter are, in Sunday best, off to stroll in the sunshine. Bless you Walter. RIPpic.twitter.com/sXQpWTPQuK"
2018-03-23T12:27:39,"Thank you @SkyNews @SkySports for giving #WalterTull this platform this morning. Now many more people know of Walter's heroism, talent, service and sacrifice. Armistice Day will see an special event and play @ImNickBailey @WalterTull100 @actnforchildren @WTHLP @WTArchivepic.twitter.com/BIQbgdvMvb"
2018-03-23T10:34:22,It was great to see @ALewerMBE draw on our Devo 2.0 report in a Westminster Hall debate on Local Infrastructure in the East Midlands this week - find the report on our websitehttp://www.respublica.org.uk/our-work/publications/devo-2-0-case-counties/ …
2018-03-22T16:15:01,"A year ago today, police officer Kris was left paralysed after being hit by a van in the Westminster bridge terrorist attack. Now he is FINALLY able to live in his own home, thanks to #DIYSOS.
pic.twitter.com/VaLYrtu78P"
2018-03-22T23:04:52,Very successful #NorthamptonSouth Association AGM tonight. Thanks to all the Members who attended.
2018-03-21T18:56:28,"Lovely letter received from @ALewerMBE today recognising the hard work and dedication by @NorthamptonBC community engagement and safety team. 

Thank you Andrew, it’s appreciated.pic.twitter.com/wvqL6tKWsi"
2018-03-22T08:46:32,My wonderful and v inspiring colleague @Tobias_Ellwoodhttps://twitter.com/bbcbreakfast/status/976736911590031360 …
2018-03-22T08:22:56,Freedom of speech should be an obvious Conservative principle but feels in need of bolstering lately. Look forward to the article.https://twitter.com/kemibadenoch/status/976123449247715329 …
2018-03-21T16:51:16,Raised #Northampton #FarCotton HiMO (Houses of Multiple Occupation) problems with Minister @HeatherWheeler in Westminster Hall today.
2018-03-21T13:45:15,"Delighted to confirm pay rise of between 6.5 and 29% for NHS staff who have worked so hard over a tough Winter, in a £4.2bn deal. Rarely has a pay rise been more deserved."
2018-03-20T13:11:42,"""This is a disgraceful letter from @JunckerEU. The European Commission President is appeasing a man who poses a clear threat to western security,"" says @Ashleyfoxmep. Read his full response here  http://conservativeeurope.com/news/conservative-meps-leader-condemns-junckers-nauseating-putin-letter …pic.twitter.com/XypNwnB8V2"
2018-03-20T12:56:19,Strong pledge on research funding on Motor Neurone Disease from @Jeremy_Hunt responding to my Commons Q. @mndassoc
2018-03-20T12:07:48,Congratulations to @Lee4NED for a great debate. Transport &amp; local government reorganisation to relieve the housing crisis were themes of my speech.https://twitter.com/lee4ned/status/976003187361701888 …
2018-03-19T18:50:40,Spoke in Commons today about domestic abuse and Council / social housing provision. @NPH_news
2018-03-19T09:04:55,This is the sort of excellent work I was talking about on the @BBCLookEast @daily_politics  show yesterdayhttps://twitter.com/LGAChildren/status/975646841487462400 …
2018-03-16T21:07:56,Northamptonshire Council: We back unitary authority call -http://www.bbc.co.uk/news/uk-england-northamptonshire-43430664 …
2018-03-16T17:59:16,"@ALewerMBE thanks for visiting the site of the new Gurdwara / Community Centre earlier today. A big change since your last visit, great progress being made on this community project. @SikhPApic.twitter.com/LxPCFbC77c"
2018-03-16T17:26:32,Thanks to @UniNorthants sophomore journalist students who interviewed me about local government in #Northants #TrueProspic.twitter.com/nDWCrAtHJL
2018-03-16T17:06:17,Fantastic opening of restored @DelapreAbbey Met up with @HE_ChiefExec  from @HistoricEngland and discussed the town's rich heritage and futurepic.twitter.com/NPwd8s1nnE
2018-03-16T14:21:17,"@DelapreAbbey to meet @ALewerMBE discussing Northampton’s fantastic heritage on opening day , works part funded by @HistoricEnglandpic.twitter.com/eQlFsmCs8V"
2018-03-16T17:01:37,Here is the press release from myself and the other County MPs about the @mycountycouncil Inspection reportpic.twitter.com/wEDasbglYh
2018-03-15T10:55:07,BREAKING: inspector looking at @mycountycouncil says financial problems not because of a lack of govt funds but council decisions. Suggests commissioners should be sent in.
2018-03-15T10:55:03,Positive prospects for Erasmus+ applications and for UK students studying abroad in the years ahead. @WalkerWorcester https://goo.gl/oJ1KVk 
2018-03-14T13:07:36,A glaring omission: Jeremy Corbyn refused to even once directly condemn the Russian Government for the #Salisbury attack in his response to PM. This will haunt him.
2018-03-14T08:53:26,"Read our tribute to #MND Association Patron, Professor Stephen Hawking, on our website here http://mndassociation.org/stephenhawking pic.twitter.com/JAel5oEIfp"
2018-03-13T07:32:24,"Labour have been caught out making misleading claims about free school meals by an independent fact-checker, showing once again that they won’t let facts get in the way of their political game-playing.pic.twitter.com/GPv0IIxuTp"
2018-03-12T10:00:02,Join us at 4pm today to hear from @DominicRaab &amp; @HeatherWheeler @mhclg on what their priorities are for #housing. Watch later here: http://parliamentlive.tv/Event/Index/d25378ec-91fb-49d4-acff-b40e7ded3ca0 …
2018-03-11T17:07:07,Not liking brown faces? It certainly wasn't the reason I voted for Brexit. http://www.cityam.com/282032/vince-cable-slammed-white-faces-brexit-slur …
2018-03-10T18:00:35,"Unveiling the statue of Margaret Bondfield by @andrealeadsom to mark International Women’s Day @NorthamptonBC and #Vote100 #IWD2018 #Northampton 
Supported by @ALewerMBE @Michael_Ellis1pic.twitter.com/MwA4z3XJmT"
2018-03-10T17:52:30,I am encouraged that NGH is commencing an inquiry into the circumstances surrounding the death of an 85 year old gentleman in their care. His family needs to know what happenedpic.twitter.com/cOJgD4zUqY
2018-03-10T12:18:50,Top marks to @NorthamptonBC for #InternationalWomensDay Hundreds turned up to see @andrealeadsom unveil #MargaretBondfieldpic.twitter.com/HkOxgwXGDs
2018-03-09T16:58:49,"I have written to Northampton hospital Chief Executive asking her to investigate the circumstances around the death an 85 year old gentleman, as reported in the press.http://dailym.ai/2DdzyL4 "
2018-03-09T11:55:25,Reasons to be cheerful and not to be downhearted by Labour's Brexit ratting agenda.https://www.telegraph.co.uk/politics/2018/03/09/dont-taken-fifth-columnists-pushing-whitehalls-anti-brexit-propaganda/ …
2018-03-08T13:20:48,"Having been in touch with the family of Mary Davies, I have written to Her Majesty's Attorney General asking him to review the unduly lenient sentence and send it to the Court of Appeal @BBCNorthampton @ChronandEchohttps://twitter.com/ChronandEcho/status/971631630879219712 …"
2018-03-08T07:19:23,Happy International Women's Day 2018 - “I do not wish women to have power over men; but over themselves.” Mary Shelley #proudtobeawomen #genderequality #femaleempowermentpic.twitter.com/ue3zR3JBvM
2018-03-07T15:53:27,"""Young people... have the power to transform our party"" - My article for  @ConservativeHome today ahead of this weekend's youth conference.   https://www.conservativehome.com/platform/2018/03/syed-kamall-the-conservative-party-needs-a-youth-reboot-and-it-starts-with-listening-more.html … #IAmATory #ToryYouthReboot #youngconservativepic.twitter.com/E7QFNUHzD0"
2018-02-27T15:33:44,"Thanks Andrew for your support
#parliament #homelessness #poverty #inequality #foodpolicy #foodpovertyhttps://twitter.com/ALewerMBE/status/968507699284643840 …"
2018-03-04T10:53:17,The thaw is on! We will be in school as normal tomorrow. Thanks to everyone for your patience and support!pic.twitter.com/CqsTm7Nw8U
2018-03-04T11:56:01,Socialismhttps://twitter.com/BBCWorld/status/969872015678164992 …
2018-03-03T08:35:12,The Prime Minister set out a clear path to Brexithttps://www.telegraph.co.uk/opinion/2018/03/02/content-now-not-time-nitpick-brexit/?WT.mc_id=tmg_share_tw …
2018-03-02T18:05:51,"After earnest discussions with @mhclg, @LGA &amp; County Council leadership on the budget and libraries I welcome the partial withdrawl on closures, but deep concerns remain. I will be replying to @CILIPPMLG s letter"
2018-03-02T13:29:48,"Tonight's Northampton South Conservative Association AGM at Billing Road postponed due to bad weather. #Staysafe."" pic.twitter.com/16yNSj0sZy"
2018-02-28T17:10:33,From @JohnPenroseNews: There's a free market-friendly solution to energy price capshttp://bit.ly/2GQrGBd 
2018-03-01T12:57:06,Backing World Book Day today as Chairman of APPG for Publishing.pic.twitter.com/ToQ8VXHvAt
2018-03-01T07:27:43,"Happy @WorldBookDayUK on this snowy morning! Remember to #ShareAStory for 10 mins a day to get children into the habit of reading. It can be siblings reading to one another, a grandchild with a grandparent, on a train journey, across the breakfast table. http://www.worldbookday.com/ideas/share-a-story/ …pic.twitter.com/6VNF1W5CQH"
2018-02-28T15:22:14,"That @Jacob_Rees_Mogg take down of Sir John Major in full: “He whipped Maastricht through in the most aggressive whipping in modern history. For that PM to then say ‘oh it should be a free vote’, is either forgetting how he behaved himself...or just straight forward hypocrisy.""pic.twitter.com/xEOIJVxIc0"
2018-02-28T12:35:17,Referenced good work of @UniNorthants &amp; @DerbyUni in achieving access for disadvantaged students in Westminster Hall today.
2018-02-27T17:34:21,"With @ALewerMBE, hoping to be able to secure time in Parliament soon to talk about the continued  importance of infrastructure spending across our regionhttps://twitter.com/commonsbbcom/status/968494171911794688 …"
2018-02-27T15:26:44,Today I highlighted the important work that @NorthamptonBC &amp; @NptonHopeCentre do to combat street homelessness at the parliamentary debate https://goo.gl/mrzyVe 
2018-02-27T13:06:35,Billions in tax raised from clampdown on corporation tax evasion says @MelJStride response to my @hmtreasury Commons Q today.
2018-02-26T16:13:10,Interesting to have an open discussion on Erasmus+ and / or alternatives with @InsightBritish today.pic.twitter.com/gez301MlnF
2018-02-26T16:02:28,Our #ErasmusPlus Shaping Futures Exhibition is up in @UKParliament! Please drop by the Upper Waiting Hall to find out more about the programme and the €170 million available to UK organisations this year #Erasmus #highered @UKLabour @LabourLordsUK @tory_zone @Torypeers
2018-02-23T16:10:57,Excellent meeting with Northampton  Jobcentre Plus staff today. #InspirationalStaff. And thank you Jackie for the sumptuous home made cake. Delicious!pic.twitter.com/Jbpp9QJWuG
2018-02-23T12:16:08,Great to meet up with Bellinge residents at my advice surgery today. Many thanks to @BellingeBCH1 for having us pic.twitter.com/Ja54m30wDr
2018-02-22T10:32:29,"We are now questioning @DExEUgov Minister Robin Walker and Sir Tim Barrow, the UK's Permanent Representative to the EU. Watch live: https://goo.gl/ih3wt5 "
2018-02-21T21:51:40,Thanks to @Jesse_Norman and @ChrisGraylingMP for most helpful briefing yesterday on The Haulage Permits and Trailer Registration Bill. Reassurance for haulierspic.twitter.com/MgSf7uhSeO
2018-02-21T10:01:40,The Publishing APPG has launched a call for evidence into how to maintain the world's best publishing sector - deadline for written submissions 15 March. Be part of the conversation! @ALewerMBE @PublishersAssoc http://bit.ly/2sANb6Q 
2018-02-21T12:33:49,Excellent news. Only 2.7% of economically active people in #NorthamptonSouth unemployed. Looking forward to my upcoming visit to the local job centre to listen and learn about their issuespic.twitter.com/WRz1WpYtTk
2018-02-20T08:42:17,"Interesting stats from DCMS. Creative industries account for 12% of all UK businesses. Vast majority are small and micro (less than £250k turnover, less than 50 staff)https://buff.ly/2odPMz1 "
2018-02-20T10:32:35,Federalist MEPs far from Northern Ireland often seemed to think they instigated &amp; sustained Peace Process. Lord Trimble knows better.https://twitter.com/brexitcentral/status/965849946065981440 …
2018-02-18T08:24:34,I never cease to be profoundly amazed by the individual bravery &amp; team skills of our @RoyalNavy bomb disposal divers to clear huge unstable WW2 bombs. @MarkLancasterMK @DefenceHQ @GavinWilliamsonhttp://www.thetimes.co.uk/article/8404bc4c-142a-11e8-9fbd-cfeb7e5474f9 …
2018-02-15T18:09:17,The need to prepare for No Deal underlined by @DDalton40 latest article.https://twitter.com/ddalton40/status/964068118044860416 …
2018-02-14T10:02:23,A thread that demonstrates well what pragmatists WITHIN the EU are up against.https://twitter.com/piris_jc/status/963026794935963648 …
2018-02-10T09:31:00,"Only war zones such as Somalia and Syria are more dangerous than Venezuela is now, reports Jason Mitchellhttp://specc.ie/2GAD1pL "
