2018-11-26T17:15:29,"My response to the EU Withdrawal Agreement and the PM's Leadership
https://www.andrewlewer.com/campaigns/my-response-draft-eu-withdrawal-agreement …pic.twitter.com/YniBwoFIgG"
2018-11-27T14:18:20,"Delighted to attend @Larkfleet @LarkfleetGroup dinner hosted by @ALewerMBE in House of Commons @UKParliament last night. Great discussion on UK's future housing priorities, current sector issues and how SME Small Builders are working to assist Government meet its targetspic.twitter.com/dZq8dEKagn"
2018-11-26T17:11:55,It was a great pleasure to Chair this. Incredibly exciting innovation going on. I stressed need for it to be expressed in a way that people understand.https://twitter.com/hedgehoglabxr/status/1065588025651077120 …
2018-11-24T14:23:02,Delapre &amp; Briar Hill by-election campaigning and listening to residents views around Thorn Hill today for @Daniel4Delapre #torycanvass #Northamptonpic.twitter.com/A5US58os51
2018-11-23T16:05:24,"""@AlexanderDowner totally nails why a supply chain non-Brexit - as the PM is proposing - is the worst possible outcome.https://www.telegraph.co.uk/politics/2018/11/23/astonishing-great-britain-risks-ending-eu-colony-brexit/?WT.mc_id=tmgliveapp_androidshare_ArnVlSXw4ltq …"
2018-11-23T13:02:21,I had a good meeting with Yvonne and Steve who run Voni Blu in Castilian Street. We spoke about a range of town centre issues.pic.twitter.com/DTd8nvoAan
2018-11-23T08:53:47,. @SMcDonaldFCO &amp; @Jeremy_Hunt need to apply every pressure upon Pakistan Govt. over this and offer Asia Bibi asylumhttps://www.dailymail.co.uk/news/article-6417675/Islamists-hunting-door-door-try-Pakistani-Christian-mother-cleared-blasphemy.html?ito=social-twitter_mailonline …
2018-11-23T08:25:29,#IainDuncanSmith was at his inspirational best last night as the guest of honour at our #Northampton dinnerpic.twitter.com/9oeYfUQ1Dc
2018-11-22T21:38:37,Excellent news again!!! Many congratulations @AngelaHillery Like @SaintsRugby you have won the doublehttps://twitter.com/AngelaHillery/status/1065688767535751169 …
2018-11-22T11:58:04,"“European institutions distrust democracy &amp; see it as having been responsible for leading to the demagoguery &amp; dictatorships of the 1930s. We have a very different tradition in Britain. We believe we need to trust the people, the people are sovereign” @ALewerMBE
#StandUp4Brexitpic.twitter.com/DdAcnRIZRl"
2018-11-21T20:22:50,Had a great day at Westminster today for the Women's Vote  Centenary celebrations organised by #AskHerToStand @women2win It was also great to see a @NSBSport student today on work experience from Northampton. Thank you @ALewerMBE for your hospitality pic.twitter.com/spgICfu2ru
2018-11-21T17:00:49,As long Select Committee session on Govt.'s errors in giving £1bn away to the EU on Galileo ends Mark Francois MP refers to the portrait on Committee Room wall.pic.twitter.com/Nr3oznR8L1
2018-11-21T15:47:46,"Quizzed HMRC leadership today @CommonsTreasury. They were clear:
- no need for any infrastructure whatever at Irish border in any scenario
- no instructions to introduce it
- any new arrangements can be ready in 24 months from point of clarity
So why do we need the #backstop?"
2018-11-20T10:43:33,"What are the costs, benefits and risks of UK participation in the European Defence Fund during the Brexit transition? We will be asking @StuartAndrew, Minister for Defence Procurement. 
Watch live on Wednesday 21 at 3.00pm. https://www.parliament.uk/business/committees/committees-a-z/commons-select/defence-committee/news-parliament-2017/edidp-evidence-17-19/ …
#Brexit"
2018-11-21T08:21:10,May's Brexit Deal Has a Fatal Defect - Bloomberghttps://www.bloomberg.com/opinion/articles/2018-11-20/may-s-brexit-deal-has-a-fatal-defect …
2018-11-19T16:00:00,"Starting now: our #leasehold reform session with developers, freeholders and managing agents. Join us live here: https://www.parliamentlive.tv/Event/Index/2d3dece9-ed83-420c-8a5d-666e8c299a93 …https://twitter.com/CommonsCLG/status/1063046457836503042 …"
2018-11-16T17:00:21,What a great day in #Northampton  We opened @Metro_Bank on Abington Street @kerryreynoldsmb Thank you so much for inviting me. Wishing them every success!!!!pic.twitter.com/O4wcCUi7kv
2018-11-16T04:02:23,"I shouldn't laugh, but this is hilarious  https://twitter.com/northantsfire/status/1062745691674607616 …"
2018-11-16T07:57:53,Excellent piece by former Chancellor Lord Lamont backing a World Trade Deal &amp; rubbishing Treasury forecasts: “with proper preparation there is no need for panic. Our economic future lies in our own hands &amp; depends on the policies we choose to follow”https://www.telegraph.co.uk/politics/2018/11/14/deal-collapses-britain-must-ignore-scaremongers-choose-no-deal/ …
2018-11-15T09:41:26,"When a chief negotiator resigns over the negotiation he was in charge of negotiating, we can assume he didn’t really negotiate it. Throughout, No 10 has created jobs and made appointments but quietly done all the work itself. That’s a big part of the Brexit story."
2018-11-15T08:01:47,"Thank you Shailesh for your principled descision at this crucial time.

#StandUp4Brexitpic.twitter.com/4okSL6HjmQ"
2018-11-14T16:09:19,A packed room for first SME Housebuilders APPG meeting. Speaker @richardbaconmp passionate on self-build and self-commissioned homes.
2018-11-14T16:08:29,"Publishing APPG yesterday, launching ""Publishing's Contribution To Research &amp; Innovation"", plus airing #OpenAccess concerns. @PublishersAssocpic.twitter.com/UmjyMq3xU5"
2018-11-14T11:29:58,Mark Francois deploys a great French quote on #politicslive: 'Nothing endures like the provisional.' Says ERG can't see EU moving from backstop/customs union if they get it.
2018-11-13T15:29:01,With #JimCarter and #NicholaMcAuliffe today in support of the @mndassoc campaign to fast track access to benefitspic.twitter.com/GU2JJPsVF5
2018-11-13T14:47:04,"Great to see @ALewerMBE, vice-chair of the APPG on #MND attending the #Scrap6Months event to support terminally ill peoplepic.twitter.com/ki6k1yQ1Ld"
2018-11-12T09:00:01,How are councils and place management organisations supporting high streets and town centres? Tune in to our fourth #myhighstreetmatters evidence session to find out. We'll be broadcasting live from 4pm here: https://www.parliamentlive.tv/Event/Index/a9b15c25-d82f-40c1-8e3a-57f44e47b376 …pic.twitter.com/Zqi2IMzLlS
2018-11-12T10:24:07,Asia Bibi should be able to come to the UK. It is those who would threaten her who should not be here.https://www.nationalreview.com/corner/how-immigration-changes-britain/?utm_campaign=trueanthem&amp;utm_content=5be867ce04d30168b231bfff&amp;utm_medium=social&amp;utm_source=twitter …
2018-11-08T15:30:09,"More than 150 parliamentarians signed an open letter to the #Pakistani Prime Minister urging the government to secure safe passage from the country for Asia Bibi. @ADFIntl #AsiaBiBi #Blasphemy
https://adfinternational.org/news/saved-from-death-row-pakistans-supreme-court-free-asia-bibi/ …pic.twitter.com/HHw8LVC3A0"
2018-11-11T15:46:10,"It would be an honour for Britain to provide refuge to Asia Bibi - and a moral duty, even if it were a risk. On this day of all days, we are surely conscious of the virtue of courage.https://www.telegraph.co.uk/news/2018/11/11/asia-bibi-not-offered-uk-asylum-amid-concerns-unrest-attacks/ …"
2018-11-11T19:18:57,This evening I was pleased to be present for a service at which a Beacon was lit on the portico of All Saints Church in #Northampton to mark the occasion of the Armistice 100 years ago today.pic.twitter.com/m1TbCCq2t9
2018-11-11T20:08:30,It was an honour to take part in the #lightingofthebeacon ceremony this evening #armistice100 #RemembranceDay2018 #LestWeForget #Northampton #northamptonshirepic.twitter.com/70frIS2Cpa
2018-11-11T19:52:21,It was a proud day today in #Northampton We all came together to commemorate the 3671 Northampton service men who gave their today for our tomorrow #LestWeForget #ArmisticeDay100 @RoyalAnglians #103bnRemepic.twitter.com/LdiPrz3WyC
2018-11-11T13:02:22,An honour to take part in the Town and County Remembrance Day Ceremony today #LestWeForget #Armistice100pic.twitter.com/Ct1L6fetng
2018-11-10T09:53:44,Moving and well performed #Armistice100 commemoration last night at @nsbschool. Talent and respect on show in equal measure. #Northamptonpic.twitter.com/hsbzc0J449
2018-11-09T17:49:45,I had a good meeting with the Leader of @NorthamptonBC today and discussed a number of local and national issues.pic.twitter.com/mYX9qPipKL
2018-11-09T16:17:48,"Students appreciated the opportunity to listen to @ALewerMBE who visited earlier today to discus his background and his career in politics to. Andrew also answered questions on a range of issues including Brexit, knife crime and the future of our local libraries. #politicsmatterspic.twitter.com/m3iVPwdD1s"
2018-11-08T18:28:11,A great turn out of residents at the @UniNorthants community forum this evening. There is lots of concern among our community about outstanding issues at the waterside campus.pic.twitter.com/LLIC17wzB8
2018-11-08T19:48:30,Poignant scenes today outside Westminster Abbey today. #LestWeForget I look forward to seeing you all at the commemoration in #Northampton on Sunday to pay our respectspic.twitter.com/mzdsxd0Lfn
2018-11-05T10:10:36,"Still necessary to repeat this, it seems. No country, certainly not the UK, would sign up to have its territory divided by a foreign power, or to be locked in someone else's customs union in perpetuity with no right to leave.https://twitter.com/WeyandSabine/status/1059361597116858368 …"
2018-11-06T10:13:46,Proud to support @JimDOfficial and @CareAfterCombat campaign to help transition veterans into the community after prisonpic.twitter.com/0vxCoHDcXr
2018-11-06T07:08:09,"People want to live in town centres – finally the Government is letting them, says @MRJKilcoynehttps://capx.co/people-want-to-live-in-town-centres-finally-the-government-is-letting-them/ …"
2018-11-04T22:54:56,"We need a new campaign for free speech to take on the professionally-offended, writes @BorisJohnsonhttps://www.telegraph.co.uk/politics/2018/11/04/need-new-campaign-free-speech-take-professionally-offended/?utm_medium=Social&amp;utm_source=Twitter#Echobox=1541371119 …"
2018-11-04T09:02:04,"'@TomTugendhat MP: ""I will be asking the Foreign Office for an urgent assurance from the Pakistan government that Asia Bibi, who has been found innocent by the Supreme Court, will not be abandoned to a hate-filled mob.""https://www.theguardian.com/world/2018/nov/03/asia-bibi-husband-pakistan-blasphemy-acquittal-christian-plea-asylum …"
2018-11-03T22:14:32,Fantastic 18th Diwali Celebrations this evening in #Northampton #northamptondiwaliprocession great work @NorthamptonBC @neelamASingh #HappyDiwali @ALewerMBE @wearecfindia @HCI_Londonpic.twitter.com/Yije50ChSg
2018-11-03T21:53:37,#Northampton #TeamBlue out campaigning today for @Daniel4Delapre #PowerPose #ToryCanvass #CampaignToWinpic.twitter.com/UYVdIVa4l1
2018-11-03T20:47:44,@ALewerMBE good to see you at the India Hindu Welfare Organisation #diwali celebrations in #Northampton this evening.pic.twitter.com/wVtABWJTql
2018-11-02T22:51:26,"Great group meeting also tonight with @npton_cons 
Thank you to @ALewerMBE and @NorthantsOPCC for attending."
2018-11-02T09:34:33,".@ALewerMBE: ""New thinking in adult social care is absolutely essential, I cannot welcome the #localgov green paper enough""

We are leading a national debate on how to best fund adult social care. Find out more at http://www.futureofadultsocialcare.co.uk  #futureofASCpic.twitter.com/caKDO2H99T"
2018-11-01T15:58:39,"For Northampton to thrive in the future, we need to embrace new technologies and build new infrastructure, that is why I support a digital hub here in the town
https://www.allthingsbusiness.co.uk/iris-iot-where-are-you-in-the-iot-kaleidoscope …"
2018-11-01T15:07:26,"“We should head straight for the ultimate destination of a free trade agreement with the EU. Talk of delay, EU antechambers, departure lounges, half-in half-out positions and muddled thinking will sell our country short” @SteveBakerHW
#StandUp4Brexithttps://www.telegraph.co.uk/politics/2018/11/01/norway-style-brexit-would-terrible-result-would-sell-country/ …"
2018-11-01T13:33:08,Great pleasure to meet Ambassador Tsuruoka last night and discuss Japanese investment in Northampton. @JAPANinUKpic.twitter.com/eDAMAQE7G4
2018-10-31T16:48:10,Attending this now.https://twitter.com/commonslibrary/status/1057664054041423872 …
2018-10-31T16:15:15,Pleased to be attending this debate and am learning a lot.https://twitter.com/cmerrey/status/1057253635086786561 …
2018-10-31T09:45:00,Starting now: our session with @kitmalthouse on the social housing green paper. Watch live here: https://parliamentlive.tv/Event/Index/f9f0dce3-6c4f-40df-9e40-90289000e785 …https://twitter.com/CommonsCLG/status/1055778016167714817 …
2018-10-31T08:34:28,At last good news for someone who has suffered for so long. Now her safety in freedom must be maintained.http://www.bbc.co.uk/news/world-asia-46040515 …
2018-10-30T16:27:52,Presentation in Lords from @CareQualityComm on care system pressures underlines need for radicalism in forthcoming Government Adult Care Green Paper.
2018-10-30T14:55:11,Spoken in Westminster Hall debate by the great John Hayes MP on beauty and the built environment. Housing is about more than just numbers.
2018-10-30T11:28:58,Attending All Party Writers Group meeting on authors' earnings with my Chairman of All Party Publishers Group hat on. Reminds me to congratulate @TEKinsey on his latest fine book!
2018-10-30T07:14:39,Rob Jonkman: Local government must retain good European relations after Brexit | Conservative Homehttps://www.conservativehome.com/localgovernment/2018/10/rob-jonkman-local-government-must-retain-good-european-relations-after-brexit.html …
2018-10-29T18:39:20,Being interviewed with @gavinshuker from Luton  and BBCs @tombarton for @BBCLookEast about today's #Budget2018pic.twitter.com/ZAbyIrQdzV
2018-10-27T09:41:59,Have been out on the doorstep in Delapre listening to people's views #NorthamptonSouth #TeamBlue #ToryCanvasspic.twitter.com/WDwrHkqP9N
2018-10-26T22:08:09,Honoured to have been invited to the @PoppyLegion ceremony in #AbingtonSquare to remember the 3671 men from the Borough of #Northampton who gave their lives #LestWeForgetpic.twitter.com/3nFk5Hxrxw
2018-10-26T20:42:41,First new #Northampton shoe factory in fifty years. It is great that @FosterShoes are making their footprint here in the town.pic.twitter.com/EiF6A4o0mc
2018-10-25T12:51:30,Northampton MP pleased to 100% back Southampton MP about this.https://twitter.com/Royston_Smith/status/1055424575134142464 …
2018-10-24T16:46:41,"Great campaign calling on removal of VAT on all digital publications, helping to make reading and learning available for all #axethereadingtaxhttps://bit.ly/2q2xQb7 "
2018-10-23T14:47:41,"So, @ellzbellz83 and the @thelowdownNN1 project in #Northampton need your vote to access some well needed funds from @avivauk community fund. Have a look here at the great work they do and vote for them

https://community-fund.aviva.co.uk/voting/project/view/17-6531 …"
2018-10-22T15:00:02,Starting now: our #myhighstreetmatters session with property owners and planning specialists. Watch live here: https://parliamentlive.tv/Event/Index/315ccc5e-e558-41ef-9c8d-4d8f65582fa6 …https://twitter.com/CommonsCLG/status/1053314846685417478 …
2018-10-20T06:34:51,"Charles Moore on how the ERG “furnished, and continue to furnish, practical suggestions about the detailed areas of Brexit policy...a report on how to facilitate North-South Irish trade with existing techniques and existing processes under existing law”https://www.telegraph.co.uk/politics/2018/10/20/brexit-headbangers-understand-eu-far-better-theresa-may/ …"
2018-10-17T17:52:00,Questioned @MattHancock in Commons on Adult Care Green Paper. Very positive noises about insurance models as per @CommonsCLG &amp; @CommonsHealth
2018-10-17T12:41:17,Great to be on the Victoria Derbyshire show talking about Brexit this morning. I discussed the superb deal that Donald Tusk has offered Great Britain and now we need to ensure that we upgrade this deal so it becomes a deal not just for Great Britain but for the UK. #VictoriaLivepic.twitter.com/VMEyMNqlUi
2018-10-17T09:25:11,Hearing about latest research and about living with Motor Neurone Disease at APPG @mndassoc today.
2018-10-16T21:07:50,I spoke in @neildotobrien debate today on housing. Seeking HRA cap lift money for shared ownership properties #Parliament
2018-10-16T17:28:09,https://www.andrewlewer.com/campaigns/agriculture-bill …
2018-10-16T15:02:33,I recognize the crucial role that pubs play in our social and economic life and I support the @LongLiveLocals initiative. @BrigidSimmondspic.twitter.com/HkiT5lZteO
2018-10-15T21:46:18,"Former Brexit minister Steve Baker says “eurosceptics today are campaigning for the deal which the EU has offered us… but for the whole UK. That’s what we want and that can’t be an extreme position”.

@SteveBakerHW | @MarkUrban01 | #newsnightpic.twitter.com/Yzrx8khEBd"
2018-10-15T09:47:25,Sincere congratulations and best wishes on this good news #RoyalFamilyhttps://twitter.com/KensingtonRoyal/status/1051739344887848960 …
2018-10-12T16:36:56,"Even the European Commission never came up with the idea of limiting pies to 695 calories. So bravo, then, to Public Health England for having the imagination to out-Brussels Brussels.https://blogs.spectator.co.uk/2018/10/shrinking-pizzas-and-pies-isnt-the-way-to-tackle-obesity …"
2018-10-13T15:57:01,Thank you @William83227308 &amp; @SiemensUKNews for a fantastic open day tour in #KingsHeath #Northampton I really enjoyed it.pic.twitter.com/oFCGbJozcI
2018-10-13T15:00:32,Thanks to Andrew Lewer for attending the Siemens Kings Heath open day. @ALewerMBE @SiemensUKNews @emmawhitaker @WestMidsRailway @LNRailway @NTARailpic.twitter.com/s9bGBu4n2n
2018-10-13T15:43:26,Out and about in #Dallington today with @soan_daniel and @pinder_chauhan speaking to residents #Torycanvasspic.twitter.com/suGYf7c0ug
2018-10-11T07:18:22,"You can see why the EU wants a customs union: it would keep privileged access to British consumers, freeze out competition and hold the massive UK market as a bargaining chip in trade talks with third countries. But why are we contemplating this nonsense?http://www.cityam.com/265319/michel-barnier-tells-uk-abandon-free-trade-plans-get-brexit …"
2018-10-10T22:04:58,I and other MPs were proud  and honoured to welcome 120 British soldiers in a parade outside Westminster Hall today #BritishArmypic.twitter.com/ZMOU8IdT3s
2018-10-09T11:30:00,Our second #myhighstreetmatters session on the future of high streets and town centres is taking place at 4pm today. We're hearing from the retail and hospitality sectors. Find out more here: https://www.parliament.uk/business/committees/committees-a-z/commons-select/housing-communities-and-local-government-committee/news/high-street-town-centre-17-19/ …https://twitter.com/CommonsCLG/status/1037646280669974529 …
2018-10-09T10:32:22,"https://mobile.twitter.com/telebusiness/status/1049550536234668032 … 
Been quite a few ""false dusks"" with regard to the Italian banking system, but this could be ""ithttps://twitter.com/telebusiness/status/1049550536234668032 …"
2018-10-09T09:17:40,Ver much enjoyed meeting Bishop Peter Doyle @RCNorthampton at the Bishop's House in #Northamptonpic.twitter.com/su0lQVaa75
2018-10-03T22:44:11,So pleased the Government is removing the housing revenue account borrowing cap.  In Northampton we are already building more council houses than any administration in the last 30 years. This could make plans really take off! @ALewerMBE @npton_cons @NorthamptonBC @BBCNorthampton
2018-10-05T07:05:35,Thanks to Rotary Club of Nene Valley for their generous reception of my Brexit talk last night.
2018-10-03T19:34:50,Excellent results - this is just from one of three proactive teams. #thankyou #OpViperhttps://twitter.com/NptonProactive/status/1047498355180539904 …
2018-10-04T19:55:57,"Thank you Stephen Dychurch of @dychurch_style for sharing your hopes, challenges and ideas for #Northampton Town Centre with me. (Great shop by the way) This is part of my tour of Northampton Town Centre shops.pic.twitter.com/MzgM3noYi8"
2018-10-04T13:24:47,I see this re-statement from Tusk as potentially very significant indeed.https://twitter.com/eucopresident/status/1047825916905357312 …
2018-10-01T12:39:08,Great thanks to @LordCallanan &amp; @ALewerMBE for their participation to the @CFECR event at #CPC2018 on relations between @ecrgroup &amp; @Conservatives after #Brexit. I’ll continue to work with them post-Brexit.pic.twitter.com/iabYvlYCEY
2018-10-01T12:21:44,"""I am happy to serve as a catalyst between the UK and our ongoing Conservative friends in the European Parliament. The @ecrgroup shines a light in the darkness of federalism."" @ALewerMBE #CPC18pic.twitter.com/u20CqsvL72"
2018-10-01T08:16:06,A UK version of such an article would be fascinating.https://twitter.com/TheAtlantic/status/1039825391135993858 …
2018-09-30T18:03:02,Great fringe event #cpc18 thanks to @robjonkman @ALewerMBE @Localis for their contributionspic.twitter.com/04Tx02TEEo
2018-09-30T11:15:32,"Attending this years @Conservatives Party Conference? Come &amp; join our fringe event at 17:45 at Soprano room, Hyatt Regency on life after #Brexit - #localgov cooperation. Our panelists: @CllrJoeCooney @ALewerMBE @jonathanwerran @robjonkman #CPC18 #Localismpic.twitter.com/Uyhyxrq0Rz"
2018-09-28T16:32:12,"Proud to support #MacmillanCoffeeMorning today with Northampton's Jewish community @macmillancancer
@macmillancoffeepic.twitter.com/l5Ju2n1egO"
2018-09-28T15:13:17,"New branch and convenience store opened by @ALewerMBE at Waterside Campus, University of Northampton! pic.twitter.com/q6lrdNqCNQ"
2018-09-28T09:30:32,The speakers and panellists at our town centre conference last week included @NorthamptonBC @FSBEastMids @ALewerMBE @NorthantsEditor and more. For the full story and to find out what our experts had to say about the future of Northampton town centre go to: http://ow.ly/leE030lX6mS pic.twitter.com/jG8Xw3tsuc
2018-09-28T09:34:20,"Delighted to join the 60th anniversary celebrations of @Cosworth in #Northampton #Cosworth are a cutting edge, world class engineering and technology phenomenon.pic.twitter.com/I7KTufty01"
2018-09-24T10:34:57,"I voted Remain in 2016, but I believe that seeking a Free Trade Agreement with the EU, similar to what’s laid out in this @iealondon paper “Plan A+” is preferable to Chequers. Paper is right to consider the impact of any EU deal across all of UK’s economic &amp; trade relationships.pic.twitter.com/yqrD9tnkjb"
2018-09-24T08:38:12,"Today the Institute of Economic Affairs unveils its comprehensive, alternative framework for future trade relationships between the United Kingdom and the European Union, and, just as importantly, with the rest of the world! 

 Download #PlanAPlus now: https://iea.org.uk/publications/plan-a-creating-a-prosperous-post-brexit-uk/ …pic.twitter.com/XzVR4m1ETR"
2018-09-21T23:29:25,"Delighted to meet @sajidjavid tonight @npton_cons fundraiser. 
I managed to get a quick photo and discuss the recent successful bid of £800k from #HomeOffice Trusted Relationships fund to @NorthamptonBC. 
#CelebrateNorthampton #Conservativespic.twitter.com/QDE3Tr07FN"
2018-09-21T14:59:00,Perry and his team at @mcdonaldsuk Riverside made me very welcome. Staff very positive and enthusiastic.pic.twitter.com/ivEgpOkkyQ
2018-09-20T13:47:28,"Last week our Int. Trade Committee scrutinised Chequers proposals with a panel of customs experts, and its flaws and the implications for both sides' red lines seemed clear. With Tusk now saying Chequers won't work, please let's move towards an FTA of the kind he set out in March"
2018-09-20T13:47:47,"Guest speaker alongside @JaneCorryAuthor today at @SWWJ Books, writing and #APPGPublishing. Thanks to Rebecca Harding for organising.pic.twitter.com/Rq2ZrNDFE5"
2018-09-19T19:40:42,#ThankYou @ALewerMBE for giving us a mention at tonight's @NorthamptonBID meeting and  awesome turnout and good to hear of the shape of #NorthamptonTownCentre for the coming future 
2018-09-19T18:32:58,"Passionate question from the floor asking @ALewerMBE to feedback to Westminster that #BusinessRates need to be urgently addressed. Grateful that Mr Lewer agrees that there must be a better, fairer system, based on sales. Key issue for @fsb_policypic.twitter.com/q7IjaXJS1t"
2018-09-19T18:26:48,"@ALewerMBE “focus on experience over stuff”, what can we offer to entice customers into town. Building on research highlighted by @michaelweedon that top net openings on high streets and town centres is in services.pic.twitter.com/pEQXByZEoi"
2018-09-19T18:05:27,"@ALewerMBE @Jonathannun taking on panel question now, joined by @NorthamptonBC chief exec @NorthamptonBID Rob Purdie @NorthantsPolice Mick Stamper @UniNorthants Deborah Mattel. 
#CelebrateNorthampton #NextStepspic.twitter.com/SADgtN88Bc"
2018-09-18T17:26:29,Have you seen our new Facebook page? Give it a follow at http://www.facebook.com/eastmidlandsacademytrust …
2018-09-17T13:25:09,At our business conference this Weds will be representatives from @NorthamptonBID @NorthantsPolice @ChronandEcho @UniNorthants @FSBEastMids @NorthamptonBC and @ALewerMBE. There will be presentations and the opportunity to ask the panel questions. Info at: http://ow.ly/p7Eh30lQ49J pic.twitter.com/FXfaJ9GClB
