2018-07-04T14:37:57,Elected Vice-Chairman of APPG on @mndassoc today. 14 MPs in attendance. 10 Minute Rule Bill on its way.pic.twitter.com/YzggnJ7NR7
2018-07-04T06:29:19,My piece in today’s @Telegraph. “Leave MPs are democrats not extremists”https://www.telegraph.co.uk/politics/2018/07/04/leave-mps-democrats-not-extremists-denying-peoples-vote-would/ …
2018-07-03T15:21:42,Hoping for an England win tonight. I have a £50 charity bet from @Coral for England to win the #WorldCup2018
2018-07-03T09:46:50,"We will be questioning the Minister of State for Trade Policy George Hollingbery MP on scrutiny of EU trade and investment legislation in the context of the UK’s withdrawal from the EU, today at 2.15pm. Find out more here:https://goo.gl/2iuMWM "
2018-07-03T08:53:07,"Spoke about local authority care workers, future funding... and the Laffer Curve... in Commons Estimates debate. https://goo.gl/BNYRtH "
2018-07-02T15:00:01,Our session with @LGAcomms @RLA_News @BritishInsurers &amp; @DominicRaab on building regulations and the #Hackitt review is starting now. Watch live here: https://parliamentlive.tv/Event/Index/8e30a968-e6f5-40a6-8599-0312a46fad02 …
2018-07-02T11:23:56,"Can I thank everyone who has been asking me about the London Mayoral race recently.  Sadly, the timing of the selection would make it difficult for me to continue my current role during the UK-EU negotiations.  Here is the statement I'm releasinghttp://syedkamall.co.uk/statement-kamall-rules-out-london-mayor-bid-this-time/ …"
2018-07-01T14:11:22,"RIP to Peter Firmin. One half of the Smallfilms dream team, he brought Oliver Postgate's characters and creations to life like no one else could. Ivor will always be my favourite of their work together, but I do enjoy a bit of Bagpuss and the Clangers now and again.pic.twitter.com/cWOQPDYNmn"
2018-06-29T16:37:13,Thank you to the Lord Lt. for an excellent garden party today. Celebrating #ArmedForcesWeekpic.twitter.com/s3xOEFopjs
2018-06-29T14:25:47,"Positive meeting with Northampton Community Safety Team today. Vicki Rockall, Rachel Packman &amp; Christian Buckenham.pic.twitter.com/oBtyEJd6XE"
2018-06-28T06:58:36,With ⁦@ALewerMBE⁩ Chair of the Publishing APPG at yesterday’s #NationalWritingDaypic.twitter.com/iQPm7JD1vf
2018-06-27T16:45:42,"Loving @EddieHughes4WN speech in Parliament on ""banning stuff"" including his views on @jamieoliver wanting to ban 2 4 1 pizza deals - proper common sense libertarian. Great asset to Parliament."
2018-06-27T13:55:46,This week's Brexit Briefing looks at the strategic calculations surrounding the current stasis in the talks and the other issues facing the EU at the June Council Summit:https://www.danieldaltonmep.co.uk/news/brexit-briefing-no44-brexit-becalmed …
2018-06-27T10:37:12,Irish border special: Today at 2.15pm we question experts @hayward_katy @ShankerASingham @Lorand_Bartels @davidcollinslaw on EU withdrawal negotiations and the Irish border (cc @BorderIrish):https://goo.gl/ZnfgLg 
2018-06-27T06:30:23,"Remainers may call for a 'people's vote' but we all know they mean 'the right kind of people', writes @allisonpearsonhttps://www.telegraph.co.uk/women/politics/remainers-demand-peoples-vote-brexit-really-calling-people-like/?utm_campaign=Echobox&amp;utm_medium=Social&amp;utm_source=Twitter#Echobox=1530045705 …"
2018-06-27T08:15:00,"Starting now: our session with industry reps, fire safety experts, building owners and insurers on building regulations. Watch live here: https://parliamentlive.tv/Event/Index/7eaa4fc3-4eaf-4123-b36d-6c53b4f1e7ae …"
2018-06-27T07:00:00,"In our joint report, we recommend the introduction of a ‘Social Care Premium’ to fund #adultsocialcare. Read our report to find out more about it: https://publications.parliament.uk/pa/cm201719/cmselect/cmcomloc/768/768.pdf …pic.twitter.com/wTI4fEYDnW"
2018-06-25T21:45:37,Powerful speaking from @LeoDochertyUK on this issue. Important that we treat our service personnel properly.https://twitter.com/houseofcommons/status/1011360067344633856 …
2018-06-25T08:45:09,We'll be celebrating as many independently owned businesses as we can throughout July - all part of @IndieRetailUK #IndieRetail Month. Want to join in?pic.twitter.com/5ppTsVKrZG
2018-06-25T15:41:27,Am attending this debate todayhttps://twitter.com/hocpetitions/status/1011247913798905858 …
2018-06-22T16:15:45,"⁦@BriarHillSch⁩ Ambition &amp; Aspiration - today we enjoyed a detailed Q&amp;A session with MP Andrew Lewer.  Terrific questions from year 6 and, he answered all of them!  Thank you Mr Lewer.  We will wash your car next time!pic.twitter.com/CCLXEAORpq"
2018-06-23T11:08:44,Head Girl and Deputy Head Boy gave me a super tour of @BriarHillSch. Great Q&amp;A by Year 6!pic.twitter.com/t0CDM5UBeE
2018-06-21T14:09:40,"My latest Brexit Briefing looks at the final votes on the EU withdrawal bill, the controversy surrounding UK participation in EU crime fighting measures and the latest political crisis in Germany:https://www.danieldaltonmep.co.uk/news/brexit-briefing-no43-meaningful-votes-extradition-and-merkels-latest-crisis …"
2018-06-22T12:14:37,400 Yr 6 children at Duston Cluster Fun Run earlier. With Cllr Suresh Patel handing out medals.pic.twitter.com/F8YkWmRAiz
2018-06-21T10:11:35,It was good to be at the Guide Dogs event last week and discuss the problem of pavement parking. @guidedogspic.twitter.com/GuFbcSeuBq
2018-06-20T14:30:16,"#Didyouknow the British Library at St Pancras is the largest public building constructed in the UK in the 20th century? It took 10 million bricks and 180,000 tonnes of cement to complete #LibraryMemories #ForEveryonepic.twitter.com/LQcKldyiLY"
2018-06-20T16:11:26,Vital services like the NHS demand finance. Tax hikes bring in less! See the Laffer curve. #health
2018-06-20T12:08:42,Today we have announced @ACCNickAdderley as the preferred candidate of Northamptonshire PCC @Stephen_Mold for Chief Constable of @NorthantsPolice Here's more about Nickhttps://bit.ly/2t9JEdM 
2018-06-20T07:20:24,"If MPs vote to weaken the Government's hand today, the UK will pay for it in the negotiations. 

The EU is playing hardball, testing our resolve. The UK must respond with a united front if Brexit is to succeed. #EUWithdrawalBill @BrexitCentralhttps://brexitcentral.com/brussels-watching-westminster-hoping-mps-back-lords-weaken-uks-negotiating-hand/ …"
2018-06-19T12:19:39,Honoured to be elected as Chairman of the new #APPGBuildingCommunities at the inaugural AGM. Thanks to @ACE_Updates for taking on organising @ colleagues @MarkPrisk &amp; @ALewerMBE &amp; @S_Hammond for offering their services to this new initiative @DrNelsonOpic.twitter.com/Xapc0uYhws
2018-06-19T12:27:20,A privilege to spend some time at Wootton Hall with staff members from @NorthantsOPCC as they seek a new Chief Constable for #Northamptonshire. Congratulations to @Stephen_Mold for assembling such a talented group of candidates. #safernorthants #PrayForThem #CelebrateNorthamptonpic.twitter.com/e9PiKEW6F2
2018-06-17T11:35:10,"As PM says part of deal will be real focus on productivity, efficiency and tackling waste. No health care system anywhere in the world will have 'enough' in the face of the demographic challenges we all face so every penny saved will go back into higher quality care for patients."
2018-06-16T11:53:19,#Northampton #TeamBlue out this morning supporting Ausra in St George by election. #ToryCanvasspic.twitter.com/1y1uU7aFsp
2018-06-16T11:05:10,I fully support @ChronandEcho campaign. What do you want to from your town centre? Email me and let me know your views andrew.lewer.mp@parliament.ukhttps://twitter.com/ChronandEcho/status/1007891968905662464 …
2018-06-15T21:26:26,Thanks to Kerry on my visit to @Coral #Northampton today in Market Square and the £50 charity bet on England for #WorldCup2018pic.twitter.com/7vueRO7pNf
2018-06-14T13:57:06,Thanks for showing your support for colleges @ALewerMBE and your local @NorthamptonCollhttps://twitter.com/alewermbe/status/1007255265018859520 …
2018-06-14T12:16:14,"Dear Ambassador @LodhiMaleeha:
Nine years ago today in Pakistan, a Christian mother of five took a drink from the well and wound up on death row for ""blasphemy."" Asia Bibi still languishes in prison. Please tell me: By what logic is your country on the @UNHumanRights Council?https://twitter.com/FreeAsiaBiBi/status/1007211388115324928 …"
2018-06-14T13:35:43,"Another momentous day of votes yesterday, but also attended @AoC_info Report Launch. @AoCDavidHpic.twitter.com/Z5CDkjcu4J"
2018-06-14T06:04:12,My latest Brexit Briefing looks at the critical votes in the House of Commons this week and what it all means for the future direction of Brexit:https://www.danieldaltonmep.co.uk/news/brexit-briefing-no42-commons-battle-take-back-control …
2018-06-13T13:30:33,Watch us live: We are questioning the Economic Secretary for Treasury John Glen MP about the impact of Brexit on UK-EU trade in financial services: https://goo.gl/ZaU6HS 
2018-06-13T10:16:48,"And we are so happy that you did! The event was really special, so many publishers, booksellers and MPs in the same room all sharing stories. #ShareAStoryhttps://twitter.com/alewermbe/status/1006813006012043270 …"
2018-06-13T08:18:20,In between the huge voting sessions I made it to the  World Book Day Commons Reception @PublishersAssoc @BAbooksellerspic.twitter.com/eilwNfUoiH
2018-06-13T06:06:38,Northampton Windrush migrant left homeless for seven years by the Home Office is in a flat following Chron appeal:https://trib.al/iLBk3Ih 
2018-06-11T08:00:00,"At 4.15pm today, we'll be hearing from @theTCPA @britpop @NatInfraCom @FalconChambers1 @Dentons &amp; @GowlingWLG_UK. Watch later here: https://parliamentlive.tv/Event/Index/4d8b1a85-5a1b-48d1-ae1b-27d96e27c43c …"
2018-06-08T22:28:00,Congratulations @NorthantsPolice Chief Superintendent Simon Blatchly who received an OBE in the Queen’s Birthday Honours for services to UK policing. So pleased for you Simon! #topcop #ourpeople #awards #OBE #QueensBirthdayHonours @Pol_Comm_UNMILpic.twitter.com/YAkF9WBxV6
2018-06-08T21:25:17,It was a joy to have been invited to the @UniNorthants Degree Show this evening. Thank you!!pic.twitter.com/gum6g01Trp
2018-06-08T20:37:19,After visiting #KingsHeathPrimarySchool I popped in to see Abdul Hussain to see the valuable work that Northampton Bangladeshi Association deliver for the local community including @NNLearnEnglishpic.twitter.com/chOmCXvIFQ
2018-06-08T19:26:20,@ALewerMBE thank you for visiting us all at Kings Heath Primary Academy today. It was wonderful to share our vision with you as we strive for a #worldclasseducation as part of the David Ross Education Trust. We would welcome you back to see our journey continue!
2018-06-07T10:41:03,Pleased to back @LeoDochertyUK  in his campaign to protect our veterans.https://twitter.com/leodochertyuk/status/1003930522656083969 …
2018-06-04T18:32:36,A big thank you to @10DowningStreet @LordCallanan &amp; @ALewerMBE for today's meeting &amp; discussion on the UK's withdrawal from the EU #localgov #ECRLocalismpic.twitter.com/R8EUIYX2AP
2018-06-05T09:23:33,"Now Joachim Coens, CEO, Port of Zeebrugg says costs of technology customs set up are more like 1% - not the 20% warned by HMRC. Adds that they have already begun ""digitising"" British goods, adding: ""I believe the costs are not the big issue""."
2018-06-06T13:27:41,Watch us take evidence from experts from the financial services industry at 2.30pm on the implications of Brexit: https://goo.gl/8yV7dE 
2018-06-05T16:58:59,Trade policies that hurt world's poorest farmers. The Babelesque € that created mass youth unemployment. A budget that doesn't meet audit standards. Agricultural policies that benefit rich farmers at poor households' expense. What are you on @JustinWelby?https://twitter.com/SunPolitics/status/1004042670883397633 …
2018-06-05T12:02:09,Illustrative of a train of thought that contributed to the Brexit decision.https://twitter.com/politicoeurope/status/1003939598546931712 …
2018-06-04T15:45:05,Watch our second session on land value capture with @LGAcomms @districtcouncil @LDN_gov @CLAtweets @Barrattplc &amp; @THELPDF live here: https://www.parliamentlive.tv/Event/Index/2ce81f12-7403-4c9a-96ee-dcd6963f9539 …https://twitter.com/CommonsCLG/status/992329470555164674 …
2018-06-04T09:36:14,In 1891 59.2% of people in Northampton were directly employed in the shoe industry #NorthamptonFactpic.twitter.com/68kp1KCZaA
2018-06-03T13:32:58,A good way to discuss #Northampton strengths and challenges with @ALewerMBE MP @michaelweedon &amp; Rob Purdie @NorthamptonBID at the county beer festival with local brewers &amp; #smallbiz who make our county so special. Looking forward to working together to support the county.https://twitter.com/alewermbe/status/1003266644582588416 …
2018-06-03T09:11:47,"This Hollywood-style ‘Nightmare At Dover’ WTO scenario in Sunday Times claims we would run out of fuel - hmm does EU produce our oil? (no, Middle East &amp; North Sea); medicines? We are one of world leaders in medicine exports (GSK etc); &amp; 85% of U.K. food is domestic or non-EU!pic.twitter.com/H7GrzT1eGb"
2018-06-03T13:26:22,Two birds with one stone. Met @PhippsNBC MD #AlaricNeville organiser of the #NorthamptonBeerFestival &amp; had a stand up meeting with leaders of @NorthamptonBID &amp; @FSBEastMids @FSBJenThomas discussing plans to improve Northampton's high streetpic.twitter.com/sIQcvU0UTk
2018-06-02T12:03:01,Thank you to the East Mids Bangladeshi Caterers Assoc for inviting me as their guest of honour to share Iftar together #RamadamMubarakpic.twitter.com/iZHhDMlu9Q
2018-06-02T11:37:01,Latest in @DDalton40 excellent series. I have been predicting Italy crisis since elected as an MEP; surprised it has taken this long.https://twitter.com/ddalton40/status/1002177821907865600 …
2018-06-01T20:35:21,Out today with @ALewerMBE in Briar Hill visiting residents #northampton. Thanks @jaderella1988 and @smilingmrkev it was nice to meet you.pic.twitter.com/QHnak7xSac
2018-06-01T19:47:08,Spent a couple of hours yesterday talking to businesses and residents affected by the flood in St Leonard's Road in #FarCotton and today I visited #BriarHill and did the same.pic.twitter.com/xFq2eWbErh
2018-05-31T22:07:46,Iftaar dinner this evening @NorthamptonColl organised by the Bangladesh Caterers Association East Midlands. @ALewerMBE @neelamASingh @Dalwahabi @ArthurNewburypic.twitter.com/76QykB7NQI
2018-05-31T15:16:53,Attending @mycountycouncil briefing on #AdultSocialCarepic.twitter.com/aIRAsjCQMi
2018-05-31T07:20:06,"The Delapre Community Rooms on Alton Road (NN4 8HN) are open today, 8.30am to 8pm. If you need support or would like to talk to someone about how you've been affected by the floods, please pop by and see us or call 0300 330 7000"
2018-05-30T14:01:46,"Labour, Lib Dem, SNP and Plaid Cymru MEPs have backed a report in the European Parliament that threatens to exclude British fish  from a future trade deal unless we stay in the Common Fisheries Policy. Why would any British MEP would support this?  http://conservativeeurope.com/news/labour-and-snp-vote-is-a-betrayal-of-uk-fishing-communities …pic.twitter.com/LDmodWBgrO"
2018-05-30T09:22:43,"More good news in the latest @ONS workless households statistics. The proportion of households in Great Britain with no one in work fell again in Q1 2018, dropping to just 13.9% (excluding students) https://www.ons.gov.uk/releases/workingandworklesshouseholdsintheukjanuarytomarch2018 …pic.twitter.com/Yn5LfTs0Xx"
2018-05-25T09:30:35,The theme of carnival brought out the creativity of both girls and staff this morning for the 6.2 leavers’ day. What a fabulous start to a Friday and for the 6.2 girls’ study leave.pic.twitter.com/tdW3Dv4HSJ
2018-05-30T10:12:58,Carnival workshop in Spring Boroughs. What are we doing? Shsh. Its a secret.pic.twitter.com/990KhZWRiR
2018-05-30T09:23:32,Good news. Spanish National Police just released me after Interpol General Secretary in Lyon advised them not to honor the new Russian Interpol Red Notice. This is the 6th time that Russia has abused Interpol in my casepic.twitter.com/ZonzXizvIJ
2018-05-29T03:24:17,"This Tax Freedom Day, save Britain from growth-killing high taxes http://dlvr.it/QVQfkZ pic.twitter.com/Z4pbj05WEw"
2018-05-28T08:29:49,"Andrew. There appears to have been a significant response from some of the services. It was not limited to St Leonards Road, but Wootton, Hunsbury. Thks to @NorthamptonBC and @Jonathannun for turning out by 20:45, 2 hrs before @NorthantsPolice"
2018-05-28T09:42:11,Our emergency planning team is working with emergency services and other partners following last night’s flooding. Advice for residents can be found here https://www.floodtoolkit.com/  #northampton #flooding
2018-05-28T08:04:59,Thank you to the emergency services and council staff who have been dealing with the flash flood in St Leonard's Road last night @NorthantsPolice @northantsfire @NorthamptonBC @mycountycouncilhttps://twitter.com/ChronandEcho/status/1000861132792434688 …
2018-05-27T20:42:26,Praying for everyone in far cotton - stay safe and hoping the floods isn't a repeat of 1998 #Northampton #flooding #farcotton
2018-05-26T08:44:08,Whilst on maneuvers in #Northampton yesterday I spotted this little photo exhibition by photography student Will Lacey. He starts the University of Northampton in September. Best of luck Willpic.twitter.com/N7W2mzm1l1
2018-05-25T20:28:00,Huge thanks to @patel4witham for being our guest speaker at our Dinner this evening pic.twitter.com/kEnhJBwxnz
2018-05-25T21:33:12,I had a truly wonderful visit to @BridgewaterPrim school today and got some bow and arrow practice in as well. Thank you all for you lovely hospitality!! #NorthamptonSouthpic.twitter.com/GbcvPVMrwK
2018-05-24T10:36:02,Attended debate on @marksandspencer closures. Challenging times for retail brands but for the high street too.
2018-05-24T09:33:35,Questioned Transport Ministers in Chamber earlier on NW phase of Northampton ring road. Key infrastructure for us.
2018-05-22T14:24:47,Agreed that high streets need and deserve support to keep our town centres and independent businesses thriving!https://twitter.com/ALewerMBE/status/998930378088992774 …
2018-05-22T14:15:36,Very disappointed at @marksandspencer news to close its #Northampton store. We need to redouble our efforts to improve the town centre offer and make the high street a better place to visit. I am heavily involved in @CommonsCLG inquiry into the future of our high streetspic.twitter.com/YXwq3MloZb
2018-05-22T12:25:13,"My speech yesterday on letting fees, “some Jim Hacker, some King Solomon”: https://goo.gl/m3dT7g "
2018-05-21T15:30:00,Starting now: our session with @DominicRaab and @claireperrymp on #fracking. Watch live here: https://parliamentlive.tv/Event/Index/f1b73fe7-ae5a-42b1-8852-18e66a094697 …
2018-05-21T02:24:27,"The dictatorship of @NicolasMaduro has, as expected conducted an illegitimate “election”.  Maduro claims he received more votes than the total number of people who actually voted. Tomorrow the U.S. &amp; international community will respond as necessary. #Venezuela"
2018-05-20T19:51:31,"A Pakistani judge has confirmed that #AsiaBibi will soon get the opportunity to have her appeal heard at the Pakistani Supreme Court. Reportedly, Chief Justice Saqib Nisar recently informed Asia Bibi’s legal representation that the date will soon be fixedhttps://www.forbes.com/sites/ewelinaochab/2018/05/20/asia-bibi-will-be-given-another-chance-at-justice/ …"
2018-05-20T13:59:25,"Venezuela is a failed state as it goes to the polls. Inflation may reach 13,000 percent this year. Most folks are going hungry, infants are dying of starvation. No wonder John McDonnell now disclaims it’s a socialist nation."
2018-05-19T07:46:42,Great news! Well done!!https://twitter.com/NHFTNHS/status/997503590251008000 …
2018-05-19T07:11:26,Prince Harry and Ms. Meghan Markle: Titles Announcement #RoyalWeddinghttps://bit.ly/2wTbBdT 
2018-05-18T11:25:11,Some bold thinking in immigration from @SyedKamallhttps://bit.ly/2rUzMDb 
2018-05-17T12:51:54,Mayormaking lunch with @npton_cons and @ALewerMBEpic.twitter.com/6kBKg0cNhR
2018-05-17T11:36:21,At the Guildhall for election of Cllr Tony Ansell as Mayor of Northampton. Congratulations Tony!pic.twitter.com/2tR8QQ5D3t
2018-05-16T11:11:56,"Yesterday's Commons speech on Northampton's housing, transport and governance: https://goo.gl/RjsYcd "
2018-05-16T09:51:02,Watch us live: We are questioning Secretary of State for Northern Ireland Karen Bradley MP about EU exit and arrangements regarding the land border between Northern Ireland and the Republic of Ireland: https://goo.gl/a7zrQg 
2018-05-15T16:41:50,"Spoken in Commons today about Northampton's housing needs, road priorities and local government. Speech by @JohnPenroseNews especially impressive."
2018-05-14T07:20:21,From @LilleyPeter: Sovereignty or prosperity? It’s a false choice. They go hand in hand.https://bit.ly/2wJd3zI 
2018-05-14T08:00:01,Join us at 4pm this afternoon to hear from Mineral Planning Authorities and other #fracking regulatory bodies. Find out what we'll be asking about here:https://www.parliament.uk/business/committees/committees-a-z/commons-select/housing-communities-and-local-government-committee/news/fracking-planning-guidance-evidence-17-19/ …
2018-05-12T15:27:06,Honoured to have been made Honorary Vice-President by Conservative Friends of Bangladesh and a privilege to meet Bangladeshi MP Syeda Mohsin on her visit to London.pic.twitter.com/n6VWGa2o5E
2018-05-12T10:52:12,"It was good to see you! 
#CelebrateNorthamptonhttps://twitter.com/ALewerMBE/status/995254924815536129 …"
2018-05-12T10:50:39,Learning more about the past and present of All Saints' Church from @purgstallheath #NorthamptonSouthpic.twitter.com/tKqx2KvBmT
2018-05-11T18:10:36,Fantastic news for the town!https://twitter.com/lovenorthampton/status/994973580445339649 …
2018-05-11T12:30:26,"Thanks to all of our Junior Wardens who joined Neighbourhood Warden, Caroline Poynter on a litter pick around Lings Primary School yesterday. During the litter pick over 30 bags of litter was collected, helping to make the area a cleaner and safer environment to enjoy.pic.twitter.com/BEmH3YF4HM"
2018-05-10T17:59:50,"References to Israel and Erasmus+ are especially interesting. As an MEP the federalists told me such an arrangement was ""impossible"".https://twitter.com/ddalton40/status/994170842488692736 …"
2018-05-10T12:42:44,"BREAKING: Commissioners appointed by @JBrokenshire to oversee Northamptonshire County Council. They are Tony McArdle, former Chief Exec of Lincolnshire and Brian Roberts, former Dep Chief Exec of Leicestershire @BBCLookEastpic.twitter.com/YH9Beq2uRn"
2018-05-10T12:32:40,With fellow 2017rs @Lee4NED @ALewerMBE @redditchrachel after hearing @KemiBadenoch on her paper for @Freer_UK Importance of Freedom of Expression today at the @iealondonpic.twitter.com/nebtRmM8nX
2018-05-09T23:28:38,"Here it is — 'Freeish Speech: Speaking out in the twenty-first century', by @KemiBadenoch — the second FREER paper 

http://www.freeruk.com/wp-content/uploads/2018/05/Freeish-Speech.pdf …pic.twitter.com/nNeKanpSvi"
2018-05-09T14:00:10,"https://www.northamptonchron.co.uk/news/rogue-landlord-who-ran-unlicensed-hmo-in-northampton-fined-36-000-1-8492324 …
Good news that @NorthamptonBC are cracking down on illegal HMOs"
2018-05-08T15:00:03,Starting now: our session on land value capture. Watch live here: https://parliamentlive.tv/Event/Index/2a52c7a6-cf69-4193-a1cd-4d5a994ef0c3 …
2018-05-08T12:40:51,Delighted to meet a delegation of Maltese MPs today for @CommonsEU with @CPA_UKpic.twitter.com/nj62C3B2P2
2018-05-06T00:18:35,"This is a crucial part of historic England. Let’s hope @HistoricEngland can help cash-strapped @NorthamptonBC to raise the money to restore &amp; preserve it. Or we must look to crowd-funding, etc., to stop this beautiful rarity crumbling further. Happy to help look at all options.https://twitter.com/annecfletcher/status/992847538024865792 …"
2018-05-05T08:50:13,http://ht.ly/CU1S30jQFbr  London Craft Week — next Thursday we're hosting a demonstration by our slipper embroiderers Hand &amp; Lock between 4 and 7.30. #lcw @HandandLock @Londoncraftweekpic.twitter.com/T5RNJeaVCY
2018-05-06T11:20:00,Sir Bill Cash explains the latest chicanery and shenanigans of the Remainers and Reversershttps://brexitcentral.com/latest-chicanery-shenanigans-remainers-reversers/ …
2018-05-04T18:15:40,"Fire Stations across the County fell silent at midday today to remember firefighters lost in the line of duty, this is the Mounts #Northampton, #LongBuckby and #Corby Fire Stations #FMD18pic.twitter.com/RtoF8rdc3o"
2018-05-04T05:50:29,"Labour fail to win Wandsworth, Westminster or Kensington, lose control of Derby and Nuneaton. Tories win Basildon, increase majority in Hillingdon. 

Ohh Jeremy Corbynhttps://twitter.com/GuidoFawkes/status/992278933704851460 …"
2018-05-03T08:38:27,My speech in @HuddlestonNigel debate on grandchildren access to grandparents. @iainastewart &amp; me pay tribute to GranPart and Marion Turner: https://goo.gl/gp3VJh 
2018-05-03T06:23:28,Westminster dawn raiders out at 5:30am this morning #ToryCanvasspic.twitter.com/UAEPUCRbjD
2018-05-02T22:05:43,Out with Westminster City Conservatives on the campaign trail. Vote Team Blue!! #ToryCanvasspic.twitter.com/w8t3CZhe1v
2018-05-02T11:42:51,Good luck to Northampton Partnership Homes tonight. Fingers crossed!!https://twitter.com/NPH_news/status/991628616671707136 …
