2018-08-14T17:52:08,"If I could reverse time, Remain would win, but it lost; Canada++ would be our negotiating model, but there’s the Chequers mess instead. The choice now is between Chequers more diluted by negotiation and the WTO default position. Only the latter is consistent with the Referendum."
2018-08-14T18:11:32,Still aren’t enough Midlands women in #Parliament. I’m so pleased I went for it and I never looked back! @Baronessjenkinhttps://twitter.com/baronessjenkin/status/1029378547209707520?s=21 …
2018-08-17T09:06:11,Please take part in the consultation on the Morpeth masterplan launched by @N_landCouncil. Link here:https://bit.ly/2KJ9H64 
2018-08-15T07:19:10,NEW STAT : Youth unemployment in Britain is now the lowest since records began.pic.twitter.com/hvRBfh0gyX
2018-08-14T08:43:30,"Here’s your 2018 @ConHome Summer Quiz Q:  in which of these pictures is Jeremy Corbyn “there, but not actually part of it”?    A. Laying a wreath for Terrorists.  B. Laying a wreath for British Armed Forces  C.Supporting the IRA.   D. On the frontbench of a once-great Party?pic.twitter.com/05T04neApF"
2018-08-14T07:34:15,Our amazing police looking after us all as ever. Thank you @metpoliceuk @Number10press @theresa_may @sajidjavidhttps://twitter.com/VinnyMcAv/status/1029257297858633728 …
2018-08-13T05:06:55,We need to kickstart the housing market by kicking developers who treat buyers like serfs says @BorisJohnson in @Telegraphhttps://www.telegraph.co.uk/news/2018/08/12/need-kickstart-housing-market-kicking-developers-treat-buyers/?WT.mc_id=tmgliveapp_iosshare_ArGh6G0Qw0VY …
2018-08-12T12:29:35,"Why is it that so many leading Brexiteers studied history? asks @Spectator. Well, this Brexiteer read mathematics and knows that #Brexit just adds up! #optimism #madeintheUK #GlobalBritain @Jacob_Rees_Mogg @JamesCleverly @BorisJohnson @BrexitCentral https://www.spectator.co.uk/2018/08/why-is-it-that-so-many-leading-brexiteers-studied-history/amp/?__twitter_impression=true …"
2018-08-12T08:47:40,It cannot be acceptable that public figures who are victims of #stalking via @Twitter have to suffer continued ordeal &amp; live in constant fear: ‘It feels like my tormentor’s rights trump mine’ @sajidjavid @theresa_may #badbehaviourisbadbehaviour #respecthttp://www.thetimes.co.uk/article/bb724834-9d91-11e8-89e6-46fcaabd1aea …
2018-08-11T05:00:31,In pictures: Officer cadets’ passing out ceremony at Sandhurst #proud #bestofthebest @BritishArmy @ArmyCGS @GavinWilliamson @Tobias_Ellwood @TomTugendhat @MarkLancasterMKhttp://www.thetimes.co.uk/article/f5b4055e-9ca7-11e8-be18-9b68e74f878e …
2018-08-11T04:57:21,"Fascinatind article by Oxford Imam on Islam, its roots and various sections, and on his view that ‘The burka is a fifth column . . . we will wake in the Islamic Republic of Britain’ @BrandonLewis @JamesCleverly @Jacob_Rees_Mogg @BorisJohnsonhttp://www.thetimes.co.uk/article/e99a0960-9cdb-11e8-9b62-17ec317258a6 …"
2018-08-10T08:45:23,Excellent article by Munira Mirza saying that Critiquing Islamist fundamentalist practice is not an ‘attack on Muslim women’. Women should always be free to choose how they dress. But without coersion. @ConHome https://www.conservativehome.com/platform/2018/08/munira-mirza-critiquing-islamist-fundamentalist-practice-is-not-an-attack-on-muslim-women.html … @BorisJohnson @Conservatives @NLandTories
2018-08-08T13:23:56,UK's exports hit record £616bn high in fresh vote of confidence for Brexit https://www.thesun.co.uk/news/6952858/uks-trade-exports-hit-record-high-of-616billion-in-fresh-vote-of-confidence-for-brexit/ … @BrexitCentral @LiamFox @GavinWilliamson @DominicRaab @PennyMordaunt @BorisJohnson
2018-08-07T06:00:42,Good news that @DamianHinds is encouraging industry to develop new technology to spearhead classroom revolution. Can we use these basics to broaden curriculum in rural schools too? @Simon4NDorset @Michael4MDNPhttps://www.gov.uk/government/news/new-technology-to-spearhead-classroom-revolution?utm_source=f6f3b1b3-5e38-4c0d-a6c4-c7dc4644fa58&amp;utm_medium=email&amp;utm_campaign=govuk-notifications&amp;utm_content=immediate …
2018-08-06T12:47:38,A sensible and clear explanation by @mattwridley why the UK has nothing to fear from a world‑trade WTO Brexit. @GeorgeFreemanMP @BrexitCentral @JamesCleverly @michaelgove @thetimeshttp://www.thetimes.co.uk/article/5dbba290-98e5-11e8-9b62-17ec317258a6 …
2018-08-05T06:28:15,.@LiamFox says EU is more rattled by fading chances of Brexit deal than UK since UK economy will thrive as global britain reaches out once again. @thetimes @cazjwheelerhttp://www.thetimes.co.uk/article/bc6d2278-981d-11e8-b2a8-453c9f590323 …
2018-08-04T13:27:25,Brexit REVEALED: What Britain must negotiate to enjoy '£80bn' Brexit victory https://www.express.co.uk/news/uk/998827/Brexit-news-UK-EU-no-deal-WTO-trade-Theresa-May-latest … @Daily_Express
2018-08-04T06:52:05,If you have views on how Govt should address Legacy of Northern Ireland's Past please take a moment to share your thoughts in #NorthernIrelandOffice consultation. Thank you. @TomTugendhat @tnewtondunn @RuthSmeeth @JamesCleverly @IoWBobSeely @LeoDochertyUKhttps://www.gov.uk/government/consultations/addressing-the-legacy-of-northern-irelands-past …
2018-08-04T06:44:42,Congratulations to @N_landCouncil for all their work supporting military veterans and their families in #Northumberland and leading across #NorthEast. #GoldAward  #soproud @RichardMWCA @R_P_Moore @DefenceHQ @GavinWilliamson @Tobias_Ellwoodhttps://twitter.com/DefenceHQ/status/1025333858143756289 …
2018-08-04T06:42:15,So very proud of the whole team! #makingthedifferencehttps://twitter.com/ForwardAssist1/status/1025631326840516610 …
2018-08-04T06:41:32,Fantadtic news that @michaelgove at @DefraGovUK  has created new protections for thousands of seabirds along the #Yorkshire coast. #Ipuffins https://www.gov.uk/government/news/new-protections-for-thousands-of-seabirds … @theresecoffey #25yearenvironmentplan
2018-08-04T06:34:47,UK Armed Forces on high alert for hurricane season as @RFAMountsBay is in post to support islanders if hurricanes threaten them. @MarkLancasterMK @DefenceHQ @RoyalNavyhttps://www.gov.uk/government/news/uk-armed-forces-on-high-alert-for-hurricane-season?utm_source=b58b4a84-5a47-4dcb-8455-cf6dc426a8a5&amp;utm_medium=email&amp;utm_campaign=govuk-notifications&amp;utm_content=immediate …
2018-08-03T08:57:11,"Willie Walsh, head IAG - which owns British Airways &amp; Aer Lingus - says we should be 'sanguine' about Brexit. 

'Brexit is inevitable. There are some issues that will need to deal with but it's not rocket science'. 

He's clear that planes will keep flying over Ireland"
2018-08-03T05:00:38,Today's Photo of the Day is this wonderful puffin shot by Sharon Foster Kent titled 'The Wedding' and taken in the Farne Islands.pic.twitter.com/mKwTsHyT38
2018-08-02T08:05:09,"A decade of digital change - 78% of all adults have a smart phone, but we're getting rid of DVD players...

https://www.bbc.co.uk/news/amp/technology-45033302 …pic.twitter.com/ZBzWco3hrP"
2018-08-02T10:40:34,"Take a look at our gallery of pictures from the #Berwick Minden Day parade.
https://www.berwick-advertiser.co.uk/news/gallery-minden-day-parade-honours-battle-heroes-1-4777352 …pic.twitter.com/RDcsyX2vHW"
2018-08-03T05:37:20,Stop hounding veterans who served Queen &amp; Country says General Sir Nick Carter @ArmyCGS @GavinWilliamson @Number10gov @thetimeshttp://www.thetimes.co.uk/article/252e8712-96ab-11e8-85e3-d844d3177259 …
2018-08-02T18:02:42,"Labour's new communist manifesto calls for a universal benefits income policy which would see huge tax hikes for all, remove incentives to work &amp; crush innovation and growth. Poorest would suffer most. #labourfail @JamesCleverlyhttps://www.telegraph.co.uk/politics/2018/08/02/labours-radical-new-benefits-policy-neo-marxist-dud/?WT.mc_id=tmgliveapp_iosshare_ArCqch9MkHmr …"
2018-08-02T16:11:27,Defence Secretary @GavinWilliamson strengthens Romania ties and thanks RAF crews for their continued commitment on Operation Beloxi. @DefenceHQ @RoyalAirForce #amazingpeople #ourmilitaryhttps://www.gov.uk/government/news/defence-secretary-strengthens-romania-ties-and-thanks-raf-crews?utm_source=e8a79f56-8b6f-4d2d-b4a5-9f36ceabda71&amp;utm_medium=email&amp;utm_campaign=govuk-notifications&amp;utm_content=immediate …
2018-08-02T12:54:22,How the Chequers plan would still leave UK judges subservient to the ECJ  according to QC Martin Howe on @BrexitCentralhttps://brexitcentral.com/chequers-plan-still-leave-uk-judges-subservient-ecj/ …
2018-08-02T11:27:44,"Today we bid farewell to our Commanding Officer, Captain Ellie Ablett MBE, who leaves us for pastures new. We would like to wish her every success in her new role as Commodore, Assistant Chief of Staff Personnel Capability. @ellie_ablettpic.twitter.com/EEQPaxpKMv"
2018-08-01T11:12:37,"""The EU's hallmark isn't free trade among its members but a common external tariff against the rest of the world"" - Barbara Castle, Labour MP (1945 - 1979)pic.twitter.com/BZDZNng91P"
2018-08-02T11:20:31,"Great to see government supporting challenge of pre-schoolers who havent had chance of reading with family. ""Read to your children"" says minister @damianhindshttp://www.thetimes.co.uk/article/90dabd72-944f-11e8-85e3-d844d3177259 …"
2018-08-02T11:20:24,"Fantastic to see my amazing constituent Dan Smith, an army veteran paddling the length of Britain for The Royal British Legion @RBL_Campaigns @GavinWilliamson @DefenceHQ https://www.britishcanoeing.org.uk/news/2018/army-veteran-to-paddle-the-length-of-britain-for-the-royal-british-legion …"
2018-08-02T11:20:16,Japan Welcomes Brexit Britain's Bid to Join Massive Global Free Trade Area https://order-order.com/2018/08/01/japan-welcomes-brexit-britains-bid-to-join-cptpp/ … via @GuidoFawkes @LiamFox #globalbritain @BrexitCentral @DavidDavisMP
2018-08-02T09:25:36,The Government’s kamikaze Brexit strategy beggars belief says @allisterheath in @Telegraph #preparedness #Brexit @DominicRaab @Number10govhttps://digitaledition.telegraph.co.uk/editions/edition_RcMCA_2018-08-02/data/526987/index.html?share=1&amp;WT.mc_id=tmgapp_inar_share&amp;utm_source=tmgapp&amp;utm_medium=inar&amp;utm_content=share&amp;utm_campaign=tmgapp_inar_share&amp;Expires=1535583600&amp;Signature=WC3h3e1Xz4ZnWJZObyIeLG8ZBgz2HL9yHICWb3Dlfa8cMm3KiDfXaxRG~d5qJ1rzmUXVZuXb~Mw9TmWyVCbozgXivSFx5C2dOv-3SXIY~vb4q~QmS5SJHB8-AruM6P58O9Zy5GRcKTQaRFHNw1uEc~-eMHMVCyKlHdo0vR9Yv4P8IgkGcsXOdqivxRPCePvk7ZLgKjcaa3Ct5tplLP64vNkFhV5kJmascpUSYPg0xQyBHVSatjFtBpy4njEtjaobRDKpP2BJELPGuC8qJqih8L8gnGAK7jW55iNCZe-NlMgw4tBTqhWhxBVJE4iErg-gRUvtMJvl46~aOY6N7kITDA__&amp;Key-Pair-Id=APKAJLCEPDGCTPVKXNOA …
2018-08-01T11:25:04,MOD appeal for families of missing or killed soldiers from the Korean War https://www.gov.uk/government/news/mod-appeal-for-families-of-missing-or-killed-soldiers-from-the-korean-war … @haynesdeborah
2018-08-01T09:32:47,"What's this tosh about giant lorry parks after 'no-deal' Brexit? The WTO Trade Facilitation Agreement (ratified by 136, including EU, states in 2017) mandates seamless, hi-tech practices at the border. The World Bank reported in 2016 that 98% of border traffic went unchecked."
2018-07-27T11:24:39,Plastic carrier bag sales have been reduced by 86% since the introduction of the 5p charge in 2015.pic.twitter.com/qfRqudhkPX
2018-08-01T10:25:47,Many congratulations to @Siobhan_Baillie on being selected as the @Conservatives candidate for Stroud. Her commitment to the area is second to none - she’ll be a superb Member of Parliament.pic.twitter.com/xmeFtQ6U5l
2018-08-01T05:45:24,UK exports to non EU countries continue to outstrip EU as goods exports globally increase by 13%. Biggest UK export market with 18% of all goods &amp; services still the USA.https://www.gov.uk/government/news/uk-exports-to-non-eu-countries-continue-to-outstrip-eu …
2018-07-29T05:29:38,Great news that government is looking into holiday homes classified as businesses which dodge £80m council tax #Beadnell #Northumberlandhttp://www.thetimes.co.uk/article/e6ed8538-9291-11e8-86ee-e22d14bef8b7 …
2018-07-28T06:33:25,"UK to double support for Palestinian economy, and improve clean water supplies, to support work to advance peace with Israel @PennyMordaunt #2statesolutionhttps://www.gov.uk/government/news/uk-to-double-support-for-palestinian-economy-to-advance-peace-with-israel?utm_source=a74d250b-c7b0-4350-affd-4a12e8ebeb86&amp;utm_medium=email&amp;utm_campaign=govuk-notifications&amp;utm_content=immediate …"
2018-07-26T15:45:43,Michel Barnier says EU 'cannot and will not' accept UK collecting EU customs duties - the centrepiece of Theresa May's Chequers deal
2018-07-26T08:57:55,"It is gut-wrenchingly shocking that a Labour Party to which my late dad devoted his life, as did so many Jewish socialist intellectuals like him from aspirational &amp; working class backgrounds, should be seen as the enemy by the mainstream Jewish communityhttps://www.thejc.com/comment/leaders/three-jewish-papers-take-the-unprecedented-step-of-publishing-the-same-page-on-labour-antisemitism-1.467641 …"
2018-07-26T09:57:09,The Canada Plus Plus Plus answer to the Northern Ireland question by @ConHomehttps://www.conservativehome.com/thetorydiary/2018/07/what-was-the-brexiteers-alternative-answer-to-the-northern-irish-border.html …
2018-07-26T05:46:08,"Thanks for supporting the need to keep @CrossCountryUK stopping in Northumberland @annietrev. 
Solving train overcrowding by not stopping at stations is like fixing school parking issues by closing the schools."
2018-07-26T06:25:42,Well done @Morrisons for making 9-10am aisles of calm for shoppers with autism. @Autismhttp://www.thetimes.co.uk/article/1bf83078-9050-11e8-8c1a-b63727488402 …
2018-07-25T23:34:05,Fantastic that a new 44 mile stretch of the England Coastal path opens up North East coastline from Amble to South Bents. #amble @AmbleCom @DefraGovUK @michaelgovehttps://www.gov.uk/government/news/44-mile-public-path-opens-up-north-east-coastline?utm_source=bbbee4f6-569e-4718-a14f-b2c651103b07&amp;utm_medium=email&amp;utm_campaign=govuk-notifications&amp;utm_content=immediate …
2018-07-25T18:07:34,"Speaks volumes that Britain’s 3 top Jewish newspapers feel the need to do this. 

When will Corbyn get it? 

And when will Labour MPs actually do something about it? 

It’s not ok to just look the other way. ##EnoughIsEnoughhttps://twitter.com/jewishtelegraph/status/1022179660287930368?s=21 …"
2018-07-25T12:37:23,"V-positive meet with @annietrev  
MP for Berwick upon Tweed 
Who will be supporting @mndcampaigns by writing to @EstherMcVey1 &amp; asking Government to Support @MadeleineMoon Bill to #Scrap6Month on #SRTI
https://www.mndassociation.org/get-involved/campaigning-influencing/scrap-six-months/ …pic.twitter.com/nTN7jnLqtL"
2018-07-25T14:18:37,"Sad to leave @FOST; an inspirational place to work, full of outstanding people from the RN and close allies working together to deliver vital war fighting training to our Sailors and ships..... I'll miss it.pic.twitter.com/6dH2SjgtOX"
2018-07-25T14:20:59,"7th Astute class submarine HMS Agincourt is to be be twinned with Torbay

Hopefully she will join the fleet by 2024

https://www.bbc.co.uk/news/live/uk-england-devon-44857971?ns_mchannel=social&amp;ns_source=twitter&amp;ns_campaign=bbc_live&amp;ns_linkname=5b581ea33c367b0681d255d6%26Submarine%20HMS%20Agincourt%20twinned%20with%20Torbay%26&amp;ns_fee=0#post_5b581ea33c367b0681d255d6 …pic.twitter.com/GlGXMg5slk"
2018-07-25T08:47:39,Great news for my constituents.https://twitter.com/nus_ghani/status/1022020739136987136 …
2018-07-25T08:33:10,Very ill-judged for Commission to keep pursuing treating N Ireland differently to GB. Was awkward shuffling when I spoke to top German politicians &amp; industry leaders at Petersberg recently &amp; reminded them how important the unity of their country had been in 1990.
2018-07-25T07:56:08,"It’s ‘out with the old, in with the new’ down on #845nas with Commando Helicopter Force @RNASYeovilton as they transition to the Commando Merlin Mk4 with its folding tail and rotor! #CarrierCapable @HMSQnlz #chf @RoyalNavy @RoyalMarines #greyisthenewgreen #flynavy pic.twitter.com/Rht4ilvsn4"
2018-07-24T22:04:05,"Treason laws are out of date. We need to update them to try criminals here, not exporting them to the US breaking our own rules on the death penalty. That means an updated treason law because betrayal matters - it unpicks society and creates divisions.https://www.thesun.co.uk/news/6856496/mps-rekindle-1351-treason-act/ …"
2018-07-24T19:58:17,'End of Term Announcements' - Pinstripedline blog on the closure of RAF Scampton and why this is good news overall. https://goo.gl/tHLaa2 pic.twitter.com/xAFJD7vdXd
2018-07-24T11:07:48,"Last week @BestForBritain blasted Vote Leave for an incorrect spending return, saying: ""it is time for them to admit the campaign was dodgy. They need to apologise."" 

Today Best for Britain have been fined by the Electoral Commission for an incorrect spending return in 2017."
2018-07-24T14:45:00,Brilliant news that the Parental Bereavement Leave Bill has now passed both the House of Commons and the House of Lords which means when we return from recess it will become and Act of Parliament. Thank you to @kevinhollinrake and @LordJimKnight for taking it through Parliament.
2018-07-24T16:45:37,".@cmackinlay: My worry is that this common rulebook will mean international trade deals are off of the table.

@DominicRaab: I'm not going to tell you that if we didn't have full regulatory autonomy it wouldn't be an additional string to our bow in free trade negotiations.pic.twitter.com/vQNhMEBAQ9"
2018-07-24T16:38:05,".@cmackinlay: I feel that over the last few months I've been misled... We've had the previous Brexit Secretary here outlining the progress he was making... but somehow, quietly, that was ripped up

Olly Robbins: I honestly don't recognise the picture you're painting.pic.twitter.com/767Fq0Z8eS"
2018-07-24T19:05:16,The White Paper for the forthcoming EU (Withdrawal Agreement) Bill was published today. This Bill is an essential part of our preparations for a smooth &amp; orderly exit from the EU. Looking forward to guiding it through the @HouseofLords #RoadToBrexithttps://twitter.com/DExEUgov/status/1021825015925420032 …
2018-07-24T17:02:18,https://www.conservativehome.com/thecolumnists/2018/07/henry-newman-unstopping-the-northern-ireland-backstop-which-threatens-to-block-a-deal.html …
2018-07-24T05:44:38,"EXCLUSIVE: Pay rise for @RoyalNavy, @BritishArmy, @RoyalAirForce today. Set to be a 2% rise, topped up by 0.9% “bonus” back dated to April. Not the permanent 3% boost that had been expected but 1st rise above 1% in 5 years. Will be welcomed
@SamCoatesTimeshttps://bit.ly/2JP1rMC "
2018-07-24T08:33:02,Wait till Chequers means we still have to put up with this stuff. #ChequersMeansCorbynhttps://twitter.com/jackschickler/status/1021312207873888256 …
2018-07-23T17:24:20,Defence Secretary highlights North East’s military footprint at Gateshead defence firm @GavinWilliamson @DefenceHQhttps://www.gov.uk/government/news/defence-secretary-highlights-north-easts-military-footprint-at-gateshead-defence-firm?utm_source=012c8cd0-5bf1-4689-b12d-7d288c7acb94&amp;utm_medium=email&amp;utm_campaign=govuk-notifications&amp;utm_content=immediate …
2018-07-23T14:00:45,The distance between your dreams and reality is called action.... #RoyalNavyLife #MondayMotivationpic.twitter.com/DhHVBBtXme
2018-07-23T13:44:31,Excellent article by economist Patrick Minford explaining that World Trade rules are nothing to be scared of: UK will flourish without dead hand of EU  @BrexitCentral @Number10gov @DominicRaab https://www.express.co.uk/comment/expresscomment/992795/brexit-wto-world-trade-rules-uk/amp?__twitter_impression=true …
2018-07-23T12:36:29,"We're investing £780 million in the East Coast Main Line to give passengers more seats and faster, more frequent journeys 
#NorthernPowerhousepic.twitter.com/h91wIe7hDy"
2018-07-23T10:34:45,MoD respond to Voyager 'scandal' as Mail on Sunday publishes old newshttps://ukdefencejournal.org.uk/?p=19117 
2018-07-23T07:03:28,Theresa May is bringing her Cabinet to Newcastle today and says she has 'a very simple message'https://www.chroniclelive.co.uk/news/north-east-news/theresa-may-ill-give-north-14938550 …
2018-07-23T09:13:47,"Today, I’m bringing the Cabinet to the heart of Tyne and Wear and the heart of the Northern Powerhouse. And we’re coming with a very simple message: this Government believes in the North East, and this Government is backing the North East.https://twitter.com/ChronicleLive/status/1021289677096136704 …"
2018-07-23T08:45:35,"Please see my latest article on the Brexit negotiations, our preparations for leaving the EU and our future relationship with Europe.https://www.teamtrevelyan.co.uk/news/future-relationship-european-union …"
2018-07-23T07:23:10,Great to publish @GregHands on @BrexitCentral this morning: a reflective piece raising the searching questions which the EU27 are failing to ask themselves in the wake of Brexithttps://brxcen.com/2Nz8NGk 
2018-07-23T05:00:21,Calling Conservatives: New public appointments announced. National Citizen Service Trust board members – and morehttp://bit.ly/2zZ4v9f 
2018-07-22T21:29:47,Out of Europe we will be able to take back control of our tax system - including making @amazon collect UK VAT as they are now required to do in Australia. No wonder they want us to sign up to stop us doing that.https://twitter.com/thetimes/status/1021142598130466817 …
2018-07-22T13:55:43,Good news that Brexit Secretary Raab vows UK will NOT pay £40billion ‘divorce’ bill without trade deal @MailOnline @DominicRaab @BrexitCentral @Jacob_Rees_Mogghttp://www.dailymail.co.uk/news/article-5979161/Brexit-Secretary-Raab-vows-UK-NOT-pay-40billion-divorce-bill-without-trade-deal.html …
2018-07-22T10:30:01,Re. today's latest #Brexit scare story I asked a leading children's physician - THREADpic.twitter.com/tfDGxmCi2n
2018-07-22T06:56:24,"Well done @DominicRaab for winning this important battle. 

However, if Conservative MPs and members and the public will not support the overall partnership, the issue will be swamped as the package is rejected.https://twitter.com/BrexitStewart/status/1020812237873860608 …"
2018-07-21T16:58:08,"We’re hiring, if you’ve ever thought about working for the @Conservatives (or even if you haven’t) have a look at these opportunities. 

https://www.conservatives.com/work-for-us/content-creator---july-2018 …
https://www.conservatives.com/work-for-us/head-of-operations-and-regional-media-july-18 …
https://www.conservatives.com/work-for-us/campaign-manager-plymouth-july-18 …
https://www.conservatives.com/work-for-us/campaign-manager-lboro-july-18 …"
2018-07-21T14:29:02,Was a huge honour this week  to award the first set of Operation Shader medals to our incredible service personnel and to announce that the Queen has granted permission to extend it to all those who made such an important contribution to this campaign.pic.twitter.com/zGcVCjqQdZ
2018-07-21T13:09:38,A perfect opportunity to thank the #KingsRoyalHussars and their families as they paraded through #Leyland this morningpic.twitter.com/hKrVEUdgLC
2018-07-21T11:42:13,"Is this supposed to be funny? Communism enslaved, imprisoned and executed millions upon millions of people. If you’re normalising it as some sort of fun fashion accessory, you’re no friend of @UKLabourhttps://twitter.com/OwenJones84/status/1020339131296174080 …"
2018-07-21T09:01:43,‘Corbyn would leave our country and its allies at risk of nuclear blackmail’ says MP John Woodcock as he leaves the Labour Partyhttp://www.thetimes.co.uk/article/f6cb955a-8c59-11e8-9b4b-d04c94d077dc …
2018-07-21T08:50:50,"Corbyn is a security risk, says the first MP to quit Labour.http://www.thetimes.co.uk/article/b79ddf42-8c62-11e8-9b4b-d04c94d077dc …"
2018-07-21T08:48:27,"May’s Brexit exposes EU to fraud risk, claims Barnierhttp://www.thetimes.co.uk/article/70597ffe-8c2d-11e8-9b4b-d04c94d077dc …"
2018-07-21T08:38:54,A powerful expose of how the EU project and its leaders' belligerence has made a pro-EU supporter realise its undemocratic vision will destroy communities and trust. @BrexitCentral @spectator @thetimeshttps://twitter.com/danieljohnsalt/status/1020385035613065217 …
2018-07-20T21:16:26,Fair enough to the fly-boys - this is hoofingly skillful.https://twitter.com/Rotarywings1/status/1019948736099901442 …
2018-07-20T17:55:06,Schools Out for Summer!! Looking for ideas of things to do with the children. Check out our website #northumberland #events #schoolholidays #GN18 #nlandfun http://ow.ly/Qu0u30kZtsS 
2018-07-20T07:00:17,"The Big #ButterflyCount starts today! All you need is 15 minutes in a garden, park or woodland to take part! @savebutterflies have made it easy to log your sightings through their app and have a handy #butterfly chart to help you know what to spot: https://www.bigbutterflycount.org/ pic.twitter.com/sN6gaTz2Uy"
2018-07-20T10:03:36,"Fascinating and timely survey by @BritishCouncil on young Americans' attitudes to the UK. ""69% of Americans surveyed rated the UK as ‘a global power’, placing it above all other G20 countries except China (on 70%)."" https://www.britishcouncil.org/organisation/policy-insight-research/a-special-relationship …"
2018-07-20T11:35:04,https://ukdefencejournal.org.uk/robot-wars-drones-to-support-front-line-operations/ …
