2018-10-25T17:52:51,Great news that every part of the armed forces now open to women... but its not entirely new. Check out the female SOE agents ⁦@GavinWilliamson⁩ ⁦@DefenceHQ⁩ ⁦@RoyalNavy⁩ ⁦@RoyalAirForce⁩ ⁦@RoyalMarines⁩ ⁦@BritishArmy⁩  https://en.m.wikipedia.org/wiki/List_of_female_SOE_agents …
2018-10-25T15:53:03,I am absolutely delighted to announce that all roles in the military are now open to women. Our Armed Forces will now be determined by ability alone and not gender. This is a truly defining moment in the history of the Armed Forces.
2018-10-25T11:13:09,"Today, the government will introduce the Fisheries Bill to Parliament, a major milestone in delivering on the promise to take back control of the UK's waters. It extends powers to protect and enhance our precious marine environment. #fisheries #environmentpic.twitter.com/U01h8vKP47"
2018-10-24T12:48:33,It’s easy to forget how tough things were in 2010. We took the difficult decisions the country needed to get our economy back on track. Proud we @Conservatives are delivering for the whole country with more jobs &amp; better payhttps://twitter.com/Conservatives/status/1055039229431070720 …
2018-10-24T12:27:57,Industry giants @SellafieldLtd @BMW and @Airbus are among the major engineering companies to recruit talent from our training scheme to prepare learners for careers in industry. Full story here: https://bit.ly/2OJSKuh pic.twitter.com/8ZNbqEN2A8
2018-10-12T09:46:43,"New #TLevels, an alternative to A Levels coming in 2020, include 3 months with a real employer to help young people get ready for work or further study"
2018-10-24T09:51:31,Mark is a triple amputee. #commandoethoshttps://twitter.com/johnjdanks/status/1055028670815862784 …
2018-10-24T08:58:07,"Championing core subjects and music education go hand-in-hand. As a mathematician and musician myself, its wonderful to see ⁦@NickGibbUK⁩ putting £300m into music education hubs. #music&amp;mathsgotogetherhttp://www.thetimes.co.uk/article/876b91b0-d6eb-11e8-9c20-5eb2e7b96a26 …"
2018-10-24T06:29:38,Also important to remember the EU sells the UK £100Bn more goods than we sell them. Any trade friction would hurt EU and French firms more than the UK. Moreover we must not be bullied by threats in these negotiations - threats that simply underline we will be well out of the EU.
2018-10-24T06:20:24,On imports the UK controls passport checks at the Calais juxtaposed controls and would decide whether to conduct any customs/regulatory checks. So talk of shortages is from imports is not right.https://twitter.com/tnewtondunn/status/1054841788308078592 …
2018-10-23T17:02:38,"Great to see recent stats out from @ONS showing strong progress on our public finances:
-Lowest September borrowing since 2007 
-Lowest year-to-date borrowing in 16 years pic.twitter.com/72vR27YVBa"
2018-10-23T09:46:19,The country has already spoken. Making us vote again would simply produce a bigger victory for Leave.https://www.thesun.co.uk/news/7558357/leave-smash-remain-second-referendum/ …
2018-10-23T07:08:38,The pressure will keep increasing on this issue. It is one that a modern Conservative party can unite around - the pursuit of elderly vets must end. Delighted so many colleagues involved in this - speaks to values and ethos of our Party.http://www.bbc.co.uk/news/uk-politics-45947678 …
2018-10-23T06:35:16,"23 charts and maps that show the world is getting much, much better https://www.vox.com/2014/11/24/7272929/global-poverty-health-crime-literacy-good-news?utm_campaign=vox&amp;utm_content=entry&amp;utm_medium=social&amp;utm_source=twitter … via @voxdotcom"
2018-10-23T06:05:31,Excellent article sets out my own anxieties about EU's backstop control mechanism which would stifle UK competitiveness.@BrexitCentral @Jacob_Rees_Mogg @MarcusFysh @TomTugendhathttps://brexitcentral.com/eus-backstop-not-insurance-policy-trap/ …
2018-10-23T05:05:05,"UK contribution to Ex #TridentJuncture in numbers. With over 50,000 participants from 31 nations, this is NATO's biggest collective defence exercise in over a decade. Find our more here  http://ow.ly/47wT50jt44s pic.twitter.com/n7yfGTxe5K"
2018-10-22T17:24:09,Very proud to be on the committee approving our North of Tyne deal with Minister ⁦@JakeBerry⁩. ⁦@N_landCouncil⁩ ⁦@RichardMWCA⁩ ⁦@R_P_Moore⁩pic.twitter.com/7eieAviq66
2018-10-22T16:46:57,"THREAD: The UK and US regularly collaborate in capability development and today’s Atlantic Future Forum in @HMSQNLZ is a welcome opportunity to discuss several areas of mutual interest, including cyber and AI, with government, military &amp; industry sector specialists.pic.twitter.com/SJjWtDOEtK"
2018-10-22T16:11:55, @LiamFox speaking about strong US-UK partnership in cybersecurity  at the Atlantic Future Forum aboard the @HMSQnlz today. #GREATTradepic.twitter.com/TozUgDFKM3
2018-10-22T14:46:26,Joint Forces Command appoints new Director of Overseas Bases - http://GOV.UK https://www.gov.uk/government/news/joint-forces-command-appoints-new-director-of-overseas-bases?utm_source=54e44f5a-8131-48aa-b1fd-605b8a598b76&amp;utm_medium=email&amp;utm_campaign=govuk-notifications&amp;utm_content=immediate …
2018-10-22T11:18:51,"The captain of the UK team, Dot Perkins, celebrates after winning a silver medal in the rowing at the Invictus Games Sydney 2018. #magnificent @InvictusSydney @Tobias_Ellwood @DefenceHQ @GavinWilliamson @JohnnyMercerUK @TomTugendhat @BritishRowing @JamesCleverlypic.twitter.com/9aMReTnak7"
2018-10-22T07:13:48,⁦⁦.⁦@HMSQnlz⁩ hosts UK-US International Trade Day in New York as ⁦@LiamFox⁩ leads UK future trade deals with global partners post-Brexit ⁦@BrexitCentral⁩ ⁦@SteveBakerHW⁩ ⁦@Jacob_Rees_Mogg⁩ ⁦⁦⁦@DominicRaab⁩https://www.gov.uk/government/news/hms-queen-elizabeth-hosts-uk-us-international-trade-day-in-new-york?utm_source=698b4824-3849-4d43-b10a-6e3ac076a24b&amp;utm_medium=email&amp;utm_campaign=govuk-notifications&amp;utm_content=immediate …
2018-10-21T19:21:04,"This man, and his heroic friends, performed one of the more extraordinary feats of courage and endurance in WW2. His death is a sadness but he lives on in the tales of bravery few could ever match. #ThankYouhttps://twitter.com/patrickbaty/status/1054088445738582016 …"
2018-10-21T13:18:01,"It was fantastic to welcome my friend and colleague @annietrev to Berwickshire to talk #Borderlands Growth Deal, #Brexit and many other things!
  
@ScotTories @Conservativespic.twitter.com/8mMP3Fish7"
2018-10-21T18:41:56,".@HMSQnlz evening in New York 

#Westlant18 #QEinNYpic.twitter.com/1iGcTh1Fuo"
2018-10-21T18:00:21,It was an honour to spend time this weekend on board @HMSQnlz. We have shown #commitment to the security of our Nation and the security of our Allies. A truly memorable day for myself and @RoyalNavy #GlobalBritain #QEInNYpic.twitter.com/hz9TIo2Mvz
2018-10-21T17:46:11,This is excellent news @Tobias_Ellwood   Thank you for listening to veterans concerns.https://twitter.com/SEAC_Defence/status/1054066110310633473 …
2018-10-21T02:10:29,"Good Morning #GreatBritain

Some say we are creating a stir on the Manhattan skyline; since this is an iconic day in @RoyalNavy history we will let the picture do the talking  #QEinNY 

Photo Credit: @georginafstubbspic.twitter.com/tsFg0iViRi"
2018-10-12T09:26:58,"Get ready for #Tlevels, a new choice after GCSEs coming in 2020. Designed with employers to help young people's careers take off #TechEd #IndustrialStrategy"
2018-10-20T20:03:02,Don't let the truth get in the way of a good story.  Don't they realise that EU funding came from us anyway along with the part we don't see back ?
2018-10-18T16:52:08,"Devastating speech from Petraeus re veterans witch hunt: ""Britain’s considerable fighting capacity will be greatly diminished if it cannot reform the legal framework within which it fights, restoring the primacy of the law of armed conflict.""https://twitter.com/Policy_Exchange/status/1052963246230171649 …"
2018-10-20T12:17:56,"Like Phillip, I campaigned to Remain in June 2016. But I agree with Tim. A second referendum isn't the answer, and will likely be highly detrimental. @DrPhillipLeeMP @montiehttps://twitter.com/montie/status/1053615118108540928 …"
2018-10-20T13:29:09,"Good Morning #NewYork Good Afternoon #GreatBritain
@nycgov @RoyalFamily @WhiteHouse @UKinUSA @UKinNewYork @RoyalNavy
#QEinNY #Westlant18pic.twitter.com/7eM6nThThT"
2018-10-20T15:57:00,"During the Great Debate at the end of the referendum campaign, Sadiq Khan issued a rallying cry to the nation: ""if we as a country decide to quit, then we're out for good, there's no going back"".
RETWEET if you think he should stick to his word!pic.twitter.com/ucNfcshV7I"
2018-10-20T15:38:21,"Boasting on Lib Dems’ #Yeovil Facebook page today: “On the way to London with Liberal elite, we will stop Brexit.” Clegg, Blair &amp; other Remainers traipsing through Brussels &amp; European embassies to encourage EU’s intransigence has been sickening. What does Paddy say about that?https://twitter.com/Change_Britain/status/1053668412499488769 …"
2018-10-20T15:33:35,Defence Secretary @GavinWilliamson pays his respects to the victims of 9/11 at the #911Memorial in New York @Sept11Memorial #NYC pic.twitter.com/oYa0cvFKDU
2018-10-20T08:33:25,"An attempt is being made by @SteveBakerHW to render illegal the EU’s Northern Ireland Brexit backstop, which would put NI in customs union and single market but not GB. He has put down amendments to Northern Ireland bill to that effect. This gives government and MPs a..."
2018-10-19T19:05:55,"Ships company planning a very well deserved run ashore

@HMSQnlz #NewYork
#UKinUSA #Westlant18pic.twitter.com/upM6k2tHQh"
2018-10-19T16:59:06,So pleased to be supporting #Berwick ⁦@CancerResrch⁩ committee and their candlelit lantern walk on 1st November. Meet at Parade Car Park at 5:30pm #letsBeatCancerSoonerpic.twitter.com/iGfe0BTX2I
2018-10-19T15:50:00," Britain's newest aircraft carrier HMS Queen Elizabeth @HMSQnlz has arrived in the Upper Bay of New York. 

Read the full story: https://www.royalnavy.mod.uk/news-and-latest-activity/news/2018/october/19/181019-qnlz-arrives-in-new-york …pic.twitter.com/3o2b0CHmkx"
2018-10-19T15:17:29,"#Manhattan #CentralPark #StatueofLiberty #WallStreet #MadisonSquareGardens #TimesSquare #EmpireStateBuilding #Broadway #BrooklynBridge #Bronx #ChryslerBuilding #GrandCentral #Macys #YankeeStadium #Chinatown #OneWorldTradeCenter 

And now;

#BritainsBiggestWarshippic.twitter.com/OCXgqPwwYr"
2018-10-19T13:51:59,HMS Queen Elizabeth is a symbol of our commitment to our #security and the security of our allies. Her entry into New York harbour demonstrates that our Armed Forces are ready to stand by our #allies @HMSQnlz @RoyalNavy #GlobalBritain #QNLZatseahttps://twitter.com/DefenceHQ/status/1053278501904809984 …
2018-10-19T12:48:07,Great to see @annietrev and Lord James Percy in the glorious grounds of @ellinghamhall today. There to  celebrate the work of @Alncom_co_uk delivering superfast broadband to rural communities #GigabitVoucherpic.twitter.com/sPW75JIyAr
2018-10-19T12:10:01,"Reaction Weekend - arts, culture, reviews, ideas - @reactionlifehttps://reaction.life/reaction-weekend-arts-culture-reviews-ideas-2 …"
2018-10-19T11:03:44,Defence Minister Stuart Andrew conducted his first official visit to @BritishArmy  Headquarters and the Armoured Trials and Development Unit. The Minister got first-hand experience in a Challenger 2 tank and Warrior Infantry Fighting Vehicle.pic.twitter.com/WXLBw7KNs7
2018-10-19T09:42:00,Always so reassuring to see the #Berwick bridges and know that I am home. #INorthumberland #favouriteplacespic.twitter.com/76PVqmwv6f
2018-10-19T08:30:04,Jacob Rees-Mogg says ‘billions’ paid for Brexit transition extension should fund Universal Credit insteadhttps://inews.co.uk/news/brexit-news-latest-jacob-rees-mogg-universal-credit-sky-news/ …
2018-10-18T16:51:52,At ⁦@Policy_Exchange⁩ ⁦@JohnnyMercerUK⁩ talks about those who served in UK military and the international embarrassment that is IHAT. ⁦@DefenceHQ⁩ ⁦@Geoffrey_Cox⁩ ⁦@GavinWilliamson⁩pic.twitter.com/4ekhCAzXaQ
2018-10-18T16:46:43,Gen Petraeus says fear of prosecution may lead to risk aversion within British military &amp; may undermine our effectiveness in multinational coalitions - in contrast to the way the US treats its veterans #lawfare #PXpatriotismpic.twitter.com/rtXR6fDuZq
2018-10-18T16:44:12,"Gen Petraeus tells PX that expansion of European human rights law ""is having a chilling effect on recruiting, retention &amp; overall morale of British armed forces"" #lawfare #PXpatriotismhttps://twitter.com/annietrev/status/1052962072726777857 …"
2018-10-18T16:37:33,"Join me in cutting back on single use plastic waste. Refill your water bottles for
free at refill stations across the country. @refill @beisgovuk #GreenGB #CleanUKpic.twitter.com/3JUZ2SexpN"
2018-10-18T16:38:15,Looking forward to some lively discussion @Policy_Exchange on the important subject of lawfare and veterans being hounded by judicialisation of conflicts @TomTugendhat @PetraeusNews @JohnnyMercerUKpic.twitter.com/XIGsnwyvPB
2018-10-18T13:39:29,"After grilling from Berwick Middle School pupils...! #LocalDemocracyWeek
#NlandLDWpic.twitter.com/0ExeD2i47E"
2018-10-18T11:50:31,"Thank you to @eddevtrust for hosting an engaging debate on effective education policy, with education ministers from around the world. Learning from each other will help us to ensure all children receive a world-class education, regardless of their background.pic.twitter.com/BJLG9pJmaF"
2018-10-18T10:24:48,That is fabulous and thoroughly restorative. Thank you!https://twitter.com/willfhamilton/status/1052854112134590464 …
2018-10-18T10:21:34,"Harry and Mark from @AlnwickGarden are trekking the Himalayas to raise money for the Garden's new Education Centre. 

Please read about their quest and support them here:https://bit.ly/2PHzYQM "
2018-10-17T16:05:22,"Today @DamianHinds has committed to improving #alternativeprovision so every child, no matter their circumstances, has the opportunity to reach their potential: https://www.gov.uk/government/news/education-secretary-vows-to-take-action-on-school-exclusions …pic.twitter.com/yoDW4w7lLb"
2018-10-17T17:40:12,Thank you to those who joined us in Parliament yesterday to celebrate our #OpportunityArea programme. Doncaster is one of the 12 areas and is using its funding to open up extra-curricular activities for those from disadvantaged backgrounds: https://www.youtube.com/watch?v=MQp70ZEqxf0&amp;t=9s … #SocialMobility
2018-10-18T08:13:12,HMS Queen Elizabeth to visit New Yorkhttps://ukdefencejournal.org.uk/hms-queen-elizabeth-to-visit-new-york/ …
2018-10-17T15:00:01,Donald Trump reveals the US will start talks on a Brexit trade deal with Britain the moment we quit EUhttps://www.thesun.co.uk/news/7513015/donald-trump-us-talks-brexit-deal-after-britain-quits-eu/ …
2018-10-16T11:07:28,"NEW @ONS figures show more than 3 million people are in work compared to 2010 – more than 1,000 jobs a day.

Pay is growing at its fastest rate for almost ten years, and we are helping people’s pay go further by keeping taxes low as we build an economy that works for everyone.pic.twitter.com/ys697bGvJJ"
2018-10-16T21:29:52,Thanks for all the loveliness and funny abuse. Just pse donate. £15m last year. Records are there to be broken x https://www.channel4.com/programmes/stand-up-to-cancer …pic.twitter.com/yILFPjdxyg
2018-10-16T10:34:03,Amble calling! Our judges and @VisaUK street teams are also in Amble don't forget to drop by if you're local! #MyHighStreet @annietrev @N_landCouncilpic.twitter.com/miFoYZfi2V
2018-10-16T14:49:05,NEW JOB: Teaching Assistant - Tweedmouth Prior Park First School http://bit.ly/2IZ4xyQ 
2018-10-16T11:15:12,"G8 to be discussing forthcoming small business saturday on 1st December. Always my excuse for doing loads of Christmas shopping from wonderful independent shops in #Berwick, #Wooler, #Amble, #Alnwick and #Rothbury. @SmallBizSatUK @AnnaAtTheAmbler @NLandTories @N_landCouncil"
2018-10-15T21:46:18,"Former Brexit minister Steve Baker says “eurosceptics today are campaigning for the deal which the EU has offered us… but for the whole UK. That’s what we want and that can’t be an extreme position”.

@SteveBakerHW | @MarkUrban01 | #newsnightpic.twitter.com/Yzrx8khEBd"
2018-10-15T15:11:25,#PMstatement... interesting Q from MP Bill Cash asking if we would fall into new EU financial liabilities (above £39bn we have promised) if we havent completed Implementation Period by 31st december 2020. @BrexitCentral @SteveBakerHW @Mark_J_Harper @Change_Britain @BorisJohnson
2018-10-15T09:33:41,"Some loud, persuasive, and misguided UK voices have been telling the EU that if they dig their heels in the UK would buckle and not leave.

I fear the EU believed them and have negotiated based on that fallacy. Those voices have acted against both the UK’s and EU’s best interests"
2018-10-15T14:38:03,Great job by the Lib Dems this afternoon. Big statement from PM on their big issue. They’ve managed to get 4 MPs here for it. Everyone else’s benches are packed. #SkivingHere
2018-10-14T19:17:20,"Have you ever considered adoption?
We not come along to our Adoption Information event on 17 Oct 5pm
Alnwick community fire station,  NE66 2ER  for a cuppa and a chat. 
FIND OUT MORE &gt; http://adoption.gr8.com/ 
We would love to talk you 
#northumberland #adoptionpic.twitter.com/HBEqkVZUYU"
2018-10-14T13:03:08,"I have so far backed our negotiating position on the EU. But staying in the customs union would be the worst of all worlds. Any other outcome - no deal, Canada, Norway, Switzerland, even a second referendum - would be preferable.https://www.telegraph.co.uk/politics/2018/10/14/brexit-theresa-mays-terms-would-worst-worlds/ …"
2018-10-14T12:23:04,Outstanding from @annietrevhttps://www.telegraph.co.uk/news/2018/10/13/fear-will-permanent-temporary-customs-union-have-no-control/ …
2018-10-13T19:21:38,Really gritty article setting out Northern Ireland border solutions for #Brexit. https://brexitcentral.com/solution-irish-border/ … @BrexitCentral @SteveBakerHW
2018-10-13T06:18:51,Truly extraordinary piece of footage. Medecine is a truly noble profession. @ParkinsonsUK @JamesCleverly @TomTugendhat @SeemaKennedyhttps://twitter.com/ColMikeTanner/status/1050748045934120961 …
2018-10-12T17:13:53,"Dear BBC 6 o’clock news. It isn’t 40 countries with EU trade deals, it’s 40 deals with 70 countries. And it’s not 12% of UK trade dependent on them. It’s 12% of UK trade with the countries, much of which won’t depend on the deals. @BBCNews"
2018-10-12T14:41:28,"NEW: Brexit Sec insists a NI backstop has to be 'time-limited', 'short' and cannot leave us in 'indefinite limbo', as 'that would not be leaving the EU'. Significantly stronger than Downing Street simply saying it should be 'temporary' this morning.pic.twitter.com/6hIuLOoX32"
2018-10-12T11:16:51,"We're coming up to the final days of #AutismHour and if you haven't visited one yet, make sure you do! Check our map to see what's happening near you: http://bit.ly/2NEbnyC pic.twitter.com/r7DcL0rSdz"
2018-10-11T11:21:25,Yet another significant confession. 3 ex ministers now! Notgoingaway. @WASPI_Campaign_ @annietrev. https://inews.co.uk/opinion/comment/as-pensions-minster-i-was-told-to-ignore-women-facing-hardship-from-state-pension-age-changes/ … @GuyOpperman
2018-10-12T11:16:40,A fabulous view of #Belford and the #Northumbrian coast as I tour my wonderful constituency today catching up with my GPs. @NLandTories @NorthumbriaNHS @NHSNlandCCGpic.twitter.com/DQf3ysmCZo
2018-10-11T16:21:29,"My piece in today's @Telegraph.

Ordinary people don't talk like politicians before they run for office - but we need them in politics.https://www.telegraph.co.uk/politics/2018/10/11/ordinary-people-dont-talk-like-politicians-run-office-but-need/ …"
2018-10-11T14:08:43,No. UC is changing lives in Plymouth and across the country. It’s success however depends on the adherence to its binding principle of people being better off in work. Not worse.https://twitter.com/JasonWaWa/status/1050386798160109569 …
2018-10-11T14:41:22,Delighted to be in Rome to return two Etruscan artefacts recovered as a result of the joint work of ⁦@metpoliceuk⁩ and ⁦@_Carabinieri_⁩  and to promote the new ⁦@BritishArmy⁩ Cultural Property Protection Unit based in ⁦⁦⁦@77th_Brigade⁩  pic.twitter.com/1aVjE6CyD4
2018-10-09T08:58:17,"There's a good case for keeping chunks of the single market (eg rules on competition, non-discrimination, standards). But remaining in the customs union while leaving the EU would be the worst imaginable outcome. There's joyful disbelief in Brussels that we're comptemplating it."
2018-10-11T11:40:24,"Flu vaccines are free for at risk groups from GPs and pharmacies — including pregnant women, over-65s and those with long-term health conditions #helpushelpyou You can check if you’re eligible here:https://www.nhs.uk/conditions/vaccinations/flu-influenza-vaccine/ …"
2018-10-10T14:34:08,Had a great day once again speaking to young people about making the most of their future and finding the right career at the @N_landCouncil SEND Careers Event @Woodhorn today.https://twitter.com/eentheadviser/status/1050027409347620867 …
2018-10-11T07:32:36,Absolutely right and we must ensure that under the nation's commitment to the Covenant we give all military families the support they need to enable you to do your jobs @APPGCovenant @GavinWilliamson @Tobias_Ellwood @RoyalNavy @RoyalMarines @RoyalAirForcehttps://twitter.com/BritishArmy/status/1050287505290027009 …
2018-10-10T21:53:13,We will not be bullied into propping up a soft-touch Government which gives in to the EU's demandshttps://www.telegraph.co.uk/politics/2018/10/10/will-not-bullied-propping-soft-touch-government-gives-eus-demands/ …
2018-10-10T18:47:37,I was proud to be able to welcome soldiers to Parliament today to thank them for keeping us safe. We are grateful for everything that they do.pic.twitter.com/tceXzBIopI
2018-10-09T16:56:22,"This is a brilliant piece by @Mark_J_Harper in today's Telegraph. 

Infrastructure, such as ANPR cameras, exists at dozens of locations throughout Northern Ireland. The Irish border issue is eminently solvable with existing technology and infrastructure.https://www.telegraph.co.uk/politics/2018/10/09/time-destroy-myth-cant-have-free-trade-brexit-irish-border/ …"
2018-10-09T07:16:43,"Only 2 days to go until the biggest ever #IllegalWildlifeTrade Conference in London.

Over 80 countries are coming together to #EndWildlifeCrime by:

tackling corruption and illicit financial flows

closing down markets

building coalitions

https://www.gov.uk/government/topical-events/london-conference-on-the-illegal-wildlife-trade-2018 …pic.twitter.com/aRKqdBd0BR"
2018-10-10T16:52:09,From battlefield to boardroom: helping veterans launch their own business http://www.cityam.com/265217/battlefield-boardroom-helping-veterans-launch-their-own … via @CityAM @GavinWilliamson @OfficialXForces @APPGCovenant @DefenceHQ @beisgovuk
2018-10-10T16:39:26,"Only had a few minutes to speak in the #AgricultureBill  - on the importance of supporting our upland farmers and planting more trees. 

The video is on my facebook page: https://goo.gl/xwHrVd pic.twitter.com/p4bKdwmrO1"
2018-10-10T13:04:36,DUP will vote down Budget if Theresa May compromises in Brexit talks http://www.cityam.com/265262/dup-vote-down-budget-if-theresa-may-compromises-brexit … via @CityAM
2018-10-10T13:01:55,Sitting in Agriculture Bill and I think the Member for High Peak @RuthGeorgeMP suggested a Labour govt would nationalise farming by turning the whole country into a National Park. Really?! What would that cost the Exchequer I wonder?
2018-10-08T19:07:15,"""To break the bonds of the ship, to break the bonds of land, climb into the skies and look down on a British ship in the middle of the ocean and have that sense of freedom... it's difficult to put into words.""  

http://www.royalnavy.mod.uk/queenelizabeth  #WeAreQNLZ #WESTLANT18pic.twitter.com/VjAbwrlzH8"
2018-10-10T12:19:44,Fantastic welcome home for some of our recently deployed @britisharmy as the PM @theresamay speaks to them and thanks them for their selflessness and that of their families as they serve our nation and keep us safe @appgcovenant @gavinwilliamson @defencehqpic.twitter.com/ndhWQwsfw8
2018-10-10T12:04:27,The Prime Minister ⁦@theresa_may⁩ is waiting to welcome some of our wonderful soldiers who have recently been on the front line to @houseofcommons @defencehq @gavinwilliamson @britisharmypic.twitter.com/8b7o5wvs31
2018-10-10T11:57:55,Wonderful to see so many in #Parliament waiting to welcome our amazing soldiers to ⁦@HouseofCommons⁩ ⁦@theresa_may⁩ ⁦@APPGCovenant⁩pic.twitter.com/BZamf5wx2F
2018-10-08T17:48:07,"Here's a series of five short videos summarising where we are in the Brexit negotiations today:

http://bit.ly/BrexitUpdateOct18 …
#PlanAPlus"
2018-10-10T05:51:46,Cpl Top Rai is one of the Regiments Plant Section commanders.  He is currently deployed to South Sudan on Operation TRENTON where the UK Engineering Task Force is supporting the United Nations Mission in South Sudan. @DefenceOps #engineering #deployed #southsudan @Proud_Sappershttps://twitter.com/BritishArmy/status/1049650063377661952 …
