2018-09-26T09:45:24,Labour MP calls for general strike. Perhaps we can all think about what we will volunteer for if Corbyn supports this outrageous call to industrial action. In #1926 my great granddad helped the police. @BBCPolitics @theresa_may @nlandtories @JamesCleverlyhttps://www.bbc.co.uk/news/av/uk-politics-45648081/labour-mp-laura-smith-calls-for-general-strike?SThisFB …
2018-09-25T15:11:50,https://www.thesun.co.uk/news/7328319/brexit-secretary-canada-deal-eu-plans/ …
2018-09-25T13:30:11,Dont our Conservative MEPs publish their expenses anyway? @MartinCallanan @JamesCleverlyhttps://twitter.com/JamesCleverly/status/1044579263549247488 …
2018-09-25T12:18:01,"People are being invited to a drop-in session on Thursday to give their views on the hospital and leisure development in Berwick

Representatives from the trust and @N_landCouncil will be at Swan Centre 10am-1pm to listen to people’s viewshttps://www.northumbria.nhs.uk/public-invited-to-drop-in-session-for-berwick-plans/ …"
2018-09-25T12:22:01,Staying within the restrictions of the EU's sluggish economic bubble is bad for our kids' future. Lets become a good neighbour and be free to release our full economic potential under our own control once again. @BrexitCentral @Change_Britainpic.twitter.com/9BkFP1PhnY
2018-09-25T12:17:36,Didn't we do best of three already?! 1. Referendum...Leave Wins; 2. GE2017... 88% of candidates stand on Brexit ticket &amp; Brexit committed Tory party wins @iainmartin1 https://twitter.com/reactionlife/status/1044558375739109376 …
2018-09-25T08:22:35,"""Only by working together can we protect our shared home and ensure our marine life continues to be a source of awe and wonder for future generations.""

@michaelgove on why we want to treble internationally-agreed targets for ocean protection.

pic.twitter.com/MNWIn9k6v4"
2018-09-25T10:49:24,"Labour are all over the place on this 2nd referendum issue. This in-out-in-out nonsense is becoming a joke, if they want to be taken seriously as a government in waiting they should probably have an agreed position on the big issue of the day.https://twitter.com/hzeffman/status/1044532398669680640 …"
2018-09-25T10:39:22,"Labour have confirmed that they would take us back to square one on Brexit.

@Keir_Starmer just told #Lab2018: ""Nobody is ruling out Remain as an option"".pic.twitter.com/Wp1jVLd3wR"
2018-09-25T10:28:20,"The key,phrase is “leave the EU”. Not swap full membership for  half or a quarter membership ...https://twitter.com/tnewtondunn/status/1044375382558994432 …"
2018-09-25T09:23:28,Excellent explanation of the potential for UK and EU to find workable solution in a Canada +style FTA by @MarcusFyshhttps://brexitcentral.com/now-eu-declared-chequers-unworkable-free-trade-plus-deal-realistic-option/ …
2018-09-25T08:34:45,Keir Starmer’s face when he’s asked to confirm Labour’s Brexit position.....pic.twitter.com/raLNCQsHgT
2018-09-25T08:27:57,An under-remarked driver of some of this UK trade deficit expanding effect has been the use of EU funding (our money) to encourage industrial production into less developed parts of the EU. #Manufacturinghttps://twitter.com/bernardjenkin/status/1044498791943098368 …
2018-09-24T20:48:50,"THREAD: Tonight I’m at the annual @RoyalNavy Photography Awards. So many of our successes happen away from the public eye so our phot branch have a vital role, not just capturing events as they happen but bringing them to life through their extraordinary skill and artistry.pic.twitter.com/yz2zgLpzRK"
2018-09-24T10:34:57,"I voted Remain in 2016, but I believe that seeking a Free Trade Agreement with the EU, similar to what’s laid out in this @iealondon paper “Plan A+” is preferable to Chequers. Paper is right to consider the impact of any EU deal across all of UK’s economic &amp; trade relationships.pic.twitter.com/yqrD9tnkjb"
2018-09-24T11:05:47,Fine piece of work by @ShankerASingham @iealondon - This is a plan the EU would understand and respect - delivering prosperity for the U.K. and our European partners. I’ve no doubt it would unite MPs and the country #PlanAPlus #ChuckChequershttps://twitter.com/Channel4News/status/1044174521220173824 …
2018-09-24T12:13:00,Pleased to be at launch of @iealondon #PlanAPlus this morning.https://twitter.com/iealondon/status/1044140912820056064 …
2018-09-24T05:54:37,.@johnmcdonnellMP completely unable to answer on @GMB whether @jeremycorbyn would use nuclear weapons #Lab18
2018-09-24T05:52:21,.@johnmcdonnellMP getting angry about answering simple and important questions about how @UKLabour would keep the country safe on @GMB #Lab18
2018-09-24T03:51:36,Great to see the Photo of the Week is a #curlew one of millions of birds heading our way and touching down in the UK from all points north.https://twitter.com/Natures_Voice/status/1043817495172460544 …
2018-09-23T11:02:43,Jeremy Corbyn knows that what he is saying is absolutely untrue.  The Labour left have clearly made a conscious decision to keep repeating this lie.  So let me be clear yet again – we will not lower UK standards in Trade Agreements. #Marr
2018-09-23T14:44:09,I agree with Len https://twitter.com/steve_hawkes/status/1043854767779459072 …
2018-09-23T12:48:24,".@jeremycorbyn on #Marr says Labour will back a second referendum if their conference votes for it, breaking his manifesto pledge and betraying millions of voters who voted in good faith to leave the EU #unfittogovernpic.twitter.com/sHiW7nlpOf"
2018-09-23T12:31:03,RN and RAF personnel of 617 Squadron on parade for presentation of new standard this weekpic.twitter.com/yu6HBplTdf
2018-09-23T07:20:18,"Alnwick Food Festival Today 
Food &amp; Family Fun Over 50 Stalls including Produced in Northumberland members Look out for the RED &amp; GOLD Bunting
LEARN MORE &gt; https://bit.ly/2pyxtoF  ...  @NlandCheese @mochamondo @thenutroaster @ProofofThePud @GreenbraeMeats @AlnwickFoodFestpic.twitter.com/0BTfUe6K1Y"
2018-09-22T21:43:18,"Andrew Murrison: After Salzburg, the EU needs a reality check on its security plans. Urgently. @ConHome @GavinWilliamson @willquincehttps://www.conservativehome.com/platform/2018/09/andrew-murrison-after-salzburg-the-eu-needs-a-reality-check-on-its-security-plans-urgently.html?utm_medium=email&amp;utm_campaign=Saturday%2022nd%20September%202018&amp;utm_content=Saturday%2022nd%20September%202018+CID_47e92f9afd5386f77e3bd270debaa466&amp;utm_source=Daily%20Email&amp;utm_term=After%20Salzburg%20the%20EU%20needs%20a%20reality%20check%20on%20its%20security%20plans%20Urgently …"
2018-09-22T11:56:29,https://www.bbc.co.uk/news/av/uk-england-45606238/the-british-army-has-introduced-new-fitness-tests … Good effort @bealejonathan
2018-09-22T08:09:41,More women should take the lead in public life in Northumberland @NLandTorieshttps://www.northumberlandconservatives.org.uk/news/cllr-cath-homer-more-women-should-take-lead-public-life …
2018-09-21T16:56:56,Rees-Mogg Responds Positively to May's Brexit Speech https://order-order.com/2018/09/21/rees-mogg-responds-mays-brexit-speech/ … via @GuidoFawkes
2018-09-21T12:12:42,Just 1 in 5 businesses are led by women. I’ve launched a review at @hmtreasury into how we can break down the barriers for entrepreneurs. Read more in today’s @Telegraphpic.twitter.com/mgY9r07Ros
2018-09-21T15:37:26,"Obviously, Anne-Marie. We are a sound, brave people. "
2018-09-21T15:32:56,Exactly right A-M that is what I am hearing as well. Fateful mistake to mock the PM and by default the U.K. EU showing it’s true colours. They have badly underestimated us AGAIN!https://twitter.com/annietrev/status/1043160475670904838 …
2018-09-21T15:30:13,Finding the same up north  @PennyMordaunt @theresa_may @JamesCleverlyhttps://twitter.com/PennyMordaunt/status/1043130836747464704 …
2018-09-21T11:36:17,"Government borrowing for the year-to-date is £7.8 billion lower than the same period last year according to @ONS.
 
This is good progress but we need to keep up our efforts so we can invest in our public services and our future.pic.twitter.com/BfVx12SxKD"
2018-09-21T13:09:42,"""I have treated the EU with nothing but respect, the UK expects the same"" Theresa May tells 27 other leaders. Those Instagram photos and jokes look pretty misguided now..."
2018-09-21T13:03:50,WATCH LIVE: PM @Theresa_May is making a statement following yesterday's informal EU Councilhttps://www.pscp.tv/w/bnTjtjIyOTU1OTR8MWpNS2dFWE5wTFdKTDTl3GF4JNCOQXUMQvJo3pqMz454Vd2xqqA_oybw_UVn …
2018-09-21T12:58:27,Defence Secretary Gavin Williamson has announced that the UK will be extending its military training operation in Ukraine for a further two years. Read more here: http://ow.ly/6g0E30lUNO9  #GlobalBritainpic.twitter.com/qNC0z2DG6P
2018-09-21T07:09:59,"Threat of cuts to CrossCountry services through Newcastle, Durham and Berwick is lifted @ChronicleLivehttps://www.chroniclelive.co.uk/news/north-east-news/threat-cuts-crosscountry-services-through-15179698 …"
2018-09-21T06:46:46,"UK ARMED FORCES:

It’s the people that make our AF so professional. We must look after them and their families. Helping us to scrutinise and improve are the three service families federations. Thank you for attending another of our regular forums.
@RAF_FF @The_AFF @The_NFFpic.twitter.com/G1f5MP3LiF"
2018-09-20T21:29:38,So wonderful that Minister Nusrat Ghani can be with us at #ABCawards2018 to celebrate asian business and leadership in the NorthEast. #FABUpNorth @abcconnection https://www.instagram.com/p/Bn9oou9gdDS/?utm_source=ig_twitter_share&amp;igshid=n2u1r826jtou …
2018-09-20T20:01:51,Major Naveed Muhammad MBE tells #ABCawards2018 audience about his 33 years of service to our nation. @abcconnection http://gavinwilliamson.mp  @britisharmy @defencehq https://www.instagram.com/p/Bn9elxHAz_v/?utm_source=ig_twitter_share&amp;igshid=8nzytxmpg6p0 …
2018-09-20T19:50:16,"Fantastic to have Mandeep Kaur, British Armed Forces' Sikh Chaplain speaking @abcconnection #ABCawards2018. #soproud #whatawoman! women2win http://gavinwilliamson.mp  https://www.instagram.com/p/Bn9dR0SAmEP/?utm_source=ig_twitter_share&amp;igshid=7zv1j1ynzd4l …"
2018-09-20T18:43:24,Fantastic to be at the 9th anniversary dinner and awards of @ABCConnection @AmmarMirza @Nus_Ghani #ABCawards2018pic.twitter.com/ruVviBbtQY
2018-09-20T13:27:21,"We held a people’s vote, it was the referendum in 2016. It is now a matter of trust in politicians that we should deliver on the will of the British people.

That’s why I’m calling on Labour to rule out a second referendum and not take us back to square one.pic.twitter.com/p98HbTeNZE"
2018-09-20T08:42:30,"So the Czech and Maltese prime ministers publicly call for a second Brexit referendum. Not surprising, it’s the EU establishment’s default. Time and again European electorates voted against EU plans but have been ignored. Well that’s not the British tradition of democracy. Bye.pic.twitter.com/n2EvB6Ewuv"
2018-09-20T07:18:13,Good news that Government has announced 'root and branch' review of rail to ensure that unprecedented growth in usage of trains can be matched by best customer service for the future. @Transport4North @transportgovuk @Nus_Ghani @Jesse_Normanhttps://www.gov.uk/government/news/government-announces-root-and-branch-review-of-rail?utm_source=06f41482-7e56-4811-9ecd-4564e972628b&amp;utm_medium=email&amp;utm_campaign=govuk-notifications&amp;utm_content=immediate …
2018-09-19T23:05:00,https://publications.parliament.uk/pa/cm201719/cmselect/cmdfence/1569/156902.htm …pic.twitter.com/T6nHlNxtk3
2018-09-19T10:38:00,Exciting to see the @premierinn hotel works started at last in #Berwick .pic.twitter.com/kJUfwZMRZV
2018-09-19T10:09:43,I’m pleased the Government is investing £2 billion in new long-term funding to build more affordable and social homes. Everyone deserves a decent and safe place to live. And I want to see social housing that is so good that people are proud to call it their home. #NHF18pic.twitter.com/b4MtIxztBG
2018-09-19T08:52:00,"I love this photo. It marks the start of a lifetime of memories, adventure, friendships and stories that will stay with you forever. Good luck, keep smiling and thank you for volunteering to Serve your nation.https://twitter.com/DartmouthBRNC/status/1041733592341245952 …"
2018-09-19T08:38:23,There's now a US-UK trade deal ready to be signed says @BrexitCentralhttps://brexitcentral.com/theres-now-us-uk-trade-deal-ready-signed/ …
2018-09-19T06:03:21,"Great to catch up with Berwick's hospital campaign team. I'm talking to all parties involved for our modern fit-for-purpose new hospital, make sure we have the services we have, as well as the great news of £20m for leisure facilities. @NorthumbriaNHS @N_landCouncil @NLandToriespic.twitter.com/mokr26bWrj"
2018-09-19T05:52:17,So honoured to inspect our Berwick Army Cadet Force and hear all about their training and adventures. #amazing #youngpeople #lifechances http://gavinwilliamson.mp  nlandcc northumbria_acf… https://www.instagram.com/p/Bn5Yleunt0N/?utm_source=ig_twitter_share&amp;igshid=1g9s2gv54ndgd …
2018-09-18T21:15:03,"TeamBerwick has had a great night with @annietrev.A night of smiles, positivity and 2 new 4* complete cadets. Very proud DC :)   @NACF_WALLpic.twitter.com/zCHR3XkpSE"
2018-09-18T17:43:15,Fantastic that Detchant now has superfast broadband! Thanks to the amazing @BTOpenreach engineers who are working flat out to get everyone up to speed. @bt_uk @NLandTories @N_landCouncil @RichardMWCApic.twitter.com/87tUUmznQT
2018-09-18T16:32:08,"I've just voted for Northumberland in the Tourism Awards! Please support the best county!
Vote4Northumberland https://www.visitnorthumberland.com/sharenland/vote  https://www.instagram.com/p/Bn384fYHtkV/?utm_source=ig_twitter_share&amp;igshid=1vxy7avhna0hd …"
2018-09-18T15:32:45,NATO Chief lists benefits of alliance to the security of the United Stateshttps://ukdefencejournal.org.uk/?p=20008 
2018-09-18T10:16:13,Delighted to have had a visit from our MP for Berwick-Upon-Tweed @annietrev this morning with members from the Northumberland Coast &amp; Lowlands LEADER programme. It was amazing to show them how we have benefited from the LEADER programme @NorthumberIand @ProducedinNlandpic.twitter.com/fulu1jzGlM
2018-09-18T10:45:58,Really useful meeting with #BerwickHospital campaign team to catch up on progress from theirs and my side. #Nolossofservices #Berwick northumbrianhs @northumberlandCCG nlandcc https://www.instagram.com/p/Bn3VZ0ogCnz/?utm_source=ig_twitter_share&amp;igshid=1vzzhmdmzhlou …
2018-09-18T10:15:45,"Queen Street in Amble has been shortlisted in the ""Champion"" category of the Great British High Street Awards!

You can vote for it to win by using the hashtags: #myhighstreet and #GBHSAmble

More information HERE: 

https://bit.ly/2Depzdo "
2018-09-18T09:56:24,Fantastic visit to carrollsheritagepotatoes this morning to see inpact of Leader funding. http://michael.gove.mp  https://www.instagram.com/p/Bn3Pu7ogJ9l/?utm_source=ig_twitter_share&amp;igshid=95v68hcdels0 …
2018-09-18T09:27:11,Autumn is coming here in #Northumberland @nlandtories @N_landCouncilpic.twitter.com/nxyMK3h18C
2018-09-18T07:03:56,"Easy to forget that the Liberal Democrats were the first party to call for an EU in-or-out referendum. In 2008 Ed Davey was thrown out of Commons for demanding one. Fair enough, but hard for them to now blame all this on Tories.https://amp.theguardian.com/politics/2008/feb/26/liberaldemocrats.houseofcommons …"
2018-09-17T21:04:53,Fantastic footage @HMSQnlz !  @LiamFox @BorisJohnson @theresa_may @Jeremy_Hunthttps://twitter.com/RoyalNavy/status/1041610786471374850 …
2018-09-17T16:52:26,When a Queen met a President. USS Abraham Lincoln a few berths along in #Norfolk #Virginia #USApic.twitter.com/L6c6cGiUMD
2018-09-17T12:10:45,"More great news for Berwick - Coastal Communities Funding for the new Welcome Centre. 

You can find out more here:https://bit.ly/2D537Dy "
2018-09-17T10:43:41,"#Wooler residents have received the backing of MP @annietrev in their campaign for road safety improvements.

 https://www.berwick-advertiser.co.uk/news/mp-backs-campaign-to-improve-road-safety-in-wooler-1-4800948 …pic.twitter.com/UhpW1osStI"
2018-09-17T11:29:22,Shortlist announced for Great British High Street Awards 2018 and our very own Queen Street in #Amble is amongst them! @AmbleCom @AnnaAtTheAmbler @NLandTories @N_landCouncil @BBCRichardMoss @RichardMWCAhttps://www.gov.uk/government/news/shortlist-announced-for-great-british-high-street-awards-2018?utm_source=fb734d40-822a-4a47-b9c3-15ef04012ee0&amp;utm_medium=email&amp;utm_campaign=govuk-notifications&amp;utm_content=immediate …
2018-09-17T08:16:41,"“The £1.9bn announced by the government today will mean we can invest in crucial infrastructure and help local authorities to get more homes built on public land."" - @HomesEngland chairman Sir Edward Lister.

 Helping deliver 300,000 new homes a year by the mid-2020s.

pic.twitter.com/jqRZTrXV1w"
2018-09-16T15:32:33,"What a great day it's been so far here in Manchester for the #RAF100 Aircraft Tour.

Here is 93 year old Albert Smith re-familiarising himself inside the Lancaster. The former Flight Engineer flew 22 missions on the aircraft during World War Two.pic.twitter.com/9cGAxC5neG"
2018-09-16T21:35:57,"Respectfully there is a lot of misunderstanding of/by Gove today. If we make Withdrawal Agreement with backstop which makes us rule taker, perpetuates supremacy of EU law, &amp; gives ECJ final say whether backstop released, we are done: a colony, with £40bn just our first tribute."
2018-09-16T16:52:16,"U.S Defense Secretary Jim Mattis is soon wheels up to Skopje, Macedonia ahead of a key referendum that would open the door for the Balkan country to join NATO. Media on the plane is @Reuters @AP @AFPpic.twitter.com/gQYp5Xi35K – At Joint Base Andrews"
2018-09-16T07:23:54,"EXCL: US Ambassador Woody Johnson: “Britain: have faith in your ability, your culture, your language and laws and get you country back” Says ties with EU under Chequers  will mean a lesser US deal will be struck “with what’s left”.https://www.express.co.uk/news/uk/1018147/Brexit-news-donald-trump-us-uk-USA-ambassador-woody-johnson …"
2018-09-15T21:11:01,"Brilliant summary of the history of the World Trade Organisation, from ITO to GATT to WTO. #notarriffs #globaltrade @SteveBakerHW @LiamFox @DavidDavisMP @BorisJohnson @patel4witham @JunckerEU @Number10govhttps://youtu.be/KRmUPHT2Vyo "
2018-09-15T16:21:20,A few photos of the first iceberg of our season and first ever for some of our @RoyalNavy sailors and @RoyalMarines. Excited for the season ahead #lifegoals #adventure #antarctica @AWShips @BAS_News @LewisPugh @JFRumble @navy_news @TeamRN1 @AntarcticHT @CaptainRReadwinpic.twitter.com/n51qByyL2C
2018-09-15T09:17:38,"Fantastic news that our Berwick Coastal bid for £324,000 for a Welcome Visitor centre has been approved as part of £6 million awarded to successful coastal projects in first wave of funding @JakeBerry #thankyou #IBerwick @beisgovuk @northumberlandchttps://www.gov.uk/government/news/6-million-awarded-to-successful-coastal-projects-in-first-wave-of-funding?utm_source=dd14ba0e-322a-4d78-8b49-143c156f6e24&amp;utm_medium=email&amp;utm_campaign=govuk-notifications&amp;utm_content=immediate …"
2018-09-14T07:00:34,"""When he got help for PTSD, everything fell in to place."" You're not on your own. We also support families caring for #veterans with #mentalhealth issues. Watch Don's story ↓ http://ow.ly/EIyJ30lGRB0  @CombatStresspic.twitter.com/r74HrDejhp"
2018-09-13T18:56:04,Today three new laws have come into force after receiving Royal Assent.pic.twitter.com/ARBE1JfCPj
2018-09-13T11:06:21,"We're delighted to be holding our meeting at the Old Royal Naval College at Greenwich, a venue steeped in the history of the Service - and to be getting there in the best way possible, while meeting the ship's companies of @HMSExample and @HMSExplorer en-route.pic.twitter.com/qQvr1EVjad"
2018-09-13T05:27:59,"Today, the government sets out its second batch of Technical Notices with advice and guidance on the No Deal scenario, and Cabinet will review departmental plans. Our top priority is a good deal with the EU, but the UK will be ready for any eventuality.https://www.telegraph.co.uk/politics/2018/09/12/britain-need-not-afraid-no-deal-brexit-standready-rise-challenges/?WT.mc_id=tmgliveapp_iosshare_ArQmrN2Bn4P4 …"
2018-09-12T17:53:55,"Exclusive: ‘Do better, be better’: Women of Westminster condemn ‘misogynist’ media treatment of Carrie Symonds https://www.huffingtonpost.co.uk/entry/women-of-westminster-slam-media-for-misogynist-treatment-of-carrie-symonds_uk_5b991456e4b0162f4732c853 … @Anna_Soubry @heidiallen75 @NickyMorgan01 @tracey_crouch @annietrev @stellacreasy @carriesymonds"
2018-09-12T16:29:47,Savers to earn 50p for every £1 saved thanks to Help to Save scheme. #savingshttps://www.gov.uk/government/news/savers-to-earn-50p-for-every-1-saved-thanks-to-help-to-save?utm_source=1016057c-69cb-4d5b-b705-f923655cd429&amp;utm_medium=email&amp;utm_campaign=govuk-notifications&amp;utm_content=immediate …
2018-09-12T14:33:15,Royal Marines experimenting with future ship to shore capabilities!pic.twitter.com/hh9fDhpUny
2018-09-12T15:19:12,Fantastic to see @annietrev show her support for British agriculture on #BackBritishFarming daypic.twitter.com/fwJ0sdiIOe
2018-09-12T16:13:23," Michael Gove on today's #AgricultureBill: ""After nearly 50 years being tied to burdensome &amp; outdated EU rules we have opportunity to deliver a Green Brexit.  Farmers who help us to deliver cleaner, greener, healthier environment for future generations will get largest rewards""pic.twitter.com/TkWDkX0zUc"
2018-09-12T13:03:30,"It was fantastic to meet Fiona Wallace of Berwick pub
@Leaping_Salmon earlier today, to hear about the incredible fundraising work she and her colleagues are doing. 

Pop in for a drink to find out more, or visit her website
here: https://bit.ly/2Mnxl47 pic.twitter.com/tEev7pMitd"
2018-09-12T10:42:16,#Northumberland welcomes #PrinceCharles as he meets the team behind + working at #TheSill + the amazing @YHAOfficial hostel on #HadriansWallpic.twitter.com/mSzX4e2p8R
2018-09-12T10:13:19,"Delighted to support @NFUtweets for #BackBritishFarming day!

I'll be proud to wear my wheatsheaf pin to Prime Minister's Questions later!pic.twitter.com/SHTWdzNW1u"
2018-09-12T07:21:00,Excellent pocket guide which explains what WTO deal means in practise by @Econs4FreeTrade. @SteveBakerHW https://www.economistsforfreetrade.com/wp-content/uploads/2018/09/World-Trade-Deal-pocket-guide.pdf …
2018-09-12T07:16:12,"Landmark Agriculture Bill from @michaelgove @DefraGovUK out today, to deliver Green Brexit. Farmers will be paid for “public goods”, better air &amp; water quality, soil health, animal welfare standards, countryside access &amp; flood reduction @NFUtweetshttps://www.gov.uk/government/news/landmark-agriculture-bill-to-deliver-a-green-brexit?utm_source=5a889abf-3b2f-450a-a674-dd2875144037&amp;utm_medium=email&amp;utm_campaign=govuk-notifications&amp;utm_content=immediate …"
2018-09-12T07:00:16,"""As a mother, I didn't want to upset my children"" #Mentalhealth issues don't just affect #veterans. They also impact on veterans' families. Sound familiar? Watch Sarah and Linda's stories. We can put you in touch with  partners who can help.  http://ow.ly/fuGO30lGS32  @CombatStresspic.twitter.com/1DtsQAp2fJ"
2018-09-11T14:11:45,"Yesterday, two Scots Tory MPs (Colin Clark and Stephen Kerr) spoke out in favour of a Canada deal instead of the ""Common Rulebook"" advocated in #Chequers. #StandUp4Brexit 

The direction of travel is very much against the Chequers deal.https://www.youtube.com/watch?v=exHwwsRsYVM …"
2018-09-11T16:03:53,"In today's @standardnews read my interview with @JoeMurphyLondon. 

Our discussion was wide-ranging: from London's crime problem, to the conservative values given to me from my upbringing.

Also not to forget, my love of Jill Scott and Stevie Wonder!https://www.standard.co.uk/news/politics/wouldbe-tory-mayor-shaun-bailey-only-my-zero-tolerance-approach-can-halt-london-crimewave-a3932761.html …"
2018-09-11T08:44:05,"There were 488,000 unemployed people aged from 16 to 24 for May to July 2018, the lowest figure since records began for youth unemployment in 1992."
2018-09-11T17:30:32,"Oh I am sure @annietrev will be wearing a #BackBritishFarming pin badge for #PMQs tomorrow 
#Northumberland #Farming #Agriculturehttps://twitter.com/NFUtweets/status/1036640786278965250 …"
2018-09-11T15:58:04,"Northumberland special educational needs and disabilities information roadshows: Northumberland Parent Carer Forum, In It Together, is working with Northumberland County Council to raise awareness of local services and support for children and young… http://bit.ly/2CLHHLy "
2018-09-11T14:36:47,Fantastic to see government investing more into our amazing Cadets and Sea Cadets @DefenceHQ #socialmobility #selfdiscipline #personaldevelopment #adventurepic.twitter.com/1bNaM8h4f0
2018-09-11T14:17:04,"Captain @smrmoorhouse - the first sea-going captain of @HMSPWLS addresses his ship’s company in Rosyth

HMS Prince of Wales expected to sail in late 2019 for sea trialspic.twitter.com/zbO9MCHvnF"
2018-09-11T11:15:38,Would a man in such a situation be described as attractive rather than by his professional role? Probably not.https://twitter.com/HenryNewman/status/1039454362031087617 …
