2018-03-26T11:47:28,"It is clear that a hard-to-quantify section of the party's activists (assuredly a minority) are out of control, and perhaps beyond helping. Historians have a special duty to speak out on this issue."
2018-03-26T12:51:29,Couldn’t agree more - quite frighteninghttps://twitter.com/gsoh31/status/978236640375312385 …
2018-03-25T21:41:52,Thread: There inevitably will be those that jump to defend and who declare this issue is being ‘weaponised’ to attack @jeremycorbyn. But every @UKLabour member should be deeply ashamed that it has come to this. /1https://twitter.com/paulbranditv/status/978022197020315648 …
2018-03-24T19:00:29,Antisemitism is racism.  You say it is “Wicked” to call it out ?   You think being a member of a Facebook group with Antisemites and defending it as  “freedom of speech” is something to praise?https://twitter.com/lindasayle/status/977559772902850560 …
2018-03-24T21:14:48,Was a pleasure meeting you Fredihttps://twitter.com/fredianiitv/status/977487474174939136 …
2018-03-24T08:40:56,"""Indefensible"" - @KarenPollock100 of the Holocaust Education Trust on muralgatepic.twitter.com/MQHm8MRFNd"
2018-03-23T19:24:26,"Am beyond shocked, sad to see this. Labour leader just does not seem to get it. #labourfailhttps://www.politicshome.com/news/uk/political-parties/labour-party/jeremy-corbyn/news/93888/jeremy-corbyn-condemned-defending- …"
2018-03-24T08:19:10,"Owen Smith calls the street art Corbyn defended ""monstrous"""
2018-03-23T18:23:34,If only antisemites were dealt with as swiftly and severely as Remainers.https://twitter.com/jessicaelgot/status/977248852230090752 …
2018-03-22T16:47:36,NEWS: Today we’ve launched our #Fintech Sector Strategy to help the UK continue to lead the way in fintech for the future. Find out how we’re making the UK the best place in the world to start a fintech business here:https://www.gov.uk/government/news/fintech-sector-strategy-launched-at-international-fintech-conference?utm_source=ca0f0b8a-9ee2-4c5f-bad7-ebc6f556d827&amp;utm_medium=email&amp;utm_campaign=govuk-notifications&amp;utm_content=daily …
2018-03-23T11:34:27,Local MP @BimAfolami getting stuck in with yr 8s on rewiring a plug with @MorrisonUtility #STEM #stemcareers @CareerEnt pic.twitter.com/ahQVCfJhO3
2018-03-23T12:52:59,Q time for @Roundwood_Park &amp; @sirjohnlawes yr 8s with ace apprentices Sam from @AECOM &amp; Jordan from @MorrisonUtility #STEM #stemcareers @CareerEnt @BimAfolamipic.twitter.com/x74xPLWzsm
2018-03-23T10:25:36,Y8 students hearing about opportunities in a changing world #STEM. With talks from @BimAfolami and @AtlasCopcoUKIREpic.twitter.com/aRpvx8HiFe
2018-03-23T10:16:02,Having a blast at @Roundwood_Park at this brill event put together with @HertsLEP &amp; @BimAfolami &amp; local employers for yr 8s on exciting #STEM careers!https://twitter.com/careerent/status/977119142523424768 …
2018-03-22T22:24:02,"Congratulations to @Kikomatthews for rowing across the atlantic, alone, unsupported and in only 50 days breaking the world record! 
All in support of @KingsCollegeNHS who saved her life.
Inspirational achievement, simply amazing 
#KikoRow!!!"
2018-03-22T22:10:01,"Jeremy Corbyn would slash defence spending, key aide revealshttps://www.thesun.co.uk/news/5878524/key-aide-jeremy-corbyn-calls-for-cuts-to-defence-budget-just-as-threat-from-resurgent-russia-grows/ …"
2018-03-22T22:05:03,"Leaders of the 28 EU states have agreed with the UK that it is “highly likely” Russia is responsible for the Salisbury nerve agent attack and that there is “no other plausible explanation”, European Council president Donald Tusk has said"
2018-03-22T16:38:46,So since the post crisis trough in 2011 real median household incomes have grown faster than they did pre crisis. Quite a turnaroundhttps://twitter.com/PJTheEconomist/status/976781180862369793 …
2018-03-22T17:36:01,Great newshttps://twitter.com/avmikhailova/status/976871303469830144 …
2018-03-22T12:55:19,Brilliant point by @BimAfolami. Labour have been captured by producer interests. We champion consumers. #letthepeopledecide
2018-03-22T10:54:57,"Great to hear from @PhilipHammondUK the commitment of @hmtreasury to making sure the UK remains the best place to start and grow a #fintech business. 

Tech City UK contributes to 3 of the 7 measures announced today #IFTC2018

Read our latest blog: http://bit.ly/2pvuEFc pic.twitter.com/LNc5P5BzuV"
2018-03-21T13:09:32,"Really welcome news of an additional £4.2bn from Treasury to fund the well deserved pay rise for NHS staff, rather than this coming out of existing NHS funding."
2018-03-20T16:57:40,"Do read this - I’m happy to be part of @Freer_UK and soon to be publishing thoughts on the economy, tax and regulation....https://twitter.com/freer_uk/status/976139083180400640 …"
2018-03-20T09:41:27,I did an interview with them at 7.00am - made clear my opposition and how I’m working to sort it outhttps://twitter.com/josephinecumbo/status/976004889938718721 …
2018-03-19T16:47:24,"2018 is the year we fix dementia care once and for all, and reform social care. It is vital that people with dementia are at the centre of any future plans for social care, that's why I’m uniting with @AlzheimersSoc to #FixDementiaCare"
2018-03-19T13:32:29,The IFS’ @PJTheEconomist seems intent on annoying all of the most vocal groups in British politics. But of course he is right. https://www.thetimes.co.uk/edition/business/fairytale-thinking-is-the-great-survivor-of-the-financial-crisis-pdg0h9pw5 …pic.twitter.com/VDqT8h8HcT
2018-03-19T12:09:57,The UK and EU agree terms for Brexit transition periodhttp://bbc.in/2pqeE6n 
2018-03-19T10:12:56,"Fake claims that Newsnight photoshopped Jeremy Corbyn to make him look like a “Soviet stooge” had a social media reach of over 2 million. By contrast, tweets from the BBC debunking the untrue claims received just 2,400 retweets.https://order-order.com/2018/03/19/fake-hat-gate-claims-had-social-media-reach-of-over-2-million/ …"
2018-03-19T08:09:33,Completely agree and understand - have had the experience myself.will be making this point firmly when I speak to Transport Sec this weekhttps://twitter.com/emonastiriotis/status/975639840606904320 …
2018-03-17T14:18:20,Was an absolute pleasure to spend time with such smart and engaged young people at the #Hitchin Air and Sea Cadetshttps://twitter.com/journo_jp/status/975012114845880320 …
2018-03-16T18:18:48,It’s all kicking off tomorrow morning on Radio 4 from 11am...pic.twitter.com/SOQoET39N2
2018-03-16T15:36:39,Thank you @BimAfolami for allowing me to talk your ear off about how amazing @HomeStartHerts volunteers are. And thanks for your brilliant offer #bigcelebration #volunteers
2018-03-16T12:33:35,"Watch @mariacaulfield set the record straight on free school meals. Labour's failure to tell the truth on this issue is shameful. It's scaremongering, it's wrong and Labour should apologisepic.twitter.com/x13axtKaso"
2018-03-14T15:01:06,Backbench Labour MPs sound the alarm over Jeremy Corbyn’s Commons Statement on Russiapic.twitter.com/4S9yGKgh2g
2018-03-14T17:25:17,In public and in private Labour MPs are furious....https://twitter.com/bbclaurak/status/973950198471954433 …
2018-03-14T17:23:57,pic.twitter.com/uXHeou4YAc
2018-03-14T17:23:19,My position on the vote on universal credit...pic.twitter.com/Tl62pd8bQi
2018-03-14T15:23:49,I don’t always retweet my Labour colleague @gavinshuker - but his sentiment is entirely accurate herehttps://twitter.com/gavinshuker/status/973929277908496384 …
2018-03-14T13:07:31,Just out of House of Commons and pass a Labour backbencher. What did you think? “She did well”. What about Corbyn? Looks at me and shakes his head
2018-03-14T13:18:23,Corbyn is an embarrassment to the nation and to the Labour Party.https://twitter.com/sebastianepayne/status/973907908361641984 …
2018-03-13T11:19:03,"You're going to hear a lot from Labour about free school meals today. Despite what Labour are claiming, no-one on free school meals will lose their meal. In fact, by 2022, 50,000 MORE children will have a free hot school meal than today."
2018-03-13T00:16:24,"Cool, calm and resolute - impressive statement from @theresa_may today on #Salisbury incident &amp; #Russiahttps://twitter.com/skynews/status/973247623967621120 …"
2018-03-12T07:54:36,Happy to supporthttps://twitter.com/rossthomson_mp/status/972756680210636801 …
2018-03-08T15:19:50,"At 6pm on @LBC, we'll be asking, isn't it about time that feminists recognised that it was Margaret Thatcher who shattered that glass ceiling for all women in Britain? [gets tin hat] #InternationalWomenDay2018pic.twitter.com/CbYNNPJjVI"
2018-03-08T20:22:56,This is really important - well done @SteveBarclayhttps://twitter.com/conservatives/status/971448264192086016 …
2018-03-08T12:27:37,"Thrilled to have been awarded Best #Mediation Services Provider 2018 by @acquisition_int in their Dispute Resolution Awards! Recognising us as a leader in minimising the impact of costly, time consuming, and distracting disagreements within the #corporate and #commercial spherespic.twitter.com/FJbWnxZBns"
2018-03-08T10:19:49,"Thank you to @BimAfolami for opening our #EqualityForum. He told us his view that it's a tragedy if people can't make the most of their lives due to culture, law or society and reminded us that we should be focusing more on those in entry level jobs not just the elite.pic.twitter.com/epEjRRnHtT"
2018-03-06T15:48:02,Much of this talent pool lives in Hitchin and Harpenden!https://twitter.com/dominicraab/status/970913970226941958 …
2018-03-03T19:07:13,Stuart - completely right.we all need to remember that food in the supermarket doesn't turn up by magic!https://twitter.com/hertsfarmer/status/969687533906006016 …
2018-03-01T13:12:43,"The UK is now running a current budget surplus - that is, we no longer borrow to fund day-to-day spending - for the first time since 2002.

Britain is back in the black.pic.twitter.com/KqLLLJauNP"
2018-02-23T16:19:04,"Fly tipping is a disgusting public nuisance. Working with my colleagues in Parliament, we are aiming to make prosecution much easier.http://www.thecomet.net/news/hitchin-and-harpenden-mp-bim-afolami-signs-motion-challenging-fly-tippers-1-5407144 …"
2018-02-23T12:58:12,Loved being there with you and the team - looking forward to working together in coming weeks and months!https://twitter.com/phasehitchin/status/967018965959692288 …
2018-02-23T11:36:51,"It is hugely important to society that the skills and talents of millions of people across the UK with disabilities are not undervalued and ignored, so I was thrilled to speak in the debate yesterday on the role of disabled people in economic growth. 

http://www.dailymail.co.uk/wires/pa/article-5423019/MPs-call-meaningful-action-getting-disabled-people-work.html …pic.twitter.com/q5QfGnz7m0"
2018-02-22T13:21:47,"@BimAfolami says that getting disabled people into appropriate work, where they can flourish and use their God-given talents, whatever they are, is central to social mobility."
2018-02-21T20:40:22,"208 Labour MPs voted tonight against abolition of stamp duty for 80% of first time buyers, so much for trying to help young people on the housing ladder"
2018-02-19T23:10:47,"Amid all the claims and counters, one key fact remains: Corbyn has not denied meeting a Czech ‘diplomat’ (who turned out to be a spy) at least 3 times in 1986-7. Nor explained why.https://twitter.com/johnrentoul/status/965531035021774848 …"
2018-02-20T11:31:31,"This morning @jeremycorbyn declared war on British business - a Labour Government that hates enterprise would mean fewer jobs, higher taxes &amp; less money for public services. http://www.cityam.com/280896/jeremy-corbyn-slammed-dubbing-city-pernicious-and … via @CityAM"
2018-02-17T14:17:29,From the ex head of MI6 this is pretty worrying....https://twitter.com/politicshome/status/964834312448368642 …
2018-02-15T10:15:53,Thread. A must-read for anyone who thinks there is a liberal bone in Jeremy Corbyn's body.https://twitter.com/rcolvile/status/964068495616040961 …
2018-02-10T08:04:39,Great barn meeting yesterday to discuss the future of farming with @neilparish at @Maydencroft. Thanks hosting @BimAfolami &amp; @CLAEast. Good coverage by @BBCLookEast.pic.twitter.com/H8eOdySMCK
2018-02-09T10:08:05,A beautiful tudor barn for our meeting in Hitchin with @BimAfolami and @Neil_parish today.pic.twitter.com/ViTsp0ZKeA
2018-02-09T10:28:34,An excellent turnout for our barn meeting with @neil_parish and @BimAfolamipic.twitter.com/ME9tIAYSb9
2018-02-07T17:35:50,"Labour MPs just voted against giving the police £450m extra funding, just hours after Corbyn criticised the Prime Minister on policing at #PMQs. Labour talk the talk, but don't walk the walk.pic.twitter.com/Zru0m7J4kw"
2018-02-06T12:33:33,"British #agriculture needs to become more efficient – and one way to do that is to improve nutrient efficiencies both in crops and livestock, says @TimacAgroUK – which opened its new head office at @RothamstedCRE to meet those demands. With @BimAfolami. http://ow.ly/JcRg30ielCk pic.twitter.com/7SimdSu4tF"
2018-02-06T09:29:58,"100 years ago, women in the UK won the right to vote. A huge step forward for Britain, but there's still plenty more to do before we can say we've got it right #vote100"
2018-02-06T07:55:51,This is the modern Labour Party.https://twitter.com/markatscope/status/960587769520246785 …
2018-02-05T18:36:29,Loved meeting you - stay in touch please so I can come to the launch!https://twitter.com/bestkeptskills/status/960566230771003392 …
2018-02-03T21:40:18,"The International Space Station is passing overhead February 03, 2018 at 10:06PM, for 549 seconds #Harpenden #ISSpic.twitter.com/F82KNkDboN"
2018-02-02T23:30:55,What a nice man the shadow Chancellor is...https://twitter.com/Jamin2g/status/959541145226436608 …
2018-02-03T01:44:51,The courtesy &amp; commitment to free speech shown by @Jacob_Rees_Mogg in stark contrast to the Corbynist thugs who attacked tonight’s meeting.
2018-02-02T19:46:57,My politics are not those of @Jacob_Rees_Mogg however l utterly condemn the behaviour of those tonight who tried to attack him whilst he was due to speak at an event he was invited to. It's extremely intimidating for any MP who travels alone to an event to be treated like this 
2018-02-02T14:00:00,Votes for teens reaches peak cynicism: the Welsh government grants 16-17 year-olds the vote *in* *the* *same* *week* as banning them from getting a tongue piercing because they 'lack the experience or knowledge' to clean it?! 
2018-02-02T09:13:42,You can give blood on the 14th &amp; 15th February at St Dominic Primary School. Find out more and sign up at http://blood.co.uk  @SDCPS1 @GiveBloodNHShttps://twitter.com/hertsad/status/959352695785246722 …
2018-01-30T12:06:38,"Labour divisions exposed as Haringey council leader, Claire Kober, quits claiming ""sexism"" and ""bullying"" by Jeremy Corbyn's Momentum.pic.twitter.com/ddKLnlnQbJ"
2018-01-29T08:55:27,"Monday's guests of the day are @CatSmithMP and @BimAfolami joining @Jo_Coburn
#bbcdp @bbctwo 12-1pic.twitter.com/bw5IjFLC9Z"
2018-01-29T09:01:23,Turns out Corbyn told three whoppers in the space of 20 seconds on Marr yesterdayhttps://twitter.com/guidofawkes/status/957901130222227456 …
2018-01-28T23:07:31,Wow.  Several lumps in throat.https://twitter.com/buzzfeednews/status/957406870779543554 …
2018-01-28T10:43:49,"Corbyn told Marr he accepted money from Iran “a very long time ago” – it was 2012.

And that he stopped because of the way they treated the Green movement – that was in 2009. He carried on taking their cash and praising their government for years after.https://order-order.com/2018/01/28/corbyn-lies-about-his-support-for-iran/ …"
2018-01-27T08:10:48,"There is more to do but today’s news that the number of first-time buyers is at the highest level since 2007 shows our mission to deliver the homes we need, backed by practical policies like our stamp duty cut for first-time buyers, is making good progress.pic.twitter.com/wcJKxPR3xF"
2018-01-25T15:37:23,"Great comments by @BimAfolami, he says this partnership between a research centre (@Rothamsted) and a “dynamic pioneering company” (@TimacAgroUK) is the manifestation of the UK’s industrial strategy @beisgovuk @AgriTechGovpic.twitter.com/MdPuOawad7"
2018-01-25T16:37:38,Rothamsted partnership is “the Industrial Strategy in action” @BimAfolami declares at official opening of @TimacAgroUK Head Office @Rothamsted today.pic.twitter.com/Y1Iqz78R8W
2018-01-23T20:01:02,"Labour's front bench take on the famous black chair. How do they get on?  
You'll want the sound on for this one…  #LabourMastermindpic.twitter.com/wjjYgZzywT"
2018-01-23T10:06:23,The UK government borrowed less in December than in any year since 2000. Total borrowing for 2017/18 looks set to be almost £20bn less than the OBR forecast just ten months ago.
2018-01-22T22:46:01,"Remember, this is from a party led by Jeremy Corbyn who said that “Only Labour can unlock the talent of Black, Asian and Ethnic Minority people""

Their patronising, condescending, casualty racism has no place in modern Britain.https://twitter.com/jamescleverly/status/955570538218512386 …"
2018-01-22T20:44:52,"So “f*****g Tory c***” seems to be the description of choice at Momentum. Hey Jezza, can we have your personal assurance you will expel from the Party those who do this? After all, your’s is a new caring, sharing politics isn’t it?"
2018-01-22T22:39:04,Is it because Labour think that blacks people cant be rich and that white people can’t be poor?http://www.bbc.com/news/uk-politics-42783246 …
2018-01-21T13:35:00,Bright Blue: A small liberal conservative think tank has helped cement Theresa May’s new love for the environment -http://www.independent.co.uk/news/uk/politics/theresa-may-environment-bright-blue-michael-gove-coffee-cups-plastic-straws-waste-a8169921.html …
2018-01-22T11:32:40,"Our 2nd Future of Work report: ""Towards a Reskilling Revolution: A Future of Jobs for All"" finds that a huge effort is needed to safeguard workers from the 4th Industrial Revolution 
https://www.weforum.org/reports/towards-a-reskilling-revolution/ …
with @wef @BCG @zahidi @TALeopold @vessisr @Burning_Glass #futureofwork"
2018-01-21T13:19:10,"Twitter defenders of John McDonnell for his comments about Esther McVey ought to be extraordinary, yet there are a lot of them"
2018-01-22T09:22:10,And @rcolvile debunking Labour’s nationalisation proposalshttps://www.thetimes.co.uk/article/labour-nationalisation-plans-would-beruinous-5pwfr9g26 …
2018-01-21T17:44:06,The full cost of @jeremycorbyn’s plans to nationalise key services has been set out forensically by @CPSThinkTank - £176bn. That’s why they won’t tell you - and the cruel twist is there’s no evidence it would deliver better services.https://twitter.com/CPSThinkTank/status/955039696450617344 …
2018-01-20T11:35:11,Really enjoyed it - well done to the debaters!https://twitter.com/hitchingirls/status/954475401803378689 …
2018-01-19T18:25:06,Thanks to @heartsmilkbank for inviting @midwifeteacher from @uhmidwifery and @slrpsych from @CRIPACC1 along to talk to @BimAfolami about how we’re working together to research and teach the benefits of #humanmilkpic.twitter.com/e1AA69Fclp
2018-01-13T09:37:02,"Laura Pidcock MP, Labour’s new shadow minister,  described Chris Williamson as “a signpost”. 

Let’s see what Labour plan he was signposting.pic.twitter.com/8bsbcZXjrb"
2018-01-12T12:55:12,"Spent the morning talking to some of the world's top consultants at @McKinsey - we discussed and shared insights into business, technology, populism and how we need to transform the British education system - thanks for inviting me!pic.twitter.com/4fgBw0TgrC"
2018-01-12T12:41:36,"Really excited about this - come along and join in if you want to discuss issues that affect the countryside, such as farming, rural communities, rural crimehttps://twitter.com/claeast/status/951793471064600576 …"
2018-01-11T20:12:26,Yes let's arrange - would be very happy to do ithttps://twitter.com/danny_d_pearson/status/951545911771123713 …
2018-01-11T19:59:11,Really looking forward to this event - and for an extremely good cause - @FredianiITV is a 1st class TV interviewer...I'm sure he will ask some tough questions!https://twitter.com/atsociety/status/951488890904465409 …
2018-01-11T19:54:45,Our vision on the environment....pic.twitter.com/zzVuJJabF9
2018-01-10T10:16:45,"Fascinating: tolerance towards migrants greater in English towns/seats which had Jewish presence in the Middle Ages. Effect is one-third the size of having a uni degree (= ""not nothing"")https://twitter.com/BJPolS/status/951033419458400256 …"
2018-01-10T23:29:38,Just watch this...https://twitter.com/daily_politics/status/951060708833165312 …
2018-01-07T11:19:01,Well done @SouthallMrs - my letter on this already sent to Dept of Education no longer needed!will still ty and clarify the details we discussed https://twitter.com/southallmrs/status/949961652019048448 …
2018-01-07T10:44:33,For those of you who fancy a bit of radio 4 at 10pm this evening...https://twitter.com/bbcwestminhour/status/949302281232703488 …
2018-01-06T10:02:25,Read this - tough to make doable New Year's Resolutions - but it feels a bit easier after reading thishttps://twitter.com/phasehitchin/status/949573653125091328 …
2018-01-05T14:53:03,"With more VC investment in UK tech than Germany, France, Spain &amp; Ireland combinedpic.twitter.com/MDjSBUKDYL"
2018-01-05T09:10:54,NEWS: 2017 saw RECORD investment into U.K. tech - double 2016. More good jobs. #DigitalStrategy http://www.cityam.com/278258/londons-tech-scene-pulls-record-gbp25bn-2017-venture …pic.twitter.com/U2ajEN2cjP
2018-01-04T13:47:17,"Congratulations Mrs Hendy.  What an honour, and well deserved.https://twitter.com/hitchingirls/status/948877113653891072 …"
2018-01-03T13:42:33,"The PM visited Laura today, a first-time buyer who has benefited from the Help to Buy schemepic.twitter.com/pGhyulAJD5"
2017-12-23T09:09:17,"OMG. Right. Please. Can everyone on twitter, on both sides, PLEASE stop going on about damn passports! I simply do not care what bleeding colour they are! There. Said it."
2017-12-22T13:35:07,This is genuinely significant - beating off some pretty stiff competition!https://twitter.com/jamescleverly/status/943191178572390400 …
2017-12-21T22:04:30,It’s important to know the facts in any policy dispute. These seem pretty clear and @DavidGauke is showing why #UniversalCredit is working for most. Shame @frankfieldteam would neither help nor admit it worked.https://twitter.com/davidgauke/status/943847521029447685 …
2017-12-19T10:44:37,"It’s easy to knock business, but thank you to all the companies that have taken risks, invested and helped take unemployment down to a record low – making ‘Britain’s job creation second-to-none’http://bit.ly/2BwXbyT "
2017-12-18T19:38:14,Really enjoyed meeting you all - see you soon in Herts!https://twitter.com/sgtalison/status/942782831671070721 …
2017-12-16T10:16:16,This amendment is a good thing - completely in favourhttps://twitter.com/samcoatestimes/status/941714798366126080 …
2017-12-15T19:16:56,"Big thanks to @BimAfolami for sporting a Christmas jumper today. He was in, talking about the important issue of mental health.pic.twitter.com/N6g19P6Cmx"
2017-12-15T16:46:05,This sort of modesty is rare amongst politicians!https://twitter.com/tnewtondunn/status/941607467066249216 …
2017-12-15T14:44:13,Really enjoyed it - lots of work to do - excited!https://twitter.com/phasehitchin/status/941679984497831941 …
2017-12-15T13:45:19,Looking forward to discussing farming and other issues that affect the countrysidehttps://twitter.com/claeast/status/941284535312044033 …
2017-12-14T16:32:29,Fantastic article from @JustineGreening on social mobility - completely agreehttps://twitter.com/justinegreening/status/941231134423355392 …
2017-12-10T20:55:16,"After heartbreaking footage on the Blue Planet II, good to seepic.twitter.com/KwMSt43FQM – At Houses of Parliament"
2017-12-08T10:30:30,"I don't think any of us can appreciate the huge pressure that the PM has been under this week, &amp; yet she has risen to the challenge &amp; delivered a genuine breakthrough that moves Britain forward. Statesmanship &amp; courage in the national interest. #brexitbreakthrough"
2017-12-08T08:44:14,"This deal gives our brilliant EU doctors &amp; nurses binding guarantees about their residence rights. NHS staff please spread the word to European colleagues: this is your home, we value your life-saving work, and we want you to stay."
2017-12-08T08:46:12,Fundamentals in all of this.....Northern Ireland will not be separated in any way from the rest of the UK after Brexit. Unfettered access to the UK market. No borders in the Irish Sea. Positive day for the Union. Now to the next stage and getting the best UK/EU trade deal.
2017-12-08T09:00:10,Well done Theresa May and her team! High drama and tough but ingenious negotiation to get a deal at the last minute-it was ever thus with the EU.
2017-12-08T07:46:40,Well done to @Number10gov for her hard work to get us to a deal with the EU - keen to move onto phase 2 and discuss trade and future
2017-12-07T18:36:39,Happy to do sohttps://twitter.com/alicegroom2/status/938839352616144898 …
2017-12-05T11:08:01,Exactly right.https://twitter.com/rbrharrison/status/937959949602353152 …
2017-12-04T12:36:52,Very happy to support @youngenterprise - a vital and fun programme for young peoplehttps://twitter.com/youngenterprise/status/937658495213678592 …
