2018-09-12T16:19:26,"If you’re a resident of the #Clacton constituency, make sure you sign up to my email newsletter and keep up to date with my activities!

https://bit.ly/2N9OlzW "
2018-11-27T11:40:00,Look who didn’t turn up to talk to the International Grand Committee on fake news...pic.twitter.com/KkyEE9oHnp
2018-11-26T13:26:11,Met with the Wildlife trust to promote a “wilder future” - yes I know that can be misconstrued - but we must look after green and wild spaces! #wildlife #environment ⁦@NaturalEngland⁩ ⁦@WildlifeTrusts⁩pic.twitter.com/5RipCndqb5
2018-11-25T12:16:28,"As part of my enquiries amongst the people of #Clacton on Brexit, I visited the Princes Theatre’s Victorian Fayre - excellent!pic.twitter.com/HfJcGX6ywI"
2018-11-25T12:13:40,"In addition to the Elder Abuse Debate I hosted in the House of Commons, I got this very encouraging reply from the Law Commission. #tenpagpic.twitter.com/r6qajNw0rf"
2018-11-25T12:08:14,Attended an #mpsupport4cry event to promote awareness of Cadiac risk in the young. Please let everyone know so we can tackle this serious and often tragic illness.pic.twitter.com/6edJLdf67f
2018-11-25T12:02:30,"All enquiries please to: giles.watling.mp@parliament.uk - write to: Giles Watling MP, House of Commons, London SW1A0AA, or call: 0207 219 0795 or 01255 473748. Thanks."
2018-11-24T15:52:28,"Seriously though, it doesn’t hurt and it saves a huge amount of grief - so get your flu jab!  As you can see I got mine...pic.twitter.com/z0fVLhwSpc"
2018-11-21T16:18:16,Policing is important to us all. Please help them by completing this survey...http://www.essex.pfcc.police.uk/policing-precept-survey-2018 …
2018-11-20T18:50:08,"It’s been a bit of a busy few days, but I managed to wade through the entire withdrawal agreement. Not bad, but not entirely satisfactory. Take a look at my statement... cheers!https://www.gileswatling.co.uk/news/update-brexit-statement …"
2018-11-13T11:55:34,"With Mary McGrath CEO of @foodcycle in #Clacton , Deacon Janet Jenkins, Volunteers Roger Green and Kay Fosker. Doing great work for the community, offering free meals and controlling food waste. Getting people together for a chat over a meal is so important. Congratulations all!pic.twitter.com/h4e2xAohdo"
2018-11-12T23:36:35,"Well, I was pleased and proud to vote for tax cuts tonight for my constituents in #Telford - they will hugely value the difference it makes to everyday life .https://twitter.com/CCHQPress/status/1062122613156298752 …"
2018-11-12T14:29:04,@PippaandLizzie
2018-11-12T14:19:36,"So fantastic to have been a small part of such a moving, funny, ridiculous and uplifting tribute to those that fought for along and Country all those years ago. We certainly kept the home fires burning on Saturday night!https://twitter.com/PippaandLizzie/status/1061969753626107904 …"
2018-11-12T09:55:53,"Five Parliaments from across the world who represent 170 million @facebook users are asking Mark Zuckerberg to give evidence to them. Retweet if you think he should come and answer questions on the 27th of November.

https://www.parliament.uk/documents/commons-committees/culture-media-and-sport/181107-Chair-and-others-to-Mark-Zuckerberg.pdf …"
2018-11-12T06:40:47,Attended Danny Boyle’s ‘Pages of the Sea’ 14-18 Now installation on #Clacton beach. Volunteers helped the fantastic Grand Theatre of Lemmings make images in the sand all morning - only to be washed away at high tide in remembrance of those who never came back. #WeWillRememberpic.twitter.com/6wxmu4OhM5
2018-11-12T06:32:31,"#Clacton saw 6,000 attend the remembrance service in the stunning memorial gardens. Very moving as every name that made the supreme sacrifice read out...pic.twitter.com/YeBphO4KAH"
2018-11-10T14:35:33,"The Clacton constituency from 5,000 ft 15 minutes ago. Walton Backwaters in the foreground- we really do live in an amazing place! #clactonpic.twitter.com/AU8mng3lJR"
2018-11-10T08:37:54,"At the Kaiser Kirche in Berlin. It contains the nail cross of Coventry as a sign of remembrance, forgiveness and unification. Returning to the U.K. to take part in events to celebrate peace. We must remember and strive to end conflict.pic.twitter.com/RK66voPWfl"
2018-11-08T09:53:02,Oh my goodness! I would encourage anyone who can to visit the Clacton Memorial garden the volunteers and staff @Tendring_DC have produced a stunning display of huge poppies made of red cyclamen &amp; black grasses #lestweforget18
2018-11-07T09:52:55,"Facebook say that they remain committed"" to working with our committees ""to provide any additional relevant information"" that we require. Yet they offer no means of doing this. The call for accountability is growing, with representatives from 5 parliaments now meeting on the 27thpic.twitter.com/VJFtpqUi0r"
2018-11-06T18:05:25,"Really honoured to be asked to open Hidden, a brilliant new addition to Connaught Avenue! Claire Lee, the owner, has had a very successful career in the hairdressing business and has employed many local people. We’re lucky to have people like her keeping our high streets alive!pic.twitter.com/cHJxueGcN3"
2018-11-06T18:04:37,"Really honoured to be asked to open Hidden, a brilliant new addition to Connaught Avenue! Claire Lee, the owner, has had a very successful career in the hairdressing business and has employed many local people. We’re lucky to have people like her keeping our high streets alive!pic.twitter.com/1QZjjBbYKK"
2018-11-06T15:43:33,With the Secretary of State for Transport Chris Grayling pushing for real rail upgrades to our area! (I also bent his ear about the state of our roads)pic.twitter.com/UyhQjJ5wen
2018-11-06T15:39:41,World! I meant world!
2018-11-06T15:32:54,I have written to @ilgop inviting Dr Nick Stella to visit #Jaywick in #Clacton #Essex following his unfair use of an old photograph of Jaywick to demonstrate deprivation as a part of his #American #congressional campaign. Jaywick is on the up! #MidtermElections2018 @JamesDwanpic.twitter.com/HuwB9BEdmA
2018-11-06T15:23:48,Attended the service marking the Centenary of the end of the First Works War - what a pity it didn’t turn out to be the ‘War to end all Wars!’ Very moving - such a waste...pic.twitter.com/2W1Pzi0l5n
2018-11-05T17:34:48,"So this is an image from the web - what do you think - is my moth the same? Or is it, as Mr Halliday says, a common or garden wallet mothhttps://goo.gl/images/QGPtU5 "
2018-11-05T13:03:17,"I do believe this is a very rare Fisher’s Estuarine Moth which turned up on our kitchen window...
I await confirmation...pic.twitter.com/sR7rP0iMEc"
2018-11-03T12:20:04,EPC-UK were delighted to host a visit and guided tour for local MP @GilesWatling as we discussed what we do as a business and how we can better the local environment #espritdequipepic.twitter.com/8dZqv1xkgy
2018-11-01T17:07:35,"This happening in Frinton today! Not a sight we want to see, but at least with this rapid and effective response with a man in custody, we’ll not see it again. The police demonstrating that we are not to be toyed with! Well done!https://www.clactonandfrintongazette.co.uk/news/17194889.armed-response-officers-descend-on-frinton-as-raids-are-carried-out/ …"
2018-11-01T16:36:35,"With some of our servicemen- and a helper, selling poppies in support of our veterans! Give generously! #PoppyDay for #PoppyAppealpic.twitter.com/q3ayZf6v7G"
2018-11-01T07:15:53,Well done @GilesWatling for sticking up for #Jaywick and promoting it on @BBCEssex.
2018-11-01T12:03:35,Too late now - you have to go to Sadie Nine on BBC Essex and Listen Again @BBCEssex @sadieninehttps://twitter.com/sadienine/status/1057921577063497728 …
2018-11-01T09:45:01,"Clacton MP @GilesWatling is leading a call for elder abuse to become an aggravated offence, carrying stiffer penalties for offenders. He told @sadienine ""we are trying to get authorities to take note and give out harsher sentences, its appalling that its not been done already"".pic.twitter.com/clJrh8VuHM"
2018-11-01T07:42:30,Clacton MP @GilesWatling tells @BenFryer and @sonwatson he will extend an invitation to Dr. Nick Stella to visit #Jaywick after the community was mocked in a US election campaign advert.pic.twitter.com/HgA2ZvKCQB
2018-11-01T08:44:50,Listen again to my interview on BBC Essex at 07.00 this morning. Jaywick is  on the up! I have invited Dr Nick Stella over to see for himself what a great place we have here!https://twitter.com/StockNeil/status/1057905509469163521 …
2018-11-01T07:00:38,"Are you travelling through London Liverpool Street station @NetworkRailLST  today? 
Please give generously to our soldiers collecting for #PoppyAppeal, funding @PoppyLegion's work supporting the Armed Forces community and marking #Remembrancepic.twitter.com/VuzG7FO0Vm"
2018-11-01T08:40:16,"After my debate on Elder Abuse in Parliament last week, I expand the topic on BBC Essex  at 09.00 this morning with @sadienine. We must make this an aggravated offence carrying heavier penalties - it is an abuse of trust hitting the vulnerable - appalling! Tune in!"
2018-10-23T11:00:30,Because this issue has been ignored nationally recently I am holding a debate later today in the House to highlight it and call for more meaningful punishment for offenders.https://twitter.com/CentralLobby/status/1054646569369251840 …
2018-10-31T19:33:02,"At the Business Support and Engagement reception. With my history of supporting small business in Tendring as Head if Regeneration, it’s good to expand that work!pic.twitter.com/v7TRbZkKqW"
2018-10-31T15:49:24,"Good to have Lynne Woodcock, Managing Director, Jayne Hiley, Director of Operations and Quality and Dr Raja, GP, in the house to answer patients’ concerns on ACE practices in #Clacton. I will keep challenging until we get the best possible service for clients!pic.twitter.com/SSXARO7E4W"
2018-10-31T11:32:47,⁦with Donna Fraser supporting Breast Cancer Awareness month for @breastcancernow⁩. Get the message across -  Check yourself regularly! Early diagnosis is vital.pic.twitter.com/6tZKVaod4j
2018-10-29T15:09:27,Another flurry coming up - it’s been a busy time...
2018-10-18T13:46:36,Why I support cutting duty on beer! It’s all about community cohesion... and the British way of life. Back your local pub!pic.twitter.com/fYWQSnM3zy
2018-10-16T06:25:58,"OK, so went to stay with friends en route to Northolt from where I was due to fly to RAF Coningsby. Fog has grounded the plane so had to dash across London to catch the train from Kings Cross at 05.30 am. The best laid plans... Might fly back though for work this evening..."
2018-10-15T16:34:41,These wonderful guys from Engaines Primary came to see me today. They had a tour and asked some challenging questions! Thanks to the staff for bringing them - great people.pic.twitter.com/kTkPx6vZok
2018-10-11T19:26:52,"Resignations, sackings, speculation and outrage may amuse the media, but it does nothing to help anyone achieve a decent outcome. In fact it just puts brexit - hard, soft or simply semi - in peril and increases risk of a Corbyn Gov.https://twitter.com/christopherhope/status/1050449323190878209 …"
2018-10-10T17:12:50,The PM greets our brave soldiers!pic.twitter.com/15xnSVdbWx
2018-10-10T17:10:23,Pleased to greet and congratulate 120 of our dedicated troops returning from deployment. We all owe them so much.pic.twitter.com/jfSP84FE7H
2018-10-10T15:10:30,Also from Oct 1st we have stopped using plastic water bottles. Great stuff that should be followed across the planet in order to save it!pic.twitter.com/OEhPyVuua5
2018-10-10T13:05:58,Pleased to see that Parliament is leading the fight against the plastic menace by introducing these compostable plastic like glasses. It’s a bit of a worry though as I think we’d better drink quickly...pic.twitter.com/XViEN0VFRB
2018-10-09T19:24:57,A big thank you to @HuddlestonNigel for the Hospitality Parliament Day 2018 at Westminster today. Also to @GilesWatling for discussing the issues affecting hospitality in our closed session. #HospitalityDay @UKHofficialpic.twitter.com/Z8jZcV2Air
2018-10-09T14:50:40,Please watch this video - this is a much overlooked matter which cuts to the hearts of so many families across the country... xhttps://twitter.com/BLA_Campaign/status/1049648381306527746 …
2018-10-08T13:28:36,At the brilliant GLA training academy - the place in #Clacton to learn the skills of roofing. There is a demand for people in this rewarding profession and Andy Bird and Lesley Addy are determined to encourage the young and those needing work to get trained! Good work!pic.twitter.com/rCLVf8dxVG
2018-10-08T13:21:36,Honoured to open the Men’s Health event! Well done all involved.pic.twitter.com/EvYM6vyhSD
2018-10-08T13:07:24,It’s at this time of year that we get the most beautiful sunsets combined with active bird life in the Walton Backwaters. What a great place to live!pic.twitter.com/RFDcg7cOVq
2018-10-04T20:39:14,"Congratulations to Hannah Clark, winner of the Judges Award as the apprentice of the year!pic.twitter.com/1CDChqJ87T"
2018-10-04T18:42:01,At the fantastic Blue Ribbon awards in #Clacton celebrating all that’s best in business in Tendring. Michael J Fitch the magician opened proceedings brilliantly! Well done all the nominees!pic.twitter.com/axhZEYeZOh
2018-10-03T18:27:13,A really impressive interview with @Soutiam21https://twitter.com/itvnews/status/1047373591258574848 …
2018-09-25T19:51:26,Great stuff from the brave crew at @ClactonRNLI - fair to say our whole town is proud of you guys! #SavingLivesAtSeahttps://twitter.com/RNLI/status/1044587384380239872 …
2018-09-22T23:04:28,Well done Buffy -your Auntie Debbie would be so proud of you! I’ve donated and I encourage others to do the same. Together we can beat this terrible disease! #beatcancerhttps://fundraise.cancerresearchuk.org/page/buffys-giving-page …
2018-09-14T18:18:01,Last of the Summer Wine raising money for a good cause with guest speaker Giles Watling Mp and @AndrewRosindellpic.twitter.com/0uRYvsemWd
2018-09-13T10:34:48,Any help spreading the word or recruiting more please contact me for help
2018-09-12T15:56:15,With the NFU promoting our amazing farmers!pic.twitter.com/WfcKP2cKEf
2018-09-12T15:54:38,⁦@AnthonyNolan⁩ today - save a life!pic.twitter.com/QMCsqwTo2Y
2018-09-12T15:53:02,⁦ I visited @AnthonyNolan⁩ fund today to offer my support. They do so much for those suffering from blood cancer. In Clacton they have 457 potential life savers on the Stem Cell Register - well done! But they always need more!pic.twitter.com/x8EEVYHcTW
2018-09-12T15:47:57,"Great news! Clacton’s Ravens Academy has been awarded £10,000 by the Big Lottery Fund to build a covered outdoor area for their children and the community!https://goo.gl/images/NWy99c "
2018-09-12T15:43:49,Emmeline Pankhurst should remain near parliament. She gave so much for equality and won! My daughters and many others over the world owe her a debt of gratitude. The plan to move her statue to Regent’s Park makes no sense. Visitors know where to find her - as did my daughter!pic.twitter.com/djJqjvOoK2
2018-09-10T17:30:42,"Wearing pink with Donna Fraser, Olympic champion and ⁦@breastcancernow⁩ ambassador. Be aware and check regularly - this needn’t be a killer. It applies to men too. Early diagnosis is vital! My thoughts are with Rachael Bland’s family and friends.pic.twitter.com/Sz4x12pD4M"
2018-09-10T15:10:13,"Spent time with ⁦@PcAndyLong⁩, the Essex Wildlife Crime Officer. He has a selection of grotesque items seized from unscrupulous dealers. Stuffed turtles, a leopard, a monkey skull and many ivory pieces - all illegal. A shocking trade - very sad. Keep up the good work Andy!pic.twitter.com/3ARtlqVlhJ"
2018-09-10T13:18:42,"At the Manchester City Football Academy - they have an amazing facility which is used to reach out to the community in so many ways. Two year olds, primary children, the disabled, a club for retired men and promoting women’s football. At the same time in the same space - amazing!pic.twitter.com/kWgunhvqYX"
2018-09-10T10:00:22,"Sadly it is true that some cancers are regarded as untreatable and therefore people are just expected to live, and die, with them. This taskforce is a determined drive to halve fatalities by2028. They have my total support. #28by29pic.twitter.com/vWjmeb3Awe"
2018-09-10T08:07:29,Hello. Is this on public land? Illegal dumping can be reported via our online form here; https://www.tendringdc.gov.uk/rubbish-and-recycling/fly-tipping … - if people tell us about issues we can address them early.
2018-08-23T07:20:35,"Those of you travelling to Clacton Airshow by vehicle, please park responsibly.Parking attendants will be out."
2018-08-18T20:39:18,"Well said Stephen. The  Arts have always, since the ancient Greeks, been the path to human progress!https://twitter.com/BigTentIdeas/status/1026540782692401152 …"
2018-08-17T14:37:26,With the East of England Ambulance Trust to see how they are responding to demands for better performance. They are determined to deliver a first class service for us all. Thanks Glenn Young for showing me around and thank you to the devoted staff @EastEnglandAmb @EEASTCEOpic.twitter.com/eyPJUCGXCA
2018-08-17T13:01:25,At Clacton Fire Station with White Watch! A truly dedicated bunch. Station Commander Mark Wilby showed me around. I had the dubious pleasure of entering a blacked out smoke filled building to rescue a dummy baby. These people really earn their corn! Thanks guys!pic.twitter.com/9GBlhEXTkg
2018-08-16T23:55:08,"Steve Gove of TDC, Cllr Colin Sergeant and I meet to survey measures to ensure security at the Air Show and measures to stop illegal incursions by travellers. We can improve things on the ground but we need a change in the law to deter those who wish to spoil our environment.pic.twitter.com/D8wDV4FMfS"
2018-08-16T23:49:26,"I held a meeting with District Commander Paul Wells, Chief Supt Ewan Wilson and Stephen Kavanagh, Chief Constable. Discussed the imminent roll out of our new officers. I will ensure that we never slack in the fight to keep Clacton and area a safe and attractive place to live!"
2018-08-16T23:39:05,"Had a very productive meeting with TenPAG yesterday, an action group for pensioners. We talked about everything from Brexit to toilets. Sam Hepplewhite, Chief Officer of North Essex CCG took on issues of health. Grateful to her and those present! #TenPAG"
2018-08-16T22:16:29,"Met Sue Hawes CEO of @grassrootschrty a devoted woman with a vision, giving grants to voluntary and community groups across Tendring and Colchester. She is actively seeking benefactors and beneficiaries. Can you sponsor? I am proud to be a patron! Visithttp://www.grassrootscharity.org "
2018-08-16T22:06:40,"Back in Clacton, went to visit Dalau Ltd, manufacturer of high end plastics supplying everything from medical parts to aeronautics to architectural. Employing 94 and exporting to the world. Clacton had so much to celebrate! David and Mark Sage have a wonderful company!pic.twitter.com/HuPhcFsJNy"
2018-08-16T21:51:50,Went to the buffer zone in Nicosia between Greek Cypriot and Turkish Cypriot positions. The @TheRoyalLancers wearing the UN blue berets keep the peace in the central area. Calm and forceful - and diplomatic! They took me to the abandoned intl airport - weird post-apocalyptic sitepic.twitter.com/dZiyb88AQn
2018-08-16T21:41:01,"Met the engineers and pilots taking part in Operation Shader over Syria. The pilots showed us their aircraft, Tornado GR4 and Typhoon. Then they said that their aircraft really belonged to the engineers who work so hard to keep them in A1 shape to send them on gruelling missions.pic.twitter.com/6gEyrCB3Qr"
2018-08-16T21:28:58,Been with members of the Royal Anglian regiment in Cyprus. Looking at the vital work they are doing defending our Sovereign Bases there. Watched a very impressive exercise as the ran up a valley defending a power station - in 37* C! Tough and dependable! @RoyalAnglians amazing!pic.twitter.com/dtXWs19j5C
2018-08-16T21:05:35,Been off Twitter for a while - been a busy old time. The next few tweets will be a sort of catch up! Hope everybody’s enjoying a hopefully brief spell of rain. Good for the gardens and the farmers!
2018-08-04T13:43:02,"Intense large bore gunfire did this to a beautiful house in the centre of Nicosia in 1974. People were killed. And still they point weapons at each other. The UN peacekeepers are doing just that, keeping the peace. At the moment it’s the Royal Lancers - thanks lads and lasses!pic.twitter.com/0UYzPy7YGd"
2018-08-04T09:03:13,In the Green Zone at Nicosia Intl Airport - built in 1969 and closed since the Turkish Intervention in 1974. The two halves of Cyprus still divided. Such a shame - a beautiful island.pic.twitter.com/tfQnmMmkU3
2018-08-02T07:50:08,"With an 84 Sqdn Griffin 2. These dedicated people fly SAR and other missions over the Eastern Med. We are lucky to have these assets, we should treasure them.pic.twitter.com/6BtVNXCjMZ"
2018-07-31T23:02:13,Enjoyed a wonderful night at Frinton Summer Theatre for Noel Coward's delightfully ghoulish/witty Blithe Spirit. Review in Thursday's @ClactonGazettehttps://twitter.com/FFrintonTheatre/status/1024425123779170306 …
2018-08-01T15:40:01,"With our incredible armed forces in Cyprus. I met Yukon, eight years old, he is retiring from army life and needs a new home. He is SO well trained! Lovely boy...pic.twitter.com/ulHGQaJaN6"
2018-07-30T11:53:38,"London Borough urged to stop housing vulnerable people in Clacton.
https://www.tendringdc.gov.uk/council/news-pr/news-listing/london-borough-urged-stop-housing-vulnerable-people-clacton …"
2018-07-24T13:33:42,This is appalling! I will not have this on my patch - these criminals need to be caught and made an example of. Thugs should be made aware they are not welcome - they will be dealt with! Thank God we will have more police officers soon @EssexPoliceUKhttp://www.clactonandfrintongazette.co.uk/news/16372445.menacing-thugs-threaten-to-use-knife-in-terrifying-attempted-robbery/?ref=twtrec …
2018-07-24T12:52:31,Supporting the pub trade - very important for British social exchange. Our local pubs are the centre of our communities and fun! ⁦@LongLiveLocals⁩ #pic.twitter.com/Z2kCjtBC4y
2018-07-23T14:19:28,"In response to a question from @GilesWatling on coastal regeration, Rishi Sunak responds that £174 million has been spent supporting coastal communities over the last few years. #oralquestionspic.twitter.com/TkWOWHR86v"
2018-07-23T13:52:24,Clacton ranked in @thesundaytimes list of best places to live by the sea @Tendring_DC @GilesWatlinghttp://www.eadt.co.uk/news/sunday-times-best-places-to-live-clacton-1-5619576 …
2018-07-19T14:15:34,"@GilesWatling representing his constituent Kevin who has finger pricked 14,600 times and calls it a ‘bloody pain’. Great to have support for @APPG_Diabetes from across the House to drive uptake and equity in diabetes care. #togetherwearestronger pic.twitter.com/p5qZpmk5wr"
2018-07-19T11:57:31,"""Great to see all parties working together to solve a practical problem."" - Rishi Sunak MP

Credit to @GregKnight - 
A code of practice is required for the operation &amp; management of private car parks to help stop #CarParkSharkspic.twitter.com/HZPiqUYuVd"
2018-07-20T08:20:52,"RIP Geoffrey Wellum. Left my alma mater, Forest School, to become the youngest fighter pilot in the Battle of Britain. They don’t make ‘em like that any more. A true hero. His book “First Light” is a terrific read! I thoroughly recommend it."
2018-07-19T20:11:48,Putting our Great British High Streets in #Clacton on the map!pic.twitter.com/FDdaZQmVTP
2018-07-19T16:01:50,My response to the Government’s #WhitePaper on the future relationship between the U.K. and the EU. Read my statement here: https://www.gileswatling.co.uk/news/statement-brexit …pic.twitter.com/69Y4ivt1Bn
2018-07-17T15:42:21,"Introduced a Bill to regulate so called ‘Mosquito Devices’ today. These ‘anti loitering’ devices indiscriminately aggravate the hearing of innocent children, babies and animals. They also cause health problems, and their use must be controlled. Time for change.pic.twitter.com/o4r79FYVvo"
2018-07-15T23:58:09,"A tremendous #VictoryDinner2018 at  the splendid Painters’ Hall @painters_hall City of London, with my great friends and colleagues from @UKParliament @PennyMordaunt @DominicRaab @JamesCleverly @paulscullymp @GilesWatling #BobStewart - celebrating 100 years of @RoyalAirForce pic.twitter.com/mwGH2y3jnv"
2018-07-15T14:45:50,⁦@PennyMordaunt⁩ ⁦@AndrewRosindell⁩ ⁦@paulscullymp⁩ ⁦@JamesCleverly⁩ ⁦@vickimichelle⁩ Bob Stewart and Sue Pollard. All together to celebrate  years of the ⁦@RoyalAirForce⁩ - a wonderful evening for a great cause...pic.twitter.com/Qhco0474IC
2018-07-13T15:31:22,I should’ve had a tin hat on - that would’ve foxed you!https://twitter.com/stockneil/status/1017785686727028736 …
2018-07-13T14:47:03,"Thank you ⁦@RoyalMarines⁩ for 48 incredible hours. Totally professional, intelligent soldiering - 32 weeks of gruelling training producing a unique, caring and frankly terrifying force. An honour to see 253 Kings Squad get their prized green berets - well done indeed!pic.twitter.com/obQ1gw6xRG"
2018-07-11T21:35:21,You certainly did! Lionhearts!https://twitter.com/england/status/1017151495979102209 …
2018-07-11T20:57:24,"Brilliant #WorldCup by #ENG 
What a fantastic effort by the boys and Gareth Southgate to reach this far 
Looking forward to Euro 2020!pic.twitter.com/zAjlMUuqrk"
2018-07-11T20:57:43,"I got to fifty before that happened and now, with glasses, I peed rerfectlyhttps://twitter.com/barnabyedwards/status/1017005199058194433 …"
