2018-04-30T09:22:42,Busy weekend. Usual rushing around Clacton on Friday - visit Council Offices. Met E of E Ambulance Servces. Attended A120 meeting in Colchester. Frinton High St to raise awareness of street furniture affecting the blind. Chelmsford in the evening discussing freedom of speech!
2018-04-27T20:43:50,Just left a meeting in Chelmsford with a superb bunch of Next Generation Conservatives. Young people wanting to make our country the very best it can be - for all! Really uplifting and positive experience #Conservatives
2018-04-27T20:36:48,"At A120 lunchtime event. MPs, County and Borough Councillors and the energetic George Kieffer, Haven Gateway Chairman - all pushing hard to get this vital link to our area upgraded. For far too long our infrastructure has been overlooked!pic.twitter.com/pqxH0WHYl6"
2018-04-27T20:29:03,"Met with Glenn Young, Head of Emergency Operations, East of England Ambulance Service this morning. We will work together to get the service the public need. He is a dedicated man!pic.twitter.com/MDrU8kxEO9"
2018-04-27T20:20:27,At the Walton on the Naze and District Sea Cadets Naval Parade last night. Cdr James Nesbit RN awarding achievements. Very smart community involvement and rewarding for those involved. Lt Gary Dodd CO deserves much praise. He gives those young people so much!pic.twitter.com/NqfsvLdnkX
2018-04-27T11:37:03,Great turnout today in Colchester for our business networking event @CllrKBentley @willquince @bernardjenkin @GilesWatlingpic.twitter.com/zeZX4eCI5H
2018-04-25T19:36:06,We should all be their friends #EndAnimalCrueltyhttps://twitter.com/rspca_official/status/982281507724251136 …
2018-04-25T19:30:41,Proud to have been a part of such an inspiring event. We in Tendring are punching well above our weight when it comes to the entrepreneurial spirit. Can’t wait to see the line up!https://twitter.com/clactongazette/status/989058821392912384 …
2018-04-25T08:12:21,.@GavinWilliamson: 'On #AnzacDay we remember the sacrifice &amp; courage of the men &amp; women from Australia &amp; New Zealand. Almost a century has passed since the end of the First World War &amp; Britain is proud to have served side-by-side with them in many conflicts over the last 100yrs.'pic.twitter.com/8ROnGol4Vp
2018-04-25T07:29:17,Cc me in if you would! Cheershttps://twitter.com/willquince/status/988903010184171520 …
2018-04-24T18:53:25,I’ll be there - so much to celebrate about #Clacton- great place to visit and live!https://twitter.com/paulhoneywood/status/988432130983292935 …
2018-04-24T11:57:04,"An incredible, overwhelming honour to be present at the unveiling of the #MillicentFawcett statue in Parliament Square. I shed a tear. We’ve come so far; but still have so far to go. #feminist #feminism #RepresentationMatters #ParliamentSquare #women #equality #suffrage #heropic.twitter.com/AkBKF6clEF – At Houses of Parliament"
2018-04-24T12:02:52,Proud to have my daughter Jemima with me to celebrate the #MillicentFawcett statue - my daughters can achieve anything they want to but there is still a long way to go. #feminism @JemimaWatlingpic.twitter.com/IZuT0C0UAs
2018-04-24T11:10:40,Courage calls to courage everywhere! Apt and inspiring!pic.twitter.com/tEuXAdhhJT
2018-04-24T11:08:32,"In Parliament Square with my daughter this morning to witness the unveiling of the Statue to Millicent Fawcett, the suffragist campaigner - a great step forward to proper equality! A sculpture by a woman honouring a woman!pic.twitter.com/tBUOJNdsv4"
2018-04-23T16:08:00,"In discussion with Imran Khan, possibly the next Prime Minister of Pakistan, on UK relationship and the corruption free democratic future of that beautiful country!pic.twitter.com/OTimQnV2lT"
2018-04-23T13:38:24,Out in St Osyth with the team knocking on doors - great response!  People here are gearing up for summer!pic.twitter.com/P74ccTvWwh
2018-04-23T12:58:25,Amazing first for the country - and it happened in #Clacton! Great day!https://twitter.com/tendring_dc/status/988030831494037509 …
2018-04-23T12:22:09,Congratulations to the Duke and Duchess of Cambridge! A boy!
2018-04-22T13:57:45,I agree - we need to encourage tourism and the hotels will return! It’s all about value to the community.https://twitter.com/bitzathisnthat/status/987976027585630208 …
2018-04-21T16:53:10,Proud to have this great event in my area. Have a safe and fun day everyone!https://twitter.com/rallytravel/status/987328726470987776 …
2018-04-21T16:52:19,Here’s to putting Tendring on the national map!https://twitter.com/stockneil/status/987330871064657921 …
2018-04-19T18:04:56,Don’t know why I didn’t tweet this ages ago. Went out supporting the excellent James Halden in Thurrock. Very positive on the doorstep - and I should think so too. His Health and Education knowledge is second to none - it should be! That’s his Council responsibility! Vote Halden!pic.twitter.com/CWoOWlNwOP
2018-04-19T15:44:24,"We cannot allow despotic regimes to use gas warfare! Especially against innocent men, women and children! The red line has been allowed to be crossed too many times. This last attack was horrific and criminal. Good people should not stand by and let evil succeed! @gregtherockhttps://twitter.com/gregtherock/status/986181452441235456 …"
2018-04-19T15:39:15,"Still on it! 23,000 patients deserve better - and they will get it!https://twitter.com/fisionchips/status/986911710127812608 …"
2018-04-19T15:38:02,A great pleasure!https://twitter.com/wcl_news/status/986879393313316864 …
2018-04-16T09:08:50,Is this the woman you breakfast with regularly?https://twitter.com/barnabyedwards/status/985450341079666688 …
2018-04-11T06:29:00,"Dad and I used to sit and watch old films. Sometimes he’d be surprised to see himself - he had a varied back catalogue, he couldn’t remember them all. Happy days! @Morris__Brighthttps://twitter.com/morris__bright/status/983843280742961153 …"
2018-04-09T09:06:24,"That means you have to start the race, run the course in time to see the winner over the line! In that case you will have to come first and present the prize to yourself... a challenge! Good luck! @HarwichRunnershttps://twitter.com/stockneil/status/982894607934611456 …"
2018-04-06T17:23:53,Herbie gets the wrong idea about a bird bath! #springmadnesspic.twitter.com/uVb5QValpA
2018-04-03T06:57:51,"Great news!
Ivory ban announced, please share!https://www.gov.uk/government/news/government-confirms-uk-ban-on-ivory-sales?utm_source=747c79eb-c460-466e-bcf5-2a759fcfb88c&amp;utm_medium=email&amp;utm_campaign=govuk-notifications&amp;utm_content=immediate …"
2018-04-03T06:48:17,An utterly brilliant short film. I  U!https://twitter.com/silentchildfilm/status/979802702233440256 …
2018-04-03T06:44:40,He certainly was amazing - and a gentleman. Much missed!https://twitter.com/thedebbiemcgee/status/980734848359944193 …
2018-04-01T15:42:04,A very happy Easter everybody!  pic.twitter.com/ziDkjkdy5z
2018-04-01T08:37:33,Brilliant idea! Take a look @CVSTendring @VTendring both of whom work hard to help the vulnerable in our community - thanks Maggie!https://twitter.com/maggiepasztor/status/979639417181818880 …
2018-03-30T13:11:56,.@sajidjavid has today set out a cross-government plan of action to significantly reduce the number of people sleeping rough as the Homelessness Reduction Act comes into force next week.pic.twitter.com/DJw1cPUtkX
2018-03-30T20:08:56,Excellent joint working.https://twitter.com/InspDeex/status/979398300460896256 …
2018-03-30T01:38:03,PRESS RELEASE - #Harwich Society visitor attractions open over Easter weekend https://www.facebook.com/notes/the-harwich-society/harwich-society-visitor-attractions-open-over-easter-weekend/2365127896846190/ …pic.twitter.com/5ssYYpnWo1
2018-03-30T19:36:42,Thanks Richard - keep in touch and all the very best for the future!https://twitter.com/richardholden21/status/979425237409435648 …
2018-03-30T19:32:45,Happy to support a cause to bring an end to extreme poverty. We must keep these issues in the public eye.  Never turn away!https://twitter.com/jon_date/status/979324531717365760 …
2018-03-30T09:31:39,"Thank you Giles, without the many years of dedication &amp; vision of just a few who invested, created, built &amp; now preserve it's importance, Frinton Summer Theatre has become an amazing Frinton tradition which is thankful for the continued support of all its patrons &amp; sponsors."
2018-03-29T16:53:34,Attended Age Uk reception. Important not to forget those who can’t get about. Check on your single elderly neighbours! Keep in touch!pic.twitter.com/loVpP3lMa6
2018-03-29T16:45:15,"Never mind the delays last week with people being left literally in the dark at Thorpe. Now the train is held up at Kirby X! Please @greateranglia get it sorted for us! I know we had a meeting last week, but don’t just go away &amp; forget us. We need reliability on this line!"
2018-03-29T13:14:07,One of the great survivors- proud to have been a longstanding part of this great British tradition! @FFrintonTheatre #Clactonhttps://twitter.com/ffrintontheatre/status/978651846129733634 …
2018-03-28T07:08:30,"All those years of campaigning by patients, residents, Councillors and MPs, (Yes, I include my predecessor, I campaigned with him) have finally paid off! Well done all!https://twitter.com/stockneil/status/978877893332865029 …"
2018-03-28T02:50:11,"Fantastic news! I had a meeting with @Jeremy_Hunt yesterday. We’re getting £14.7 million for #Clacton Hospital! The local community will benefit from development of an integrated outpatient facility, minor injury, diagnostics and primary care centre!pic.twitter.com/wKNcwquSGS"
2018-03-27T16:14:10,My question to the Foreign and Commonwealth Office. We must work to bring an end to illegal wildlife trade!pic.twitter.com/OYhBmltFGV
2018-03-24T08:44:50,A PPG meeting...https://twitter.com/gileswatling/status/972265115411275783 …
2018-03-10T12:44:33,I was asked about the growth of abuse on Social Media. Did some research. This from the NSPCC...pic.twitter.com/aonfjCfQTZ
2018-03-14T21:13:03,Quite extraordinary to watch... almost sad.https://twitter.com/mrharrycole/status/973906999573434368 …
2018-03-15T20:45:13,Sorry Labour - this is how it is!https://twitter.com/conservatives/status/974312504070373379 …
2018-03-23T17:48:44,"Out with the amazing Samantha Garvey, Chief Inspector of the RSPCA. We rescued a German Shepherd that was undernourished, had sores all over and fur falling out - a beautiful soul suffering a terrible life. Sam is a real hero who goes into distressing situations to save animals!pic.twitter.com/v39QwFSO62"
2018-03-23T17:36:02,Leafleting in St Paul’s today - what a day for getting the message out - Spring is in the air!pic.twitter.com/Y7I6tGIxuZ
2018-03-21T11:39:34,".@uklabour trolls shared a pic of partially deaf Tory MP @AlecShelbrooke. It was shared and retweeted thousands of times. They said he's ""lazy &amp; a disgrace"" when he was just leaning to a speaker to hear properly. 

Please share the truth far and wide.https://www.express.co.uk/news/uk/934410/Facebook-MP-sleeping-Alec-Shelbrooke-Commons-viral …"
2018-03-15T16:54:05,My take on the #freeschoolmeals debate!pic.twitter.com/pWOq7KifcT
2018-03-14T12:59:31,You couldn’t write this! @jeremycorbyn hits a new low as he attempts to politicise the Russian Nerve Agent Attack in Salisbury in the PM’s statement to the house.
2018-03-14T01:29:54,"Rita Tushingham is 76 today, Happy Birthday Rita pic.twitter.com/mgmuPUUuS5"
2018-03-14T15:13:20,#ParentkindPledge An overarching approach to parent/teacher relations! Good to support them! #Clactonpic.twitter.com/EUrFVGcgVv
2018-03-14T13:14:34,It has been!https://twitter.com/andrewpolitics/status/973897759928483842 …
2018-03-14T12:51:18,Breaking News: 23 Russian diplomats to be expelled from Britain amid probe into ex-spy's poisoninghttp://www.foxnews.com/world/2018/03/14/23-russian-diplomats-to-be-expelled-from-britain-amid-probe-into-ex-spys-poisoning.html …
2018-03-14T13:12:46,Electrifying performance- a real honour to witness! #Clactonhttps://twitter.com/mrharrycole/status/973903906920116224 …
2018-02-28T18:21:57,"Meet our newest trainees Poppy, Alfie and Harry. Sponsor one of our life changing guide dog puppies from just £1 a week."
2018-03-14T12:26:21,"Our proposals mean that once Universal Credit is fully rolled out, 50,000 more children will be eligible for free school meals than under the old system. #PMQspic.twitter.com/KPpLtoM6iJ"
2018-03-14T13:11:07,QED - !https://twitter.com/cchqpress/status/973897963981475840 …
2018-03-14T11:55:43,"All children have to be afforded - by parents or the taxpayer. We must focus resources to those most in need. 50,000 more children will receive free school meals as a result of last night’s vote. Labour as usual is trading in falsehood! #Clacton"
2018-03-11T16:37:18,"Origami done - but a long way to go to beat this dreadful disease.  Three new ground breaking drugs being made available to all women in England and Wales. More here: http//bit.ly/2EsEey7
@breastcancernow #iamsavinglivespic.twitter.com/c6R52Sfc1h"
2018-03-11T16:28:28,Mothering Sunday! Supporting @breastcancernow #iamsavinglives campaign. So many affected - so many to help. Find out more: http://bit.ly/2EsEey7 pic.twitter.com/eDhGd9ZuTY
2018-03-11T11:24:46,"Wow, Labour talking bollocks about education!!!! 

Surprise level = 0https://twitter.com/factcheck/status/965894977170665472 …"
2018-03-11T10:51:23,Quod erat demonstrandum - thanks!https://twitter.com/fredabhatti/status/972551635330306049 …
2018-03-10T12:47:07,...and this from Amnesty International. When interviewed by the DCMS Select Committee the platforms denied any responsibility. We need to put a health warning on all social media!pic.twitter.com/QrEtqjDDJj
2018-03-10T10:40:05,"I know @labourlewis, seen him at work, and you really shouldn’t be accusatory - he’s very bright! And nice... as far as I can tell.https://twitter.com/subutcher/status/972387336196644864 …"
2018-03-10T07:43:53,This demonstrates a total disconnect from gender equality! Extraordinary - words fail...http://metro.co.uk/2016/09/02/corbyn-wants-to-ban-sexist-after-work-drinks-for-quite-sexist-reason-6105449/ …
2018-03-10T06:21:46,Quite right too! The last Labour government took this country to the brink of bankruptcy. NHS spending is at an historic high despite “there being nothing left” by socialist failure... we cannot risk letting them get their hands on it again. It might not survive a Marxist regime.https://twitter.com/fredabhatti/status/972255656169410561 …
2018-03-10T06:15:23,"Again with the negative... predictable. That PPG is trying really hard, there are new measures being put in place to improve services. Too much info for here, so please write if you really want to know. Or is this just another keyboard warrior moment? ;)https://twitter.com/landroverrich/status/972280214469402626 …"
2018-03-10T00:17:21,Really positive meeting yesterday finding a positive way forward for our internationally lauded Health Servicepic.twitter.com/Fa90CpcVxT
2018-03-09T23:08:43,Thanks!https://twitter.com/fredabhatti/status/972246932134547456 …
2018-03-09T18:15:42,My Tory MP has another tack - carefully ignores anything caused by austerity hinting it’s not his fault because he’s a new MP. Then he brown noses his colleagues in the House and spends his time taking selfies with good causes. By doing nothing he is complicit. @GilesWatling
2018-03-08T17:28:21,"1st female MP to take her seat, 1st female Prime Minister, 2nd female Prime Minister. The @Conservatives have a proud tradition of women in parliament. We’d love you to be part of our future. #InternationalWomensDay
https://www.conservatives.com/askhertostand "
2018-03-09T21:16:40,Is that really you Bob? Nah - far too cute!https://twitter.com/robertlindsay/status/971763190743928832 …
2018-03-09T21:14:29,"Honeypot Lane near Wix today, 9th March - still impassable!pic.twitter.com/C076ciWV97"
2018-03-09T19:40:19,This is probably the best tweet ever! Please retweet at will! Thanks Su!https://twitter.com/subutcher/status/972174099555540992 …
2018-03-08T12:37:21,And live with!https://twitter.com/jamescleverly/status/971696859617120257 …
2018-03-08T12:35:52,A brilliant video demonstrating exactly what Tendring District Council is doing for you - Easy to watch and very informative! Take a look - the narration is positively Oscar winning! Our Corporate Plan 2016-2020 https://youtu.be/hGOUM-M38wY  via @YouTube
2018-03-08T10:35:57,Getting a taste of all things Cornish! This is something we can do from Tendring - I’m on to it! A Taste of Tendring - has a good ring...pic.twitter.com/yqQz9odMUY
2018-03-08T09:14:24,.@AmberRuddHR: On #IWD2018 we're launching a review into new laws and stronger powers to put safety and support for survivors at the heart of Government efforts to stamp out Domestic Abuse.pic.twitter.com/lcxhuTQMV5
2018-03-08T09:15:25,Dammit I should have put #IWD2018 -  Happy International Women’s Day!
2018-03-08T09:13:43,"To my wife, my two daughters, my three sisters and the entire sorority - Happy International Women’s Day!!"
2018-03-07T22:28:11,At last! You get what you deserve!https://twitter.com/morris__bright/status/971511763513593856 …
2018-03-07T19:27:53,"Thank you for your vote!  DCMS, to which Labour members go as well, was before breakfast this morning and I’m happy to still be in my office now... If you want to know what I do for the constituency please subscribe to my enewsletter! Please go to giles.watling.mp@parliament.ukhttps://twitter.com/landroverrich/status/971389585996513281 …"
2018-03-07T19:29:25,Brilliant - utterly brilliant!https://twitter.com/jamescleverly/status/971144907900538885 …
2018-03-07T19:22:15,"There are two main reasons people serve in parliament - 1, to work for the good of their constituency. 2, to work for the good of the country. That applies to all sides of the chamber and like many others I have hard working friends of many leanings..."
2018-03-07T10:29:45,With @MattHancock at the launch of the @DCMS #CultureisDigital report at the National gallery - getting digital and art combining to promote a future of cultural understanding - amazing!pic.twitter.com/NLnKZNfpqf
2018-03-06T15:52:28,Go guys go!https://twitter.com/thertf1839/status/971013895560269824 …
2018-03-05T08:40:15,Animal welfare and fairness to our fishing fleet!https://twitter.com/david_duguid/status/970286399705505792 …
2018-03-04T19:15:40,15th September 1747. David Garrick spoke this from the stage of the Lyceum Theatre. Written by Samuel Johnson. I’d love to have heard it!pic.twitter.com/S0SuyWj2wF
2018-03-03T15:24:45,It was always going to be a rough road. May is making it as smooth as possible. Great speech!https://twitter.com/ruthdavidsonmsp/status/969581481508114432 …
2018-03-02T16:34:23,Thank you for putting me in this very important loop Lis!https://twitter.com/lisbennison/status/969531965446742016 …
2018-03-01T22:07:14,Good to know our local District Council is on the case. Our officers are a dedicated cadre - always ready to put in that extra effort - whatever the weather! Well done TDC!https://twitter.com/tendring_dc/status/969114005699747841 …
2018-03-01T20:51:58,"Take great care out in this dreadful weather! Wear the right clothes - and please look out for those less fortunate! Rough sleeping is no joke, so please use the streetlink app or use http://streetlink.org.uk  to report the location of any rough sleepers you see. Help is available!"
2018-02-28T17:08:19,Great Britain viewed as the top US partner by both Republicans and Democrats.http://pewrsr.ch/2GQWi5R 
2018-02-28T20:09:51,Really good to see you back! Congratulations!https://twitter.com/jbrokenshire/status/968877019416158208 …
2018-02-28T16:17:25,Meeting the President and High Commissioner of Azad Kashmir. Hearing about the development of this fabulous region. As we leave the EU we need to expand our horizons!pic.twitter.com/CmEKhqRVJS
2018-02-28T16:11:29,A bit nippy for alfresco dining...pic.twitter.com/Mt89zRGGi5
2018-02-28T16:10:05,"I’m a great believer in good apprenticeships - those I met today found it fulfilling, leading to skills for life!pic.twitter.com/e9DagC4TFN"
2018-02-28T11:53:03,With Fay Ripley supporting Marie Curie nursing. They do such a vital job with such care and kindness. I can’t say how highly I regard these amazing people!pic.twitter.com/MDtkhbDOcr
2018-02-27T18:33:07,Ah the days of big hair!https://twitter.com/woodg31/status/968550828196941830 …
2018-02-27T18:31:05,"Just heard that Lewis Gilbert has died. He made 97 - fantastic! But I will miss his presence in the world, he championed my cause and was always supportive. A great director of some our finest quintessentially British films. @ElstreeStudios he’s with my dad now!"
2018-02-27T18:19:49,What a wonderful place - whatever the weather!https://twitter.com/ffrintontheatre/status/968532935992336384 …
2018-02-26T15:36:21,"Let me make this absolutely clear, I abhor cliches...  they’re my Achilles Heel!https://twitter.com/gjbic/status/968102593019957248 …"
2018-02-25T00:40:55,My boys and I on a freezing muddy walk on the Naze. We are so lucky to live in this wonderful place. Come to #Clacton - you’d be amazed at the great things we have to offer. Only 70 miles from London!pic.twitter.com/hOat1uC8dv
2018-02-25T00:35:22,Great meeting with Melanie Hammond and Russel Henry of the Citizens Advice Hub - I fully support the tremendous work they do throughout the community. They offered to help me and I them - together we can achieve great things. Thanks to you and your team!pic.twitter.com/t42LZAWTQB
2018-02-23T20:39:32,10 TC at Tendring District Council’s Pride of Tendring Awards - celebrating those who really make a positive difference! Well done all!!pic.twitter.com/7TjBJzmR3W
2018-02-23T20:33:30,Transforming Lives for Good - a school to really help and engage young people. Proud to have been asked along! Looking forward to getting involved!https://twitter.com/tendringtlg/status/967087907361214466 …
2018-02-20T14:36:25,Pleased to help prevent cruel forms of dog training! #apetisforlifepic.twitter.com/V2lgonSHtk
2018-02-06T08:26:08,"100 years after *some* women were granted the vote, we are still fighting for equality. Me in the @Telegraph #100years #vote100 #Suffragette100http://www.telegraph.co.uk/politics/2018/02/05/women-still-fight-equality-100-years-getting-vote/ …"
2018-02-06T09:45:06,One hundred years ago today some women won the right to vote - these are a few of their stories #Vote100pic.twitter.com/9TSLXj2Ead
2018-02-06T09:30:03,This is the year to reform social care. I’m uniting with @AlzheimersSoc to #FixDementiaCarepic.twitter.com/9FQspO6XZC
2018-02-06T10:34:59,"Brilliant, just brilliant!https://twitter.com/shondarhimes/status/959103541636825089 …"
2018-02-04T21:57:30,Lovely to see my mate @RealSuPollard in the audience at @dancingonice tonight! Will she be next perhaps? Don’t ask me! #Strictly who knows?pic.twitter.com/dGAKDhfh84
2018-02-03T17:06:30,"Great to hear directly from the superb, hardworking women and men of the Fleet Air Arm - they do us proud! Thank you for the eye opening tour Cap’n Dan @RNASCuldrosepic.twitter.com/cfPtXNfB5Z"
2018-02-01T11:27:27,Nigel - what happened?! A great man who’s service to Tendring District Council will not be forgotten - happy retirement!https://twitter.com/jamesdwan/status/958734544575885313 …
2018-01-22T18:20:00,"Thank you @JamesDuddridge, @ZacGoldsmith, @GilesWatling and @kitmalthouse for signing the @HolocaustUK Book of Commitment in Parliament today!"
2018-01-29T11:55:00,"Delighted to announce another A120 Networking Event on Friday 2nd March in #Colchester co-hosted by our MP supporters @willquince @bernardjenkin &amp; @GilesWatling open to all businesses from #Colchester, #Harwich, #Tendring and #Clacton. Please get in touch if you'd like to attend.pic.twitter.com/G40sX4NDzw"
2018-01-31T12:01:19,There’s a robin in the Chamber - thought it worth a tweet...
2018-01-29T18:38:43,Supporting my neighbour @willquince and the Colchester Ambassadors working hard to bring investment to this fast growing area!pic.twitter.com/6r5YraDqtG
2018-01-15T11:48:53,"‘Taken out of context’ . once again the ‘get out of jail’ card for those whose have been caught out on social media. Dreadful language and ill advised application of it. Don’t excuse it, you said it, you meant it. Now...disappear. 
#ukipgirlfriend"
2018-01-15T09:31:13,"""I want people to use #socialmedia to engage in politics, but we need to crack down on those who bully and troll,"" new Deputy Chairman of @Conservatives and #Braintree MP @JamesCleverly tells BBC Essex as he aims to increase the party's popularity with younger voters.pic.twitter.com/w4gA2hMPV7"
2018-01-15T13:41:32,The EU protocol is weaker than what is being proposed by Michael Gove. Caroline Lucas is effectively trying to weaken animal sentience lawhttps://order-order.com/2018/01/15/caroline-lucas-tries-to-weaken-animal-sentience-law/ …
2018-01-08T07:23:20,This is brilliant - you’d never run out of runway. No V1 or V2. No last abort line. If the aircraft fails it’d just go round and round...https://twitter.com/eddiehughes4wn/status/950254574245498880 …
2018-01-01T10:50:50,"We got back to three well behaved dogs who managed to contain themselves, but I know your pain! May 2018 just get better for you - and the poorly dog! (Your lovely kitchen floor...)https://twitter.com/gjbic/status/947739011703074816 …"
2018-01-01T10:46:38,Me too Buffy! https://twitter.com/buffywatling/status/947583327535616000 …
