2018-07-11T10:44:52,Happy to support School Diversity Week! Organised by the charity @JustLikeUsUK⁩ - its a great way to champion LGBT equality and challenge prejudice!pic.twitter.com/SMoauwH9w7
2018-07-09T21:07:23,"How fantastic! Real life always beats drama... A whole new world opens up!
Congratulations.https://twitter.com/iancrdavidson/status/1016050021022740481 …"
2018-07-09T08:06:52,"Thank you to Juliet and Adrian Ryan for coming to see me about the appalling occurrences of racism. Wherever it rears its ugly head we must stamp it out. What happened to them over a lifetime and more recently to their son, should never happen again. Celebrate diversity!pic.twitter.com/riS3gSRhUB"
2018-07-06T10:35:57,Thank you to @GilesWatling for supporting #PetTheftReform. We really appreciate you taking the time to meet the @SAMPAuk_ team and for being a positive voice in the  #PetTheftDebatepic.twitter.com/Aszso5pUm5
2018-07-03T18:41:25,Tonight we have a meeting of our full council - fitting for National Democracy Week #TalkDemocracypic.twitter.com/NYsUX3KNZt
2018-07-01T10:27:30,My quarters for the past few days. Taking training with the military! Thank you to ⁦@RoyalNavy⁩ ⁦@RoyalAirForce⁩ ⁦@BritishArmy⁩ I think I can find my way around parts of Wiltshire now...pic.twitter.com/fJgcuTJGBn
2018-06-30T18:52:38,Thank you to @guidedogs for showing me how challenging it is for visually impaired people to navigate street clutter. Thoughtful urban design can make such a huge difference.pic.twitter.com/slCm8ydMlm
2018-06-26T11:48:40,Thanks to ⁦@damienmooremp⁩ and ⁦@GilesWatling⁩ for supporting South Gloucestershire business in Parliament todaypic.twitter.com/4bwBN7PqMF
2018-06-25T19:47:55,"Really good to catch up with @essexpeasant Guy Smith this evening. So many challenges for farming post Brexit, but we must make sure that we get the deals we need to be a world leader in agriculture! Migrant workers - or lack thereof - is a big issue. That’s just for starters!https://twitter.com/nfutweets/status/1011322422623162369 …"
2018-06-25T12:08:54,"With the amazingly brave Suzannah Roberts of Ladbrokes, Frinton. She suffered and is giving back! She and the staff and customers raised £1,400, which was topped up to £2,000 by Ladbrokes for Breast Cancer Care. Well done all - great community work!pic.twitter.com/xq0x576Za7"
2018-06-22T20:38:41,Visited Jackie Pobjoy and her team at the Walton Pre School. The children voted on their favourite shapes and favourite tiny beasties. The Rectangle and the Bee won! Getting three to five year old kids to engage in a democratic process. Fantastic!pic.twitter.com/rPQf24u6jY
2018-06-22T20:32:40,#Clacton gets its mail!pic.twitter.com/P4yZP0Cgdj
2018-06-22T20:30:55,Beginning of another busy old Friday. Out early with Royal Mail manager Michael Hogg &amp; local postie Gerry Hibbard. He showed me sorting and delivery. These people really serve the community and care - they deliver letters too!pic.twitter.com/7v6lzZeuRS
2018-06-22T17:09:20,Good to meet you Steve - let’s work together to help our police help us! Thanks for coming! #ProtectTheProtectorshttps://twitter.com/essexfedchair/status/1010140559564996608 …
2018-06-22T17:07:31,So do I...https://twitter.com/tanyatanyamf/status/1009917359287685122 …
2018-06-21T16:55:20,A shot I took - aren’t our soldiers terrific!pic.twitter.com/Xkaw8YfI3P
2018-06-21T16:50:39,A pleasure to help! I hope you find him - and soon. It’s heartbreaking to lose such a friend.https://twitter.com/debbie18124912/status/1009839473990033408 …
2018-06-21T09:13:54,Very grateful to @GilesWatling MP for highlighting our work to stop #wildlifecybercrime in local presshttp://www.halsteadgazette.co.uk/news/north_essex_news/16288046.mp-urges-crackdown-over-illegal-wildlife-trade/ …
2018-06-21T16:38:24,"With ⁦@ZacGoldsmith⁩, Sir Roger Gale and many others in Parliament Square getting the message out about the cruel practice of mass live animal transport.pic.twitter.com/UU3a0AumXf"
2018-06-21T16:25:32,"The summer reading challenge - such a terrific idea to encourage children to engage with literature. Free to take part - games to play! What’s not to like?! Nearly 850,000 books read so far. I’m getting some for my local library. Have a great summer with a book!pic.twitter.com/uwxLhWW69o"
2018-06-21T13:27:09,Out with ⁦@HelpforHeroes⁩ today on their amazing campaign. I’m really #ProudTosupportpic.twitter.com/EdqPquuYnv
2018-06-19T13:00:18,Good to appear before @CommonsCMS at @UKParliament today to discuss @ace_national support for social impact of participation in arts and culture with MPs including @DamianCollins @JulieElliottMP @chris_matheson @pow_rebecca @GilesWatling @IanCLucas @Simonhartmp @JoStevensLabour
2018-06-19T16:19:14,"Am gobsmacked to hear Labour transport spokesman say they would delay all duelling of the A120 &amp; send it back to drawing board - delivering A120 upgrade is key to unlocking A12 upgrades.
Qns from @JamesCleverly @bernardjenkin @willquince @patel4witham @GilesWatling"
2018-06-18T16:22:23,"Today is the start of #EqualiTeas, celebrating 90 years since the passing of the Representation of the People (Equal Franchise) Act.pic.twitter.com/kKRL1ot87O"
2018-06-18T17:31:51,We are ALL supportive of the legislation to make #Upskirting a criminal offence. This has my full support and this is a view shared by all my colleagues. Glad to see legislation being brought forward by the government.pic.twitter.com/PPQ9T4s4op
2018-06-18T20:19:21,"Couldn’t agree more! Heinous, callous crimes of this nature need to have greater penalties! Anyone who profits out of misery is beyond the pale!https://twitter.com/sampauk_/status/1008791827225497600 …"
2018-06-17T22:47:08,Happy Fathers Day @GilesWatling! Thank you for making life a fun adventure pic.twitter.com/TYH9t7QD0M
2018-06-16T08:42:48,"All sexual activity depends on consent. Upskirting by its very nature denies consent, so therefore is sexual assault and is criminal - or should be!"
2018-06-15T16:47:32,‘I've written to the Prime Minister asking that government time be made to allow the Voyeurism (Offences) Bill to have its Second Reading. Upskirting is a hideous invasion of privacy - it's right that we take action now.’ - @neill_bob https://www.facebook.com/325431457911993/posts/476180689503735/ … #Upskirting
2018-06-12T13:54:44,"⁦@vickyford⁩ is hosting a wonderful #EqualiTeas event on 15th July in Oakland’s Park, Chelmsford to celebrate 100 year’s since women got the vote! Take a look at the invitation here and get there if you can - should be fun!pic.twitter.com/3DdMETKSRL"
2018-06-09T16:34:55,Amazing day! Saw the Queen celebrate her official birthday - as a country we do this so well. Our soldiers are wonderful! #proudto beBritish #Clactonpic.twitter.com/Y11yp25RDr
2018-06-09T12:14:40,"And many flags - right up your street!
Happy Birthday Ma’am!https://twitter.com/andrewrosindell/status/1005382383820996608 …"
2018-06-08T16:10:33,"Out with Siobhan Meade, Community Liaison Officer for Guide Dogs for the Blind, demonstrating to local shopkeepers and business owners the dangers of badly placed A boards... We need to work towards a greater understanding of these issues. ⁦@sibbymeade⁩pic.twitter.com/GThIRfIEtM"
2018-06-07T22:26:12,"I got this - amazing, our postal services go above and beyond! Congratulations!
The sender will get a reply in the next day or two...pic.twitter.com/rfpToh9XNA"
2018-06-06T19:44:34,Great performance at our Summer Party from @niluferyanya!pic.twitter.com/JEws9X4z81
2018-06-07T08:13:19,Attended the 10th anniversary celebrations of UK Music with Matt Hancock and Tom Watson demonstrating cross party support for this vital cultural offer! ⁦@UK_Music⁩ getting our music together!pic.twitter.com/6O2ROzoKfW
2018-06-07T08:07:03,"Cancer affects virtually every family in the country. 1 in 2 of us will suffer from it in one way or another, so that is why I am especially happy to support ⁦@CancerResearch⁩ - so much has been done - so much more to do!pic.twitter.com/Me5N60LOR4"
2018-06-06T07:40:28,https://www.careappointments.co.uk/care-news/scotland/item/44312-mp-calls-for-review-into-diagnosis-and-treatment-of-digeorge-syndrome …
2018-06-06T08:25:02,It’s festival season! So be aware of the CO dangers. Keep BBQs out of enclosed spaces - especially tents. They can kill even if they look out. Take care in caravans and boats too! Keep ventilated! #campCOsafe #Clactonpic.twitter.com/tdnDJDcVY0
2018-06-04T19:05:58,A subject close to my heart - no thanks needed!https://twitter.com/hsiukorg/status/1003667973154988032 …
2018-06-04T16:40:32,Attending @HSIUKorg's banning fur imports debate in Westminster Hall. Excellent cross-party contributions from @ZacGoldsmith @andreajenkyns @KerryMP @HenrySmithUK @heidiallen75 @GilesWatling @AlexChalkChelt @DanielZeichner @ConservativeAWF's #RogerGale @meaglemp #FurFreeBritainpic.twitter.com/YsIkQe3OFo
2018-06-04T09:47:51,"We're at #Weeley this morning starting a new era.

It's what we do.

The Early Intervention Vehicle will help hundreds of patients reduce the likelihood of needing 999 again. And it is all down to #teamwork.

#patientcare #collaboration
@GilesWatling @EEAST_SLMWeS @EEAST_ACLpic.twitter.com/1lnpsBm1zJ"
2018-06-04T13:16:14,A pleasure to be at the launch of the new Early Intervention Vehicle initiative in Weeley today. Taking pressure off the full double staffed ambulances. Quicker response and greater coverage! Superb people! @EEAST_EOCs @EastEnglandAmbpic.twitter.com/xioueq08NR
2018-06-04T12:57:50,Happy memories for us all!https://twitter.com/gjbic/status/1003603363341225984 …
2018-06-04T10:05:04,Thank you @EEAST_SLMWeS for asking me to be a part of this very important event. Great to meet the dedicated teams who are looking after us in North Essex! Early intervention vehicles will become a vital part of our Ambulance offer! #Clactonhttps://twitter.com/eeast_slmwes/status/1003572622964256769 …
2018-06-02T10:05:35,"Went to support Cadow, a joyous atmosphere created for adults with learning difficulties. These volunteers give so much, well done Chris Simons and team! Your clients are lucky to have you!pic.twitter.com/oUZlzLLJou"
2018-06-02T09:54:51,"Opened the Summer Fayre for the Tendring Specialist Stroke Services this morning. A team of dedicated volunteers help people to lead a fulfilled life after a stroke. They fundraise and are a fun part of the community! Support them at 85 Frinton Road, Holland-on-Sea! Great people!pic.twitter.com/TlIZW2AN9B"
2018-06-01T17:03:52,"We’ve just remembered! Herbert is two today! (And he still hasn’t cracked how to pee on three legs).
Happy Birthday Herbie!pic.twitter.com/ZqDPJJNaek"
2018-05-28T07:26:01,"'Sonia Friedman told me that if these new lighting regulations were brought into force, her smash hit @HPPlayLDN would have to close – and that is just one of many.'
Giles Watling: EU lighting regulation will put UK hits such as Harry Potter at risk http://bit.ly/2wXq88k pic.twitter.com/ufimvfwhtJ"
2018-05-27T18:09:45,With enthusiastic cyclists on the front at Holland on Sea. Cycling Awareness Day! Get out of the car &amp; on your bike! Good for the heart and lungs - no pollution and sharing great company. What’s not to like? Promoting the development of a seafront cycle path! Great place to live!pic.twitter.com/JM3LVacEHe
2018-05-27T18:03:35,Buying sweet peas and cucumber plants from the excellent Dave Morgan today - he and his wife Lin collect and drive for Multiple Sclerosis - great people trying to beat a terrible disease! Well done! #Clactonpic.twitter.com/A1PeXw8WTC
2018-05-26T17:48:16,Wow! What a recovery !  Good work.
2018-05-26T18:46:38,"Not really me alone. I went in with the RSPCA. In the end three dogs were rescued from that premises. All well now. There was also a human tragedy in play which has now been dealt with. Can’t say any more, but it’s so good to see people, and animals, take a turn for the better!https://twitter.com/thorpelynden/status/1000433449033977856 …"
2018-05-26T15:44:05,One further update. Tee as she was when we found her - and eight weeks later with some TLC! @RSPCA_officialpic.twitter.com/xE3KpSLyxk
2018-05-25T10:54:47,Visiting @BrightLido today ahead of official opening Monday. Fantastic effort by Town Council and local volunteers - looks amazing!pic.twitter.com/AObi9LtDxW
2018-05-25T16:21:22,Out with Samaritan volunteers this morning in #Clacton. A devoted group who really save lives! Not many can say that! They’re keen to point out that they are here to listen - a problem shared...pic.twitter.com/pyTYQnRkif
2018-05-11T14:48:18,"#SaveStageLighting forum this morning: showing the difference between focusable, tailored fixtures and general lightingpic.twitter.com/XoI9KXZqsP"
2018-04-30T21:56:50,"7 days to save all theatre, concert and event lighting from EU regs. #savestagelighting read my guardian letter herehttps://www.theguardian.com/tv-and-radio/2018/apr/30/eu-rules-mean-itll-be-lights-out-for-acts-like-beyonce …"
2018-04-28T15:33:00,We're lighting up the Coliseum today to spread the word about #SaveStageLighting  - Please join us and sign the petition to protect the future of the entertainment industrypic.twitter.com/bCVGVwBYw2
2018-04-28T18:37:46,We are supporting the #SaveStageLighting campaign against new EU regulations which will severely impact our ability to light our shows. Theatres and opera houses in the UK and Europe are showing their support by lighting up their fly towers - LightUp! to #SaveStageLightingpic.twitter.com/mVgMwFtrOu
2018-05-25T16:05:50,"I met Tee again today. She is now a fine, fit dog who is going to her forever home tomorrow. A million miles from the poor creature who was close to death when we rescued her last month. She now has a future thanks to the amazing Sam Garvey of the @RSPCA_official #dogsforlifepic.twitter.com/p7MjEmBIeR"
2018-05-23T06:20:01,"EU lighting regulation will put UK hits such as Harry Potter at risk, says @GilesWatling @SaveLighting http://bit.ly/2wXq88k pic.twitter.com/f0lOYXmYVp"
2018-05-24T14:25:05,Some of the bravest people I know are a part of this group - they shouldn’t need to be brave! Acceptance goes a long way towards justice!https://twitter.com/10downingstreet/status/999595714333302785 …
2018-05-24T14:22:47,"So much good work going on - Britain is great at this, but we have to do better!https://twitter.com/ifawwestminster/status/999630016005771264 …"
2018-05-23T15:40:56,"Dog theft for breeding is a terrible crime. Cruel to the dogs and cruel to the owners who have no idea what is happening to their beloved pets. Big issue in my constituency and there should be serious penalties for these thoughtless, money grabbing criminals!https://twitter.com/waterhousepat/status/998881640175808512 …"
2018-05-23T15:23:24,"My fight against LED lighting being foist upon our theatres! Including Frinton Summer Theatre, The Princes and Westcliff of Clacton. I will continue to press the Government on this. @FFrintonTheatre @SFP_London @SaveLighting @TheStagepic.twitter.com/AoUFg6bqE8"
2018-05-23T10:56:30,I watched my mother destroyed by this terrible disease. Alzheimer’s carers have a very difficult time - they need our help! That’s why I am pleased to support @alzheimerssoc campaign today #fixdementiacare #DAW2018pic.twitter.com/eUPnj4SOSg
2018-05-23T07:01:24,"Interesting morning taking evidence in the DCMS select committee from @tristanharris on internet companies controlling our lives. He says they have our data and can influence our decisions, both commercial and political - frightening!"
2018-05-22T15:13:16,Brilliant news! Got this from @mhclg - the Coastal Revival Fund is looking for bids to  help at risk Coastal Heritage sites be put back into economic use. I am writing to @Tendring_DC today to urge them to bid for our Sunshine Coast! #Clactonpic.twitter.com/dOoivNQUpO
2018-05-22T14:38:52,Great news for British Theatre! After a pleasingly short campaign I’ve managed to get assurance from the Dept of Culture Media &amp; Sports that they will resist EU regulations imposing unworkable LED on British Theatre @TheStage @SFP_London #savetheatrelighting @theRTF1839pic.twitter.com/smrA9AZBtt
2018-05-22T11:47:12,.@tristanharris says Mark Zuckerberg @facebook should appear before @CommonsCMS 'From the 2016 election and the Brexit campaign it's clear that there was a psychological attack on two countries. It is justified that Mark Zuckerberg appears before you' @DamianCollins @GilesWatlinghttps://twitter.com/CommonsCMS/status/998852877757091840 …
2018-05-21T16:46:00,A real pleasure to support #LucysLaw - we need to improve animal welfare across the board!https://twitter.com/kc_political/status/998599709357957120 …
2018-05-19T04:18:32,"@GilesWatling @FrintonLitFest @caxtonbooks @CllrBucke am not surprised - with your unique MC skills, an utterly enjoyable evening. Memorable Answer #Order being the name of John Bercow's Cat..https://twitter.com/GilesWatling/status/997623508946571264 …"
2018-05-18T23:42:34,My pleasure! Completely banjaxed myself...https://twitter.com/ffrintontheatre/status/997588487326126080 …
2018-05-17T16:29:11,"I’ve been in Bulgaria meeting EU and Western Balkan leaders, including @EmmanuelMacron and Chancellor Merkel. Next year the UK leaves the EU, but we are not leaving Europe. We’ll continue to work with our allies to protect our collective security and champion our shared values.pic.twitter.com/fpJUszIPok"
2018-05-16T09:24:26,"Happy Birthday Roy Hudd: Custodian of the nation's Music Hall, comedy's friend, &amp; 1 of the nicest blokes in the biz.pic.twitter.com/kuus4KE93P"
2018-05-17T04:41:34,Great times indeed!https://twitter.com/markyb65/status/996879408345513984 …
2018-05-16T11:31:34,Watching PMQs on TV while shoving a cheese sandwich down. Good to see @GilesWatling repeatedly leaping to his feet with eternal and unbounded optimism! Good luck Giles!
2018-05-16T12:19:49,"First steps being taken with Victoria Atkins, Home Office Minister, to introduce regulation of discriminatory ‘mosquito’ devices! They harm children, babies animals and young people generally!pic.twitter.com/nE2pexYVe8"
2018-05-16T11:37:20,Thanks Neil! Got there in the end... enjoy the sandwich!https://twitter.com/stockneil/status/996714774007304193 …
2018-05-16T07:45:12,A beautiful lady in her beautiful garden!https://twitter.com/bethchattogdns/status/996321432966754304 …
2018-05-15T21:12:56,"A great friend, good actor and a good man died today - RIP Peter Byrne...pic.twitter.com/KRCUuci675"
2018-05-15T17:41:45,"Fellow MP @AndrewRosindell and the fantastic @Madabouttheatre company join me in Holland on Sea for Friday night fish and chips - great speech Andrew, thanks!pic.twitter.com/WoqN8f7ehY"
2018-05-15T16:14:46,Met with Robert Morgan of @EastEnglandAmb discussing a really positive way forward to improve our much valued service. More news soon!pic.twitter.com/tcPl5hDsdY
2018-05-15T12:18:02,Fly on the wall at yesterday’s team meeting!pic.twitter.com/EmiTM9cwmv
2018-05-15T12:16:31,Where was this? You must let me know so that we can meet up!https://twitter.com/gjbic/status/996292598334672896 …
2018-05-15T12:16:19,A great loss to horticulture - a visionary who gave so much to our area and the world. You are nearer god’s heart in a garden than anywhere else on earth!https://twitter.com/iancrdavidson/status/996089341834334211 …
2018-05-13T21:00:20,"Wonderful to have the amazing @AndrewRosindell at our #Clacton gathering. Great speech thank you - and thank you for brining your mum Eileen, she was great company!"
2018-05-11T16:11:35,Thank you! Now we should get some serious action over bad banking practice - that debate had cross party support.https://twitter.com/julia04352962/status/994871261896630272 …
2018-05-10T11:19:10,She is a great lady and wonderful to be with. A shimmering effervescence of life. I hope she and Scott have many happy days ahead. Sorry to swear but #Alzheimers is a bastard disease that hits so many...https://twitter.com/morris__bright/status/994526005825036288 …
2018-05-10T03:40:57,"Well - Millicent is something to be proud of and on a personal level, I think my girls are too! Thanks!https://twitter.com/krb981/status/994333545643601923 …"
2018-05-10T03:39:19,Enjoy - it’s a real inspiration!https://twitter.com/edwardgabell/status/994349543377506304 …
2018-05-09T16:15:28,My daughters came to visit me yesterday. We went to see the new Millicent Fawcett statue in Parliament Square!pic.twitter.com/pnIam55F1v
2018-05-09T15:56:40,Great first meeting of A120 MP Working Group today in Westminster. Plenty discussed and much work to get on with @willquince @JamesCleverly @GilesWatling @bernardjenkin @patel4witham @PriskMark @jc4southsuffolk @KemiBadenochpic.twitter.com/jc0DMSQ1x8
2018-05-09T18:37:11,"Cheers Rob! It was great to meet you, Jenny and the team!https://twitter.com/rjhdouble/status/994271453704065027 …"
2018-05-09T17:13:47,It was a fun interview - 25 mins long. Now they’re going to edit it down to around 3 mins - good luck with that! https://twitter.com/corepoliticstv/status/994209215525859330 …
2018-05-09T16:40:48,As I said - A120 a priority!https://twitter.com/the_a120/status/994244772402487296 …
2018-05-09T16:37:15,Hosted a reception to promote better rail connections for #Clacton. The work goes on...pic.twitter.com/gKp5BagiZo
2018-05-09T16:35:17,Went to yet another meeting today pushing hard for the A120 upgrade! The Clacton constituency will really benefit from this long overdue improvement! #Clactonpic.twitter.com/cWJNhHMCCc
2018-05-09T16:32:59,With Tendring Reuse and Employment Enterprise. Mark Penn and his team are a really positive story about Phoenix like rebuilding and community service! Well done all - we need more people like you!pic.twitter.com/Pau1vMDgGl
2018-05-09T16:29:03,With http://londonbustheatre.co.uk  - a fantastic team putting Tendring on the map! Big lottery fund putting money into #Clactonpic.twitter.com/2aXOLPs2pu
2018-05-09T16:17:08,"18th February 1969 - I turned 16, Hendrix turned on at the @RoyalAlbertHallpic.twitter.com/CP8bFwB2d9"
2018-05-09T16:09:59,Went to an early bird meeting @RoyalAlbertHall. She is going to be 150 soon. I was pleased to hear of great plans they have for extending the cultural reach far beyond the metropolis. Good on ‘em!pic.twitter.com/8hFE3hR3ZA
2018-05-09T16:05:47,Doing a “Meet the MP” interview for @CorePoliticsTV today - great fun and quite probing. They asked me what the naughtiest thing I’ve ever done was. Me? Naughty? Never...pic.twitter.com/FOCfOkH67D
2018-05-06T10:29:32,"Our dear Vice-President, Dame Maggie Smith presenting at the Acting for Others - Golden Bucket Awards 
#GoldenBucketAwards #DameMaggieSmithpic.twitter.com/ksZ5Ftd8zj"
2018-05-06T17:20:00,"An answer: Unemployment at 43yr low, disposable income at record high, income inequality near 30yr low - and Labour in grip of a hard-left clique against whom Jewish leaders recently had to protest outside parliament. Puzzle is why Labour vote held up.https://twitter.com/theeconomist/status/993169835336130560 …"
2018-05-06T18:41:26,Went to see ‘Chess’ at the Coliseum yesterday. @theRTF1839  supporters @mrmichaelball and @cassidyjanson nailed it - as did the rest of the cast. Great show only on for another few weeks - hurry!
2018-05-06T11:37:47,Great shot! And I’m delighted to see the very important louvred doors! Hope it’s going well - have fun!https://twitter.com/edwardsnicki/status/992664633512288256 …
2018-05-04T15:51:20,It was a pleasure to meet you all - you’re doing a great job for the residents of Holland (the very British one...)https://twitter.com/verityruth/status/992378006051131392 …
2018-05-05T11:17:18,Fourth time in a row now. Not a great delay but still a delay. On the 11.53 from Manningtree into Liverpool St. Apparently this time it’s ‘platform issues’ at Ipswich. What’s going on @greateranglia ?
2018-05-03T12:39:03,Of course you were!https://twitter.com/stockneil/status/991898237060567040 …
2018-05-02T21:28:37,"Nationalisation? Give me a break - I used to tour the country on British Rail. Over staffed, poor service, v expensive, byword for ineffiency and curly sandwiches. What we’ve got is far from perfect but it is light years ahead of the nationalised service! Under 40s won’t rememberhttps://twitter.com/jjjoyce2005/status/991763600741208070 …"
2018-05-02T19:36:08,This could be a domino effect - plus vital data disappearing!https://twitter.com/damiancollins/status/991757217895534597 …
2018-05-02T19:34:39,I know you have great plans @greateranglia but this is the third time in a row we’ve had delays! This time due to a faulty speed restriction board! On the 20.18 from Liverpool St.
2018-05-01T21:47:04,"We shouldn’t have to keep saying this, but some just don’t get the message...https://twitter.com/conservatives/status/974312504070373379 …"
2018-05-01T10:49:18,Fly on the wall at yesterday’s team meeting!pic.twitter.com/pSPJBX44Rx
2018-04-30T14:28:28,Looks like a dreadful boy band!https://twitter.com/whybrowsurveyo2/status/990922319253200896 …
2018-04-30T09:33:03,"Sunday am catch up with emails, then three hour walk with dogs in rain, via pub in Great Holland. Never off duty - picked up casework there! Great stuff!"
2018-04-30T09:30:27,Saturday went to Unite Union meet and greet in Jaywick. Made welcome by Dan Casey - Labour through and through but a good guy! Citizens Advice was there - we offered joint assistance to people with issues. Saw Mad About’s ‘Right up your Street’ - excellent community theatre! 
